,post_id,subreddit,title,text,score,num_comments,created_utc,post_url,comments,image_urls,over_18
0,10oofje,BestofRedditorUpdates,Girl asks for help from reddit regarding being severely cyber-bullied,"**I am not OOP. OOP was** u/Fe_and_WINe. She posted in r/AskReddit 11 years ago. She has since deleted her account, so I hope she's doing ok and has moved on to wonderful things.

Because of the subject matter, your fact to cover up spoilers is serious in nature. In 2019, approximately 37% of kids aged 12 to 17 reported being victims of cyber bullying. That increases to 50% of students a part of the LGBTQ+ community. Here are two resources if you (or someone you know) has been a victim of cyber bulling: [Source 1](https://childmind.org/article/help-kids-deal-cyberbullying/), [Source 2](https://www.stopbullying.gov/)

**Trigger Warning:** >!bullying, threats of assault, threats of sexual assault, depression, mentions of suicide, homophobia, encouragement of suicide!<

**Mood Spoiler:** >!Action is taken (eventually) but still frustrating!<

**Original** [Post](https://www.reddit.com/r/AskReddit/comments/qvgi5/the_cyber_bullying_has_gotten_to_the_point_where/)**: March 13, 2012**

**Title:** The cyber bullying has gotten to the point where the school will not take any action unless I kill myself. Reddit- how do I get my story out and make this stop?

I am not asking for therapy, but help in gaining momentum.

Since the beginning of the school year, I have been harassed both in-person and online by the school's bully. It is hard to use the word because almost everyone knows and loves him. I tried not to let it get to me, until it escalated.

Go kill yourself. No one would care if you died. Why aren't you dead yet? This was said to me multiple times online, and in the middle of class. As a teenager dealing with depression and suicidal thoughts, I could not laugh this off. I went straight to the office and demanded to see a vice principal. I was sobbing uncontrollably and visibly a danger to myself, but they just sat me down and had me fill out a form. I called my Dad, who cancelled his flight out-of-town to come be with me. He was furious that he was not called in a situation like this. We had a conference with the vice principal, and we were told there would be consequences if it happened again.

It has been months. Multiple people have gone to the office with complaints about his bullying, and absolutely nothing has been done. Not so much as a detention. He is now attacking the leader of our school's GSA, members, and myself through twitter. Curiosity got the best of me, and I decided that I needed to go through his history to get hard evidence. Here are a few gems I found- some submitted by other people. There are actually over 20 screen shots.

Life has its ups, and you have the Downs. Please do us a favor, and fucking drown -- A poem dedicated to Sarah.

I have AP Lit in the morning. Sarah, if you say a single word, you are getting choked (I am the only person in the class who will participate in discussions without being forced).

I was to roofie Sarah

Sarah has a boyfriend and I'm still single? Time to die

Sarah for biggest slut. Go die

It is hard enough for me to want to be on this planet, and people are taking time out of their day to wish that I would die. I think this has passed what the school can do. They lost my faith when they didn't help everyone else who begged for some sort of relief after me. I live in Anne Arundel County. How can I get my story (and the others') out there so that we can see some real change before it is too late?

TL;DR: The bullying isn't worthy of school attention unless I die.

Edit: It's not just me. I have screen shots of him saying things about a TON of people who I am sure have no idea it exists.

Going to bed for tonight! I will NOT let him stress me out to the point where I miss class. The other girl involved talked to people at PFLAG tonight, and they suggested board of education. I might show her this page later. Thank you everyone, and I will be back reading your suggestions and updating you on my progress on this yet-to-be-named operation. **(Editor's note- in case you're not aware, PFLAG is an LGBTQ+ organization)**

***Relevant Comments:*** *I used webarchive to find comments since this post is too old for unddit and she deleted her account.*

*Did anything happen between them to start this?*

Nothing. We went from being casual friends to me being his next target. No fights, no anything. I was blindsided.

There is no context. He just wrote them. I do not have a twitter, nor does he know that I've seen his. He will just randomly post about me.

*There are a lot of comments with advice, from suing to police involvement:*

There is definitely great emotional distress. I'm back on the anti-anxiety meds that I finally weened myself off after months of trying.

I'll discuss the police involvement with my Dad in the morning.

I know, but the last time I reported something like this (unrelated) to the cops, they did not do much for me, and that time was harassment with a threat to my safety. Not the same kid.

His parents know, and don't care. Usually, the school does SOMETHING. Even if it's just a 2 hour detention. I got that for being late to class once. This kid- nothing.

*Try bantering back?*

I tried the banter thing with him. It only led to the teacher not taking his remarks seriously because she thought we were besties.

*About what he said about the VP of the GSA (****Editor- Gay straight alliance or gender and sexualities alliance****):*

Seriously- the stuff he said to our Pres was just fucked up. He also called me a sassy dyke. I worry a bit about giving out the school though, as if they could get me in some sort of trouble.

I am sassy, but I am not a dyke. He knows my mother is gay, and I take offense to the word.

*Someone says to pay someone else to beat his ass (classic reddit):*

He'll get his ass kicked eventually on his own. Apparently, the school thugs do not take mocking kids in wheelchairs lightly.

We have a kid at school that everyone loves who is in a wheelchair. The asshole just started harassing him about not being able to walk, and he almost got jumped. He then later tweeted about making fun of handicapped kids.

*Someone seems to... shame her for threatening suicide?*

Suicide wasn't a threat. I would never use my suicidal thoughts as a threat. I cannot change how I feel, but I am getting better at controlling them. It wasn't so much that I was planning anything- I was afraid I would snap.

*Good post about dad:*

I love him so much. He came with his suitcase in his hand and told me he wasn't leaving town until he knew I was okay. We then went out for slur-pees and he texted me bad jokes the rest of the week. I really lucked out in the parent department.

**Update Same Post: March 14, 2012** (I found the date using webarchive: [Link](https://web.archive.org/web/20120315092216/http://www.reddit.com/r/AskReddit/comments/qvgi5/the_cyber_bullying_has_gotten_to_the_point_where/))

Edit 2: HOLY S%&\^ YOU GUYS! I get off my bus this morning, and I see an unusual amount of cops around the school. I find the group who was going with me into the office, and we sat in guidance, waiting for the counselor to see us all (There were about six of us). Next thing I know, someone asks me if I'm Sarah. They had been looking for this Sarah all morning, and had even called down another girl by the same name. I get taken into one of the counselor's rooms, and a BOOK of these comments is placed in front of me. She tells me that she has gotten a ton of emails, and that the page has been forwarded to several teachers and the principal. I was shocked. Thankfully, she was not upset about the emails, though some of them were a little nasty. I learn that my Principal has been up all night trying to deal with all of the emails she has been getting. Though she seemed a little mad at first, we quickly settled everything. I was taken into a room with the principal, the counselor, and an administrator to share my story again. I printed off every tweet and the cops collected any threatening ones. They might be able to do something about it, which is amazing, because I wasn't expecting it at all. I'm still shocked that many of the school officials were just now learning about this kid, but I know now that they know: every body knows. Nothing can happen immediately, but the process is starting and consequences will happen.

I am slightly scared about the possible backlash, but I feel amazing knowing that even if people dislike me for it, I stood up for my own safety. I have a ton of support- both from you guys and my friends. Thank you everyone who sent an email (they kept mentioning some guy from Montana). There is no need anymore to contact the school or the county about this issue. I will be checking in every morning with the counselor, and she will give me a pass to see her if I ever feel like I'm being harassed over the next few days. You guys made this all happen overnight and sped up the process ten-fold! I don't think I can say thank you enough for helping me, and everyone else, finally deal with the school cyber bully. I love you, Reddit!!!

**Later that day:**

He has been suspended until the school decides what to do with him. Thank you for your support and emails, but **THERE IS NO NEED FOR ANYONE TO EMAIL THE SCHOOL ANY FURTHER!!!!** The matter is being taken seriously now, and everything can move a lot quicker if the school isn't being flooded with email and concern. I promise you, action has been taken. Thank you!

***Time Magazine wrote an article about this:*** [Article](https://newsfeed.time.com/2012/03/25/reddit-users-help-girl-take-action-against-her-bully/)

**Edit-** thanks to u/fia-med-knuff for finding this [article](https://wjla.com/news/local/arundel-high-school-student-charged-with-harassing-classmate--74157). The bully was charged with harassment as a juvenile and released to his parents.",8320,329,2023-01-30 01:06:45,https://www.reddit.com/r/BestofRedditorUpdates/comments/10oofje/girl_asks_for_help_from_reddit_regarding_being/,"#Do not comment on the original posts

Please read our [**sub rules**](https://www.reddit.com/r/BestofRedditorUpdates/wiki/subrules). Rule-breaking may result in a ban without notice.

If there is an issue with this post (flair, formatting, quality), reply to this comment or your comment may be removed in general discussion.

**CHECK FLAIR** to determine if you want to read an update. For concluded-only updates, use the [CONCLUDED](https://www.reddit.com/r/BestofRedditorUpdates/search?sort=new&restrict_sr=on&q=flair%3ACONCLUDED) flair or subscribe to r/BestofBoRU.


*I am a bot, and this action was performed automatically. Please [contact the moderators of this subreddit](/message/compose/?to=/r/BestofRedditorUpdates) if you have any questions or concerns.*,Why does it take countless emails from internet strangers for the school to take action?,As a former teacher, the way the school handled the bullying initially makes me think they’re one of those schools that proudly claims ‘there’s no bullying at our school!’

Which just means they have poor/no procedures for reporting bullying, they turn a blind eye to what does get reported and then they pretend everything’s fine.,Took me awhile to compile this with her account being deleted, but I wanted to share since it reminded me that random internet people can actually do some good. I hope she is doing well today.,I remember being cyber bullied before cyber bullying became a phrase — MySpace days. A kid I was dating decided that he couldn’t break up with me the normal way. He phished my MySpace login and hacked my account, deleted all my photos and poetry and wrote “I’m a nazi wh*re” all over the page. This was a month after my sister had died and 2 weeks after my parents announced their divorce. He kicked me at my lowest point, and the administration just told me to choose who I date more carefully. 

I’m glad that this poor girl had the Reddit community and her parents as a support system. It gives me hope that even though this situation was poorly handled, that she lives to see another day, and that she keeps standing up for herself.,Its still frustrating how people in power and position takes no action against bullying unless victims stand up for themselves.
Still Good for her, i guess.,I did some research and I found a mention that the bully was charged with harassment as a juvenile and released to his parents. I wasn't able to find anything after that though.,This hits close to home. Fucking Severna Park highschool has a bigot scumbag kid running around too. 

Glad OOP got some help.,The only social aspect of high school that I appreciated was that special needs or disabled kids were off limits. You'd get your ass kicked before you even finished messing with a kid.,I’m the guy from Montana. I forgot all about this.,[deleted],The irony that Reddit helped her by essentially cyberbullying the school into actually doing something.,They needed a public push. Glad they got one.,From the Times article

>The social news site Reddit has a penchant for do-gooding



Me: *squints*,How on earth did this get to a stage that something was only done after Reddit users sent emails. This is absolutely outrageous. 

I'm absolutely shaking with anger on this poor person's behalf.

I have an 11yo who had a little trouble with a bully last year. Usually I am not one to contact the school but as soon as I heard, I was in contact with them. I wanted answers.

Apparently the teacher who knew about it did not report the matter. When I contacted the school and told the VP she was amazing. Sorted this out straight away.

I have no idea what it is like in other countries but in Victoria Australia (at least in my experience) they take bullying very seriously.

I really hope the original poster is doing well.,Why is the default for men who harangue women to want to rape them? Pretty sure “I was to roofie Sarah” could be “want to” or “If I was”. Even if it’s not it still is horrible.

Also, for once in my life I would support an adult kicking a kid’s ass. 

I’m glad some of the emails were nasty. They NEEDED to be nasty. The principal deserves to feel shame. He needs to. He didn’t give af until other adults knew he was a pos and called him out. This is a time that Reddit did good using clues to find the school.,Seriously, bullies need to be dealt with severely as early as possible. They are like weeds, need to be dealt with before they grow out of control and cause more damage.,Letting this boy continue with this bullying behavior with no consequences would have resulted in tragedy… a suicide, an assault, a shooting, or something like that. It’s boggling that the school administrators were willing to stick their heads in the sand… like there’s no way they’d realistically think the problem would just go away, right?,As a former teacher, the way the school handled the bullying initially makes me think they’re one of those schools that proudly claims ‘there’s no bullying at our school!’

Which just means they have poor/no procedures for reporting bullying, they turn a blind eye to what does get reported and then they pretend everything’s fine.,I really wish we'd stop calling it bullying and start calling it hate crimes.,How do you even come across a post like this? Over 10 years old from a deleted account.  What’s your secret OP??,Anyone else dreading what the school's response to OOP was after the cops left and Reddit wasn't looking over their shoulder anymore?,Glad Reddit could be the catalyst for justice, but pretty sad no one listened to Sarah from the beginning.,>Though she seemed a little mad at first

This whole thing made me seethe, but that part is just the fucking icing. Maybe if the principal didn't want to have to deal with emails, she should have taken the bullying seriously? Just a thought.,Note: GSA used to stand for gay straight alliance, but has changed (at least where I am) to gender and sexualities alliance to encompass the whole queer community. 

Great post, thank you for compiling this! :),This bully will have a hard time as an adult. I'm sure its because his parents ignore him or worse. I do hope that they get some therapy for him but I'm glad OOP is doing better.,This is amazing. People keep talking about how we need laws against bullying. But the fact is, we have laws against bullying. They are harassment and assault laws. The problem is, we don’t apply them in the school context, not nearly enough. If we created new laws for bullying that were somehow different than the harassment laws we already have, what confidence could we possibly have that they wouldn’t also be ignored?,I hope Sarah is doing well. 🥺,An amazing result! I wish reddit existed when I was at high school.  Instead I had to change schools…,This is why I’m in Reddits best updates,Disgusting that she had to go to such lengths to obtain help. Those school officials should be prosecuted for criminal negligence, be terminated, and banned from ever working in a school again.,The fact that the school had to be shamed into taking action is pathetic.

I am glad she got help though.,I'm still shocked that many of the school officials were just now learning about this kid,

One person with responsibility can ruin lives by not doing their job right. I hope when contracts need renewel they look in another direction.,Curious about the guy in Montana….,I just have to say that I'd like to smack whoever asked Sarah if anything had happened that would have caused the bully to start bullying her. Like maybe it was her fault somehow??

Bullies like that are just AHs, picking on whoever is different enough that they think they can get away with it. I had to f'ing pull one of my kids out of school mid-year because her school couldn't put a stop to the bullying. No kid deserves to be tormented like that, ever.,Bully can be wild based on how connected or not the kid’s parents are. My town has a guy whose kid is brought up in bullying and he basically tell his friends on the board of the education to make sure she’s not charged. 

The situation is private so we have no idea who the victim is or if the parents know the bully’s dad is coming to boe meetings telling them to vote to make sure nothing happens to his daughter. And that he’s got friends etc. big surprise the apple doesn’t fall far from the tree. 

Schools can and boes can be absolutely useless.,I went through almost the exact same thing.  Public schools just don't care.  If they aren't forced to do anything, then they won't.  Zero respect for most school admin.,I hope something bad happened to the Vice Principal who knew what was going on and refused to act.,As a parent in situations like this you have to go for the financial throats of the other parents. The threat of lawsuit and financial ruin will make them fix their shitty offspring.,kinda sad only serious action was taken when it could’ve possible harmed the schools reputation and have it made public.

Imagine all the other kids that complain but go unnoticed. 

Still very happy for OP.,You know, the world has changed for some good. When I was younger, if you were gonna harness the power the internet to stop a bully, the quickest thing to do was start a retaliation campaign on /b/,What a lovely way to end my browsing for the day.,I wish you’re well, Sarah! Fuck bullies!!!!,It's worrisome that we have to live in a world where this creep not only may see himself as the victim, but it's a real possibility he may shoot up a school (and OOP) as payback.,Brave of this girl to ask for help and good on the community to force that school to take action.

Sadly, we have another loser incel in the making because the piece of shit parents failed to raise their son.,I'm from AACO and I'm not shocked it took outside intervention for something to be done... 

Was like this when I was in school, is like this for my kids in school. No one cares until someone takes drastic measures, then it's all we need to be proactive about the mental and emotional health of our students!

Crock of shit. I'm glad oop got some results but I can say with 100% certainly, had she not turned to Reddit, she would have been bullied out of the school, or worse.,I guess we should start a reddit mob sub where if you have a problem, the reddit mob will solve it. Kinda like the A team, but with way more mental health disorders haha.,Did they ever say what school this was? I live in Anne Arundel county and this makes me think of Severna Park hs. They have a bit of a reputation for bullying, basically the school is full of rich kids who pick on anyone different.

About a month or so ago the school went viral on TikTok with a video of a disabled student being bullied called racial slurs and the r word. Great school 😣,When I was in 3rd grade, my bully told me he was going to bring a knife to school the next day and stab me until I die. It wasn't the first death threat he'd made, but it was thr first on school grounds. I'm 35 now and I can tell you within feet where he said it (we were walking in from recess).

In tears I told my teacher what happened. She yelled at me and told us both to go to the principles office. He wasn't available or something so they locked us in his office alone for a long time (I want to say 2 hours, but it probably was more like 1. Felt like longer). He came in, talked to us for maybe 15 minutes and sent us back to class. No punishments.

I told my parents what happened when I got home and they apparently went nuclear on the school. They kept me home the rest of the week and i was told, it wouldnt count toward number of days missed. I don't know the details, but he was moved out of my class immediately and every staff member knew my name after that. I later learned my photo had been given to every staff member and were told if they ever see him near me to intervene immediately. He switched schools later that year, I forget how long it took.

Obviously, this story does not surprise me in the slightest.,Whenever I feel like this site is a cesspool, I’m going to come back to read this story to remind myself, “we can do great things”",,false
