,post_id,subreddit,title,text,score,num_comments,created_utc,post_url,comments,image_urls,over_18
25,gq5mrn,SmolBeanSnark,May 25-26,"
A day in the life of CC

11:45am- I wake up to my cat (the unimportant one) kneading my stomach, begging for food. I groan and roll over. The life of a pet owner isn’t all just glitz and glamour and fodder for my insta stories- these things are super needy! I yawn, stretch, and open my phone. A couple thousand likes on my instagram, a couple hundred replies on twitter going ‘why are you acting like your college degree makes you better than other sex workers?’. Come ON guys, I was trying to normalize people with ~elite~ educations succumbing to a career as lower-middle class as sex work. Or something like that, I forget what point I was trying to make in the first place.

12:30- After scrolling on social media I head to the kitchen for some breakfast. Somehow those glass shards from last week still aren’t cleaned up, so I kick them further under the table and start my meal, a canteloupe-kale-spirulina-basil-orchid-spritzer smoothie. More scrolling, more name-searching, and so on.

2:45- Now my work day has really started! Meaning Adam called me and asked me to stop blindly retweeting posts with my name in it and start working on Scammer. He really knows how to push me to be my best. I set a timer for 20 minutes and open my laptop. The Word document opens to the photo of Natalie and I that she used in her Cut article. I use my cursor to gently stroke her malicious, beautiful face. The next 15 minutes are me typing MY side of the story- that Natalie suffered all the consequences of being the friend of an addict, but never got to know the amazing woman recovery made me into- until I scroll up and see that every paragraph I’ve written before is the same exact quote, à la The Shining. Hmmm, that’s a movie- I mean book- that I could cosplay on onlyfans. A sexy Wendy Torrance perhaps? I’ll think on it. I haven’t read the cliffnotes yet.

5:00- Thank god, my work day was finally done. After writing for 47 minutes (double what I’ve gotten done for the rest of the month of May!) I had to do a cameo. Unfortunately, this was one of them that didn’t pay me. I mean, do they really expect me to get these things done in five days? Anyway, it was to some girl named Claire who graduated from Berkeley. Magna cum laude, whatever that means. I start the cameo. “Heeeeyyy girl, this is Caroline Calloway. Matisse Calloway is here too! I have no clue where the other is, girlish laugh. Anyway, um, kombucha slurp I just wanted to say that uhh… you’re graduating! That’s great, like SO great. I mean, uh, I don’t even know what Berkeley is- like I uh, I went to school in England and I like don’t really even know any schools in America more girlish laughter. Um, BUT, I bet it’s a GREAT school, like almost as good as Cambridge- I got an art history degree from there, like, a year ago- and I bet you are like SO happy to be done with school. And I heard you graduated Magna Cum wink Laude, which is like, super sexy forced effortless giggling, like maybe you can start an Only Fans after you graduate too! Unless you don’t want to which is, like, cool, but uh, pensive kombucha sip I’ve made like, oil wells of money doing it, so just think about it! Anyway, what were we………… oh yeah, graduation! That’s like, SO great for you. I guess you can use $100 you owe me from this cameo and put it towards, like, an apartment! Or some olive oil, don’t underestimate what a three-figure bottle of olive oil will do for your life. Anywaaaaay, I hope you have a great day in, uh, Berkeley, and, uh, yeah!”. I honestly can’t believe I’m not paid more to make these.

7:30- Soupboi is coming over! I get that we’re in like, quarantine or whatever, but governor DeSantis said as long as you don’t cough directly in each others faces it’s okay to be in the same enclosed space. He comes with ingredients for dinner. I lounge on the couch in my running clothes while he makes my favorite vegan dinner- lamb with curried vegetables. I name-search on twitter again, and quote tweet all the reply-guys with “sorry, I have a BOYFRIEND now!”. These simps think I’m bae AF, or however you say it. Who knows!

10:30- a few kombucha spritz later I say goodbye to Soupboi. As I close the door, a sharp burst of panic hits me when I realize I forgot to make my close friends content for the day. I quickly repost some stuff from my feed to satiate the trolls who comment hateful stuff like “I paid $2 a month for this but you haven’t posted in 65 days”. I have GAD and their cyberbullying doesn’t make it any better, but of course they wouldn’t get what a stressful life I lead.

2:45- I’ve spent the last few hours in a twitter-hole, so much so that I didn’t realize what time it is! I realize I forgot to shower after my run, but it’s already so late I figure I’ll just do it tomorrow. Goodnight fans and snarkers alike, I’ll see you in the morning.

---

Today's post was written for YOU by an anonymous, funny lil bb. If you find yourself inspired to write up the post text for this upcoming Wednesday's discussion thread, please send it to [modmail](https://old.reddit.com/message/compose?to=%2Fr%2FSmolBeanSnark) by 6:00 PM EST the day before! If you'd like to volunteer for a future date, check and comment on the [signup sheet](https://www.reddit.com/r/SmolBeanSnark/comments/fg1xzt/writeup_signup_for_the_rest_of_2020/). There is a 39,000 character limit and the overall tone should be humorous.

[May 22-24 post](https://www.reddit.com/r/SmolBeanSnark/comments/godsts/may_2224/) and [all previous discussion posts](https://www.reddit.com/r/SmolBeanSnark/collection/955ad74e-9a63-4c0f-85e3-0bb1121b5d80)

[Week 26 Transparency Report](https://www.reddit.com/r/SmolBeanSnark/comments/gp69uc/week_26_transparency_report/)

---

[The Fallen Bookshelf](https://www.reddit.com/r/SmolBeanSnark/collection/03109561-af85-4c9e-837f-8c06c9944922)

[Chat Room](https://s.reddit.com/channel/126811656_77ad3a88873c5b558f182d1338b6af7b8c78ff56)

[Off Topic Chat thread](https://old.reddit.com/r/SmolBeanSnark/comments/gpklof/may_2430_off_topic_chat/)",149,539,2020-05-25 06:07:22,https://www.reddit.com/r/SmolBeanSnark/comments/gq5mrn/may_2526/,"[deleted],Her sudden performative depression is 100% an act for Adam to excuse herself from her writing obligations. Sorry not sorry.,“My cat. Not that one, the one I love.”,How unprofessional to publicly discuss your assistant’s looks. Also, Caro’s obsession with Brigid’s appearance kinda makes clear that she didn’t find Ari or Christina pretty....,[deleted],Prediction: when CC leaves Florida, and Soupboi, to return to New York she is going to go hard to find The One. I think that she will do a 180 in how she presents herself, for a while anyway. We are going to see less cerebral softcore, less talk of her mental health, fewer finger paintings and cash grabs, and, one hopes, the end of the tableaux. Envy is a profound motivator for CC, particularly when paired with a perceived rejection. 

Then again, I could be completely wrong, and she might accelerate her ‘shock me, shock me, shock me,’ scammer schtick.,How perfectly natural and spontaneous that photo that soupboi posted of Carl wrapped in a blanket up to her tits like any woman in a post-sex scene of a mainstream film! 

Also I don’t know if it’s because she has been so boring and predictable lately but I realised yesterday that I didn’t care about what she would do if I didn’t have the snarkers commentary on the side. It’s like watching a film in a language you don’t quite understand without the subs. Missed you snarkies 💖,[Is anyone else loving this Of Mice and Men OnlyFans shoot? Caroline and Matisse Calloway cosplaying Lennie and the mouse is so cerebral and brilliant.](https://imgur.com/a/s87mXDc),Carp's Depression AMA reminds me of being 12 and friends posting AIM away messages like- Everything is HORRIBLE and NO, you shouldn't ask!,[deleted],I love that she posted “all cameos done for the day” like she’s just done a ton of work, when if you check her cameo profile, she did one 😂.,Just thinking about how Caro tweeted that she feels bad for elder millennials who don't know how to be online when she literally can't even figure out how to fix her WiFi (which I assume was just turning something off and then turning it back on again whether it was the router, her computer or the wifi ON her computer) without the help of an assistant.,You know how most of us consider it a red flag when men say their exes are crazy?  

Her exes are the exception.  It has to be so daunting to date one of them.,Caroline pretending she takes each and every Cameo incredibly seriously which is why she’s heartbroken she missed the window for one is a laugh. Granted, I too would be heartbroken if I missed out on a cool hundred because I was too lazy/unmotivated to do literally one minute of work.

P.S. Thrilled the sub is back. I had nothing to mindlessly scroll while I waited for my pasta water  to boil yesterday!,I never saw this discussed but remember  at the beginning of quarantine CC put up a note in the condo lobby hey this is Harriet's granddaughter I'll go grocery shopping for you if you can't leave your house! And as soon as all the old people in the building started asking she immediately backed off her performative nice deed I want to help but this is too much! I'm busy!,I didn’t snark or look at cc’s posts (I mean internet art) yesterday so I’m catching up now. 

All I can say is her “AMA chronic depression” posting reminds me of when I was 14 and used to ask myself questions on formspring or ask.fm to spice up my life and add drama when I wanted people to know my personal business lol. 

Also I do think she’s depressed but yesterday sounds just like.. sadness lol, and she wanted to pathologize it into something ~more special~ than other sad girls!!!,Oh look it's Tuesday again and no part 3!,She takes her cameos “humiliatingly heartbreakingly seriously”. Truly, the voice of our generation. Of course Carl would find work (even if it’s just doing cameos) humiliating.,[deleted],Are they really nekkid on Gma's couch?  The disrespect!!,[deleted],Caroline: all my characters are 28!! obviously!


Also Caroline: imagine I’m lux Lisbon and we FUCK after school,genuinely so excited for what caroline's gonna do to get us to stop circle-jerking and pay attention to her again,[deleted],i love when cc has yet another quiet tuesday hoping no one will ask for the content she makes FOR YOU that she also asked you to pay for and then didn’t deliver,a bit random but in 2012, caro and her ex helped acquire an art piece for the guggenheim and i think that was the last time she was a true patron of the arts, even if it were her ex's money. at first i wondered why she never bragged about that but it's because it was attached to an ex [https://www.guggenheim.org/artwork/31995](https://www.guggenheim.org/artwork/31995) (look at credit line),Caroline for ur next OF try Harry Potter but the scene where he’s in a crib after his parents are visited by Voldemort.,I’m so grossed out by the fact that her fans saw that photo of Emma Watson as an ACTUAL CHILD and immediately said, “oooh, make some porn out of this!”  
And then CC was like “I’m three steps ahead of you 😏”,I just KNOW soupboi is scooping that litter box for her. ScoopBoi,Amazing that she has to post to confirm her cameos were done. I can just see the exchange between her and her manager now... “if you finish all your cameos today, you can stalk one of your exes”,I was really hoping for a self-congratulatory post on the big grid about how the darkest corner of the internet went dark yesterday but my queen let me down smh 😔,I’d be disturbed and fascinated to see the actual stats of how many hours she spends on her phone, name searching herself, online shopping, hours spent on IG & Twitter.
I’d also love to know if she’s ever really thought about how many hours and months she’s wasted while she could’ve been writing her “memoir”. I’m pretty confident (like 100%) the money she brings in from cameos and OF is purely spending money (not rent I’m talking about the designer clothes, olive oil and expensive glass bon bons) No matter how many tantrums she throws about how she HAS to sell titty pics to survive, at the end of the day she’s got a serious safety net. You don’t need to be rich, hot or young to be a writer. You don’t need to live in NYC to be an author. The only thing you truly need to do is just fucking WRITE,I'm going to jinx things by saying this, but I am so relieved she's graduated to the weird hair lifting pose in all her stories rather than that annoying influencer chin lift she was really into a while ago. 

....now of course she'll go back to the chin tilt because she'll read it here, but it's nice while it lasted.,wasn’t there supposed to be an ~announcement about the printing of SCAMMER like three days ago lolll,I feel like everyone I follow ends up in the top 1-5% of only fans upon joining within a few days. This ranges from beauty gurus to tiktok people. At first I was like oh wow good for you, but now it seems pretty commonplace. There was even a beauty guru drama channel up in the top percentages 😂 I'm beginning to question how they work it up and even wondering if they're just arbitrarily throwing out numbers to encourage people.

All of that just to say, Caroline it's not that special. Anyone with a following of any sort ends up in that category.,The only unbelievable thing in this write-up is CC knowing the name of Florida’s governor,y'all i know we're all talking about the hermione thing but also, why is she wanting to follow good cambridge meme pages when she graduated years ago... caroline pls move on im begging u,With the implosion of SBS and the birth of 500 new CC discord’s yesterday, her engagement must have been WAY DOWN 😂,Cerebral and poignant softcore porn...of a Harry Potter character,Caroline failing to pronounce Jacquemus HAHAHA omg Caroline 😂😂😂 trying to be an it girl so hard and yet failing every. Single. Time.,maybe she should’ve taken **any** of the books she has promised to write “heartbreakingly seriously” cuz so far they are just “humiliating”,Hmmm I feel like the theme of every one of her graduation Cameos could be a bit better than “you’re going to fail, it’s inevitable, you will literally never stop failing, that’s all that life is, just pure failure, please keep failing, don’t ever let anyone tell you to stop failing!”

Not sure that’s great advice.,Don't you all love when she writes someone has cooked this dish FROM SCRATCH I mean yeah cc... That's literally what cooking/baking is......,So, em, I don't know, it's 4AM over here, I can hardly sleep and idk why the fuck Caroline popped in my head alongside this Oscar Wilde quote from The Critic as Artist: Man is least himself when he talks in his own person. Give him a mask, and he will tell you the truth.

It made me think about how performance art for Caroline potentially means she can get away with all the questionable things she says/does because it is all performance exposing some deeper, darker truths about contemporary society — but in actuality, that very guise has enabled her to be her true self without being held accountable, which by the way I don't even think is the point anymore. It also means she doesn't have to do *any* thinking behind her persona and act instinctively, as on a whim, because she has a free get out of jail/performance card. I just — *shivers*

😴,[deleted],Idk if anyone here has seen or even heard of Matilda the Musical, but there is a song about how in this world you don’t need to be talented or smart, you just need to be pretty and loud. And this reminds me so much of CC,creamy tum. cloven hooves. animal nubbins. All fully disgusting,[deleted],[deleted],Thinking about Amadeus and how Mozart could have really written an article for The Cut exposing Salieri.",,false
26,6xpgwl,phantomstrider,Josh's Anxiety Tips (Part 3) - Cyberbullying,,1,0,2017-09-02 22:33:07,https://www.reddit.com/r/phantomstrider/comments/6xpgwl/joshs_anxiety_tips_part_3_cyberbullying/,,,false
