,post_id,subreddit,title,text,score,num_comments,created_utc,post_url,comments,image_urls,over_18
36,1fv73s1,SPTV_Unvarnished,Liz Ferris warns fans and says she was in the SPTV Foundation's cult,"Late last night, Liz Ferris made a comeback onto her channel to say she went from being in the cult that she was born into to joining the SPTV Foundation cult. I even bashed Marc and Claire, she says. I bashed Amy, and you know what? I've apologized. I called Claire up and apologized for the horrible things that I said.  
  
She says that Aaron started a cult but called it a foundation and that he's competing with the Aftermath Foundation out of revenge. Liz calls Natalie a pathological liar and says Natalie and Aaron only care about making money. Because when this is all said and done, guys, they're going back into real estate, she says.   
  
For two and a half months straight, Liz gave all of her YouTube money to Natalie because Natalie was hurting, she says.

Liz says last year Marc and Claire Headley had wanted to keep the attempted rescue of her dad as quiet as possible because we were doing a lot of stuff behind the scenes with police and private investigators. She says the only reason she agreed to come onto SPTV and tell her story early was that fellow 2nd Gen Vanessa LaRose said that she was being followed, attacked and treated like garbage because she went to Gold Base with Liz.

A chatter says she doesn't think Aaron will get divorced because he'll have to show his finances. I'm gonna leave that up for a minute, Liz says.   
  
Liz agrees that she only spoke on the phone with Tony one time for an hour. She says that's the only thing that came out of Natalie's mouth on Tuesday that was true. If Liz doesn't release the email and texts she says she has as proof, it's going to be very hard to believe her.  
  
Liz says she doesn't think everybody on the SPTV Foundation board knew it was a sham. They hoped it was real, she says. Now knowing everything that's out? Yeah.

A chatter asks Liz if she knows if anyone on the SPTV Foundation board has used alternate names to distract and misinform SPTV fans. Do they have aliases? Yes. Liz says.

There was a group chat in Signal between Liz Ferris, Nora, Elysia, Liz Gale, Aaron and Christi Gordon. Natalie wasn't in it. It was just us, Liz Ferris says.

Because she'd been talking to Natalie every single day, sometimes twice a day, I asked the group if it would be OK if I added Natalie to the group. Well, then something happened. Nora kicked me out. She went on this rampage about how I'm a liar, Liz says, referring to when she gave information to Zero Dark Tony. She says she and Nora have gotten past that now.

Aaron is the most sexist man I've ever met in my entire life, and I have met Tom Cruise and I have met John Travolta, Liz says. She says it was vomit-worthy when Jenna said that DOA was more evil than her uncle, David Miscavige.   
  
Liz says everyone including her has made mistakes.  
  
Liz says she loved being on YouTube and connecting with her chat, but she didn't love the bullshit of SPTV and pretending to be friends. If you go back and see, look at who's pretending. Look at who's attacking people and who's actually trying to help people. Really look. Because I promise you it's not SPTV Foundation. Did they help me with a couple months of therapy? Yes. Thank you so much for helping me with a couple months of therapy. Thank you for twisting the knife and letting me know how much I did not matter to you.

Liz says the SPTV Foundation doesn't care about the protesters or the 2nd Gens. I promise you they don't even care about the subscribers. The only thing they care about is the almighty dollar.

A chatter asks if everybody on the SPTV Foundation board knew it was a sham. I don't think they knew it was a sham, Liz says. They hoped it was real. Now knowing everything that's out? Yeah.

A major SPTV donor superchats Liz saying “I am so sorry they treated you that way. It is wrong and I won’t be giving that part of the movement any more of my donations. I wish I had known how truly awful they have been to you.”

Liz says she and Keri spent $400 on weed paraphernalia for Tony because he was in so much pain he could no longer smoke. After Keri interjects, she says she's guessing about the amount of money they spent on that because she didn't save the receipts. She says Keri also got a bonus and donated a lot of money to Natalie and Tony.

Liz says gifting memberships to Natalie's channel made Tony smile and he would say Is that all you've got, Liz? so she kept doing it.

I put my family through a lot, Liz says. In the moment, it felt like the right thing to do.  
  
Liz says before she joined the Sea Org, she got pregnant from rape. She says Callifornia had a law where her rapist could have applied for custody of that child and gradually received more and more custody rights, so she gave that child up for adoption.   
  
While she was going through a raunchy divorce from a wife who was good at cheating on her, Liz found out her biological son had died. Him and his adoptive mother, she says. She wants to call herself the mother, but says she was the incubator. I helped someone who wasn't able to have children, she says. Her child was 13 years old when he died.   
  
So when someone says they know loss, I know loss, she says. That was a direct dig at Natalie, who did a tearful video yesterday about the loss of her father as well as her longtime love, Tony, several months ago. Natalie said Liz imposed upon her to come to Minnesota and stay at Natalie's house for a few days right before the Celebration of Life.

Liz says she's been told that somehow she invited herself to a funeral. I have some amazing texts that say 'Please come stay at my house. Oh my God, it will. be so much fun. It'll be like a sleepover slumber party.'   
  
I've never been so disgusted by some of these people in my entire life, she says. But her credibility is very strained because Liz has viciously attacked Marc, Claire and others on her channel more than once.

Liz says she's watched Aaron attack women and treat people like garbage. 

Liz says when she was in the hospital with pulmonary embolisms in both lungs, she was dying. She was admitted to the hospital before Tony's funeral and the only people she talked to were Pearlsnappy, Summer Savage, DrWhoHeather, Selfless Self and Elysia. She says Lara was the only SPTV person who called her while she was in the hospital for those 10 days.  
  
DOA showed up at the hospital in person when she couldn't walk 20 feet, Liz says. So if anybody wants to say he's not a great human being, I will stand up and I will punch you in the throat, she says.

Natalie doesn't even like me and that's OK because I can't stand her ass anymore, she says. I thought she was the coolest shit on the planet. She says Natalie only likes what Liz gave her.  
  
Liz says in the past few months, Natalie has gone to Hawaii twice and she just checked going to Miami off her bucket list. Liz mockingly thanked Aaron for only showing pictures of himself in the pool with Natalie and Jenna from the chest up. If I'm gonna go out, I'm gonna go out with a bang, she says.

To be fair, Natalie went to Hawaii first for her father's funeral and then again with Tony's sons to spread his ashes there. Those weren't just pleasure trips.

Liz says she's so sick of SPTV people pretending they're the nicest people on the planet. She says that a lawyer looked over the contract the SPTV Foundation expected her to sign to get another month of therapy, and that lawyer told her that if she said anything to embarrass the foundation or one of its board members, the foundation could come after her for all of the money it set aside for her. Including the shots, which they did not pay for, she says.  
  
Liz says her viewers and Feral Cheryl helped her get those SGB shots.   
  
The SPTV Foundation paid for Nora's shots. Liz says she's glad that Nora is doing amazing, but Nora didn't have to jump through the hoops that she did to get the shots.

SPTV did cover her shots, Liz says. Not mine. I couldn't even get six months of therapy.

Liz says she has not talked to Marilyn whatsoever but she says that she loves me. She says Marilyn has not reached out to her, but she has talked shit about Pearlsnappy, who's been there for the victims of Louis Repetto.

I will say Louis Repetto because I got to see things that I should not see. I got to witness things that I should not witness because some people had had some horrible things happen and Aaron didn't think that people on his channel would give a shit, she says. Aaron said that no one who watches his channel would care about what Louis was doing. Liz asked everybody to put a 1 in the chat if they know anybody who's been assaulted.

Liz says there's not a lot of accountability. Liz says there have been times when she has been screamed at to the point where she didn't know if she could continue being here on this earth. Now I get to be told that I somehow invited myself to a funeral.

Liz says her lawyer could not even find the SPTV Foundation's EIN number. Liz says Liz Gale, who resigned from the SPTV Foundation board earlier this week, couldn't get the EIN either. In a livestream on Saturday, Liz Gale had told her viewers she would try to get answers about the EIN number and the contract that the SPTV Foundation expected Liz Ferris to sign. In her resignation video, Liz Gale said that she had started to ask some hard questions about the foundation and she wasn't getting any answers.  
  
Don't be fooled, Liz Ferris tells SPTV fans. You're not stupid. You're not delusional. You don't need to bump someone's ego, especially Natalie and Aaron. They don't need any more ego. Their heads are so big they could float to the fucking moon.  
  
Liz Ferris says she likes Liz Gale and reveals that Liz Gale was one of the board members who voted for her to get help. From my understanding, a lot of people had no idea that there was a new clause that they could come after the people, she says.

In response to a chatter who tells Liz Ferris she's showing no proof, Liz says people can reach out to her through email. I've got tons of screenshots, she says. You want emails? I've got an email where she actually says how excited she is that I'm gonna stay at her house. But somehow I invited myself, right?

Stop being fooled, she says. You're not stupid. 240,000 people are not stupid. They have to know that he's an egomaniac. They have to know that she's just as bad. The only difference is that he'll assault women while she'll put them down to the point where they don't want to be here.

I'm so sick of people grifting, Liz says. She says someone on SPTV was creating a new catastrophe because they needed one to get more donations. That's disgusting, she says. I just want to get my dad out. I just wanted to let people know what happens behind those walls.

Hopefully, Liz will come to understand that she has asked fans to give her money many times too and she hasn't always made smart financial choices.

Liz says Natalie and others on SPTV are trying to make her out to be a giant liar and punch down on her.  
  
The protesters are the ones who aren't being supported by SPTV, she says. They're regular people. They've gone through hell, she says. Liz says she's watched a piece of Pearlsnappy's light fade since she started protesting, and the same goes for Selfless Self. 

Liz says Lara is out there doing the real work. She promises people that Natalie only cares about herself and that she has blocked so many people just for mentioning Liz's name. Just like Marilyn, she says.   
  
Liz says that when Marilyn came back to her channel after cyberbullying Ellie, Liz was in Marilyn's chat ready to send her a comment saying that she was so proud of Marilyn. Marilyn was doing an AMA that night and Liz saw someone ask what Marilyn thought about Liz Ferris and the SPTV Foundation. That comment was deleted.

Liz tells Marilyn she's still a mod on her channel. You might want to remove that, Liz says

At around the 1:03:00 mark, Liz imitates Marilyn doing her seal clap and saying More friends! when someone gifts a membership or joins her channel, and it's hilarious.  
  
People got blocked permanently from channels for having beliefs, she says. Please don't be victims. Please don't let them manipulate you. Please don't. Otherwise, you're just gonna end up like me, and its a human punching bag thing.

Liz says she saw a post from Reddit that said Aaron's ideal org board for the foundation would just be him. She thinks Aaron wants Jenna and Natalie with him on the board. She says she doesn't have any bad words to say about Jenna. I don't know her, she says. I've never had a conversation with her, but I knew of her. Keri reminds Liz that she sat across from Jenna at breakfast in Los Angeles, but Jenna didn't speak much.   
  
But months ago, Liz said that Jenna was much nicer than Leah Remini. She referred to Leah as a bitch and said that Jenna was prettier than Leah. Liz actually stood up and saluted Aaron on her livestream, thanking him for everything that he has done.

Serge is in Liz’s chat saying “It’s called silence in the face of abuse is complicity. Stand, speak and be the change.”I hope Serge will speak out more clearly too.  
  
Liz says when Natalie suggested that she come to Minnesota a week later Keri was having surgery, you asshole, and you knew it.

Liz says Natalie then tried to run with the narrative that she saved Liz's life by uninviting her to the funeral. Liz says she thought she and Tony were close because they chatted all the time. Liz was in Natalie's chat constantly.

A chatter tells Liz they were disappointed to see how Aaron treated her and Lara. How you saw him talk to us? Multiply that by 10 and that's how he talked to us behind closed doors, Liz says.  
  
A chatter remembers Natalie saying that Tony loved Liz and that he thought she was wonderful. Liz agrees and says she thought Tony was amazing.  
  
Liz says she's rewatched the livesteam a couple of times where Aaron bullied her and Lara. She says she might even release it. After this livestream ended, Liz did make that video public again. It’s titled Oh What A Childhood and Aaron joins the stream at around the 49:30 mark. Lara brings up Liz’s shots at around the 37:45 mark. Very shortly after Lara asks who paid for Liz's shots, Aaron was in the chat demanding to be brought onto the livestream.  
  
Liz says she doesn't fault Natalie for her actions while planning Tony's Celebration of Life. What I do fault her for is her actions since then, she says. She didn't call me. I was in the hospital. They all knew.

Liz says that Aaron would text Nora about what a horrible person Liz was and how she was attacking his work, knowing that Nora would rush to defend him.  
  
Have you ever heard Aaron accept any accountability for anything ever? Liz asks.

Liz says the way Natalie talked about her Tuesday was very cold and calculated. It was almost like she was trying to make her needle float, she says.

Liz says she gets severe anxiety when she flies and I was gonna fly all by my goddamned self just so I could be there for Natalie. Thanks, Natalie, for the invite to your house. I'd rather sleep in a cardboard fucking box, she says.  
  
A chatter says that Pearlsnappy stopped him from going into the Austin org and he owes her his life.

A chatter says people go to a funeral to pay respect for the person who died. They act like it's a party and invites were sent out, the chatter says. Liz says the funeral was turned into a meet and greet. Keri adds they did that so they could put it on YouTube.

Someone else says they would be ashamed to be seen going on multiple trips after being given $39,000 from SPTV fans. Mic drop, Liz says.  
  
Liz says she knows the names of the board members who voted to reject help for her, but she's not going to go over it because those votes were their opinion. It was supposed to be majority rules, but then it turned into it had to be unanimous, Liz says.   
  
If it's true that the SPTV Foundation is requiring unanimous support for grants, that's a very high bar.  
  
I'm thoroughly disgusted by what they pretend to be doing, Liz Ferris says about the SPTV Foundation board. They pretend they want to help people. They pretend they want to help people get out. Aaron doesn't want Scientology to close. I promise.  
  
Liz says Aaron's making Scientology sound worse than it is in his P Diddy coverage by trying to make it seem like P Diddy did what he did because he knows Scientologists. It's not. It's because he's a freak, Liz says.  
  
Liz says her liver enzymes are back to 16 when they used to be at 300. So now I'm gonna live a long life, she says.

A chatter says the people who have resigned from the SPTV Foundation board need to call the state of Florida and get their names removed from the paperwork.

Liz says she feels fantastic right now because she's just letting people know what really happened and what really goes on. She promises that Aaron and Natalie will continue to try to keep up the charade. And that's fine, she says. I got it out. I wouldn't piss on your ass if you were on fire. I got to say it.  
  
A chatter tells Liz that Tony loved her. Tony did love me. And I loved Tony, Liz says.

Someone else says it was obvious how much Tony loved it when Liz would make it rain with gifted memberships in Natalie's chat. Liz says that's because Tony knew Natalie would be taken care of. That's the one thing that he asked me in that hourlong chat that we had, she says.   
  
Keri interjects to say she heard Tony tell Liz to please make sure Natalie is OK. I'm sorry, Tony, I cannot keep that promise and that's sad to say, Liz says.  
  
Eat More Pizza Now sends a superchat that Liz is right. He used to mod for Aaron.

Liz says that she's tired of people pretending and hurting people. Welcome to the club, she tells Marilyn and others. I hope you all get to experience this. She says she hopes everyone will come out and talk about what they've experienced.  
  
A chatter asks how SPTV Foundation board member George LaBanca was close enough to Tony to speak at the funeral when they had only met once, but Liz and Tony weren’t even that close even though they communicated every day. “Just another hole in the story,” the chatter says. Liz agrees.

Liz tells viewers to show some love to DOA and Lara. They're not trying to get one over on you, she says.   
  
A chatter says in all caps that they weren't saying anything about anyone but they got removed from Marilyn's chat anyway. Liz says anyone who mentions her name in Marilyn's chat gets removed. And if you didn't say my name, it's because you support us, Liz says.  
  
Someone tells Liz it’s not up to her to take care of Natalie and that it’s supposed to be mutual in a true friendship. She says Liz’s promise to Tony can be void with no guilt. Liz says she doesn’t have guilt. Keri says she still has guilt because of the conversations that she had with Tony “and how much I knew that you cared about both Natalie and Tony.”

When a chatter asks Liz to keep sharing, Liz says she doesn't know if she's going to do that. She says she will never support the SPTV Foundation, but she will support any other foundation.  
  
A chatter says the people who have been blocked or removed from chats need to unsubscribe from those channels and Liz agrees.

A chatter says So many of us have been shamed, ignored and blocked for trying to make valid points. It's so frustrating. Liz says that didn't happen on her channel.   
  
If you cannot trust someone, don't be subscribed to them, Liz says. But I promise you I did not lie about anything.   
  
DOA puts hearts in the chat for Liz and she tells him she absolutely adores him. Selfless Self says the SPTV Foundation board members personally benefited because their reputations were boosted when they pretended to be magnanimous and generous.   
  
Liz says it's up in the air whether this will be the last video on her channel.

",60,80,2024-10-03 12:57:55,https://www.reddit.com/r/SPTV_Unvarnished/comments/1fv73s1/liz_ferris_warns_fans_and_says_she_was_in_the/,"We can say a lot of crap about DOA, but him visiting Liz and not streaming that (afaik) says he at least cares about her and isn't using her. You know Aaron would have streamed it.

Thank you again OP for your awesome summaries!,I noticed Rabbit has not jumped in to defend Aaron around the board defections guess she has bigger fish to fry....,I have very complicated and critical feelings about this post and Liz’ use of her YT channel for what she’s used it for. Liz is a complicated figure.

But this is genuinely a barn burner of a post. For Liz to say “I think meeting the SPTV Foundation people is the worst thing to happen to me” is an intense statement.

She shreds Natalie, and claims she is just what many people here have criticized her for being.

She is inflinching in her torching ASL. There’s no hesitation. She rehashes the time he dropped in, and pushes back hard.

None of this is a revelation. The only revelation here is that she sees what we have all seen for months. 

Let’s be clear to other followers of SPTV or those on the edge: open your eyes. Read these threads. We could have saved you *many hours* of grievance and frustration.,Well, damn. That was a lot.,Wow. I’m glad she spoke out. She’s the first one to admit publicly the ASL group is like a cult. She may got on the bandwagon seeking money, but I certainly wouldn’t call her “the biggest grifter on YouTube…” A couple others come to mind— 

She’s vulnerable to being manipulated and I believe she felt Tony loved her and vice versa, but it was just another parasocial relationship like Reece has. 

I give her credit for apologizing to Marc and Claire—that must’ve been difficult. She’s made a lot of mistakes, but even coming out with this video was probably also really hard, but necessary to get past it. Hope some of his followers take heart in what she’s saying. Hope she’s ready in case a smear campaign ensures.,Interesting. I've been watching a live with UK Alex and Nora. To say I've been surprised is an understatement. It's actually pretty good. Nora should have aligned herself with Alex and others like him all along. And i have been extremely critical of Nora's behavior the past year. Are they waking up to Aairhead's bullshit?,I wonder how long this rift will last? I'm glad Liz apologized to some folks, but I sincerely hope they keep her at arms length. I wouldn't trust any of these ex-sptv people. 

I'll keep saying this over and over, YOU SHOULD HAVE LISTENED TO US TROLLS ON REDDIT!!!,Absolutely AH-MAZING. Everything that was said about Aaron months ago is now being said as though it was a big reveal. How disgustingly frustrating for all the people who went through complete Hell.,OK, so I'm curious about periphery people in this: Marilyn isn't cool with LF? Is it just blinding loyalty to ASL? Does that explain the apparent rift between Marilyn and Poe? (assuming that's a true) Is Poe still friendly with LF? 

I know this isn't of interest to everyone, but I don't get Marilyn's apparent loyalty to Aaron? Is it all about the almighty dollar? What about having the back of ALL 'second Gems.' Nora and Serge were in her chat the other night... but LF questions/comments are deleted???

Does anyone know where Mirriam Francis is in this quagmire of crap; so much of it kicked into high gear after her interviews with Rabbit. (a topic for another thread) But this post just got me thinking about who is still loyal to whom... and WHY.,Yay Liz!!! Welcome to the club! 


A lot of people were fooled by Aaron Smith Levin, the creepy grifter.,Wow. It sounds as if Liz Ferris is finally coming out of the fog. Good for her. I’m glad she apologized to the members of the Aftermath Foundation but I don’t agree Leah is a bitch. Leah is intense. The two are often confused. 

I think the more Liz Ferris stops keeping Aaron’s secrets, the better she will feel, and the faster she’ll heal. Aaron has been masterful in making people his protectors, drawing them in as quickly as he can, making them think they are special in some way, confidants, coconspirators, part of his team. 

It’s telling that she calls Aaron “sexy” much less the sexiest man she’s ever met. [EDIT! NOT SEXY!! LIZ FERRIS CALLED HIM SEXIST, like a misogynist and that makes 1000% more sense.   I know at least four human women have found him attractive, and that’s baffling enough. I’m glad Liz hasn’t completely lost her mind] I’ve met him and don’t agree, but I believe he acts in ways people interpret as sexy. He is big and loud and stands too close and has Rasputin qualities I find off putting but other people like. One of the perks of  my Autism. 

Meeting Aaron the handful of times I did, I was able to see without any filters what a liar he is. He is as close to a pathological liar as I’ve seen, having met one like him before, who lied for the sake of lying. I have no trouble with her characterization of his group as a cult. I remember looking at the checklist of cult leader qualities and thinking Aaron came up short only because of the sexual promiscuity when everyone knew he had been happily married for decades. This was during the Masterson trial, when he was telling viewers that he was taking time away from his family because the trial was so important. Such a sacrifice he was making for the community. Little did we know, he was taking time away from his wife, mistress, sex tourism, attempts at cheating so off base they were brought to the attention of law enforcement, and who could tell what we haven’t been told yet, all while he was out here cheating. 

I’m thankful I took the time to sit in on the trial and to see Lara perform because it was a crash course on Aaron that spared me a lot of what other people subjected themselves to. They didn’t know how thoroughly Aaron Smith Levin cannot be trusted.,At least shes finally apologising to people. Did she apologise to Stef for inciting hate when Stef tried to help her with a go fund me?,I don’t know guys, this might be my last YouTube video… <rattles tip jar aggressively>,As soon as someone from AMF makes her mad, she'll flip flop. Constant victim mentality. There isn't a good side here. Imo. Shady all the way around the circle.,Everyone of the streamers mentioned in this thread are liars, grifters, and mentally ill.  Plain and simple.  I wish  they  would all check into a mental institution and disappear for good.,You can’t believe a word that Liz Ferris says. She is a liar of epic proportions.,Sorry Liz but your hypocrisy is showing! The biggest grifter on YouTube! The begging never stops! Then you spend it on gifted memberships and toys! Glad you’re not dying but pretty sure you knew that sometime ago. All the self-pitying over dramatic “I’m trying not to die” videos were embarrassing. The lying esp with ZDT is well documented so you can’t be surprised people don’t trust you. A bit of pearlsnapoy and selfish self’s light has faded coz going through so much! 😂🤣🤣. Think they’ve had a restraining order. The way she goes on and on about the love with her and Tony and she was supposed to look after Natalie. All from 1 hour long phone call, never having even met them. This lot on YouTube are sooo dramatic. No surprises about Aaron’s crimes. Just confirming what we knew already but I was surprised by her sheer nastiness to Natalie. I think it was over the top and unnecessary. Maybe Natalie wasn’t being honest but she hadn’t been nasty about Liz really. I can’t stand Liz F. Of course I’m sorry for what she’s been through and I don’t think she’s the brightest and is easily manipulated. Her wife doesn’t seem very nice. She got pally with ZDT too. Also, Liz is on the spectrum so maybe that’s why she can only feel self pity while having no compassion for others? It’s the self pity and constant begging bowl I just can’t stand.,All those taking Liz’s words as true facts deserve to be fooled. Aaron came on her live with Laura because of information that was given to DOA about the SPTV foundation that Liz claimed was not her and in her live last night, she confirmed that it was her who gave him the information, in other words she lied.  Natalie never disinvited her to the funeral she disinvited herself. Natalie never said anything bad about her rather it was she who tried to paint Natalie in a bad light. She tried to double dip by getting money from both the foundation and feral Cheryl who paid for some of her treatment. She makes it seem like the foundation didn’t pay for her treatment and they did, they paid for six months of treatment. She said she has receipts, but yet she wouldn’t show us any and refused to name names that would prove her right that makes no sense. People are so quick to say that Aaron is loud but Laura FM is louder and no one is accusing in her the same. The more you try to accuse others of wrongful acts the worse you look. Pitiful.,THIS ⬆️ 💯

![gif](giphy|14c0YMK7oEVs0o|downsized),I NEVER liked Natalie. I was even willing to consider I was off in my estimation because everyone so universally sang her praises, claiming she was not like the rest of them. 

Note to self: Trust your gut.,Liz owes Mike Rinder a huge apology, but won't go there, probably due to her friendship with Mirriam.  Her criticism of others seemed to be based on alliances rather than objectively basing views on a person's actual actions.,I think Nora did do a few streams with Alex, but as soon as Aaron said he didn’t like him of course Nora also found reasons to attack him as well! 
This sub was called a hate group, now many of them are now saying what we’ve all seen for months ! 
Aaron must really have treated them like 💩 for the likes of Nora to turn on him, there’s absolutely nothing she wouldn’t have done for the guy! 
She’ll never admit it but this group showed her the real Aaron!,I think people are being to  quick to trust Nora. Lets not forget the terrible things she has said about people.  I wont be forgiving her for any of that any time soon.,I've never liked Nora even way back when she first appeared on ASL's channel.,Honestly....have we been wrong about anything yet?,You/we should be frustrated but also relieved that the receipts and questions raised have finally broken through. I had my doubts at times.,Yeah. I just keep feeling intense frustration.,Its a shit show. Honestly they are all such fickle people that seem to align themselves with whoever suits them best at the time.  The people they talk shit about, might be the next people they need to align themselves with because they seem to have no real loyalty to anyone.   Watching this all unfold is like watching a reality TV show in real time.  I dont wish any of them well,  they bought this all on themselves and they really hurt innocent people in the process.,I am not sure.  I think Mirriam is friends with Liz F.  She is somewhat on the periphery of things and doesn't really get support from Aaron, so it is hard to know.,Liz Ferris and Marilyn have a love-hate relationship. Liz was emphatic last night that she felt mistreated and shunned by Marilyn, so I think they're on the outs at this point.

About Poe and Marilyn. [https://www.reddit.com/r/SPTV\_Unvarnished/comments/1fttnmn/marilyn\_cries\_about\_poe\_and\_other\_men\_in\_sptv/](https://www.reddit.com/r/SPTV_Unvarnished/comments/1fttnmn/marilyn_cries_about_poe_and_other_men_in_sptv/)

Here's what happened between Liz and Poe. Liz used to say Poe was like a dad to her. Liz says Selfless Self is like a brother to her. Selfless went into Poe's chat a while back and was upset with Poe for not having more understanding toward DOA's mental struggles and stress after the encampment. Poe yelled at Selfless and said he was causing division in the movement by coming into his chat and derailing a positive conversation Poe was trying to have about stopping Scientology's abuses.

Selfless got really offended and talked to Liz about it. Liz then did her own livestream talking about what happened without using Poe's name. She said what Poe did was one of the worst things she's ever seen. When her fans asked her what she was talking about and where they could watch it, Liz gave them enough hints to know where to find what they were looking for.

Mirriam has been pretty quiet recently, so I don't know where she stands.,I think she called him sexist not sexy.,Just when I like what she’s saying, I will admit I felt myself reaching for my credit card. Just goes to show, what a minefield places like these channels can be. 

I always said I brought home stray dogs, but I would never bring home a stray person. SPTV has turned out to be a collection of stray people sharing all the various ways we could give them our money.,They all are.,I hope her awakening includes an apology to you, Vanessa. 🫂,Reese is the #1 grifter, but liz is a close 2nd! She has a right to her opinion, and it's clear to me at least it sounds like she's gotten chummy with all the people who have turned against sptvf, and she's easily swayed. Again, she has the right to her opinion, but this was over the top, imo and her partner is constantly interjecting. Give the woman a damn microphone and let them do it together on camera. I'm sick of the toxicity in that space, if it all implodes tomorrow idgaf!!,You seem a little over-invested.,DO NOT PERPETUATE THE VILE MYTH THAT PEOPLE ON THE SPECTRUM CAN'T FEEL COMPASSION! Look up the Double Empathy Problem.,[removed],Aaron is a dick and a misogynist being loud is not the issue,I don't think you have been paying attention to everything.  Liz said over and over that the doctors for the procedure would not accept payment from a third party.  So she stopped asking for funds from sptvf at that point, even though Lara said she should still try to get it.  Even Aaron said she did not pursue those funds.  They gave her five months of therapy, then would not give her another month without signing a ridiculous claw back contract.  So she declined that.  Liz is guilty of being self pitying and grifting but I still find her version of events regarding the Natalie situation more convincing than Natalie's.  It just makes more sense since the disinvitation happened right after ASL dressed Liz down on her own show.,I actually loosely remember seeing a comment you left about Natalie months and months ago that I didn’t agree with at all and thought “what’s up with that, she seems like the nice one…” and then I was thinking about that comment the *next time* I watched one of her streams, and it came in to focus. It was suddenly a new perspective of her. So… thanks for that. It gave me a chance to look more carefully.,Mirriam owes Mike an apology too. She turned on him because she had the support of Aaron, Jamie Mustard and Aaron’s monkeys.,I'm not ready to give her a pass yet. She has amends she needs to make to people. I agree with you that this sub laid bare the truth about Aairhead. When he came for her, this sub aligned with everything he does to people, and that's hard to ignore. For all of them.,We shouldn't trust any of them. They have much fuckery to atone for first and foremost.,I don't trust her either, yet. But I think she's capable of change, if she puts in the work and continues to go to therapy. And if she apologises sincerely to Mike, Claire, Mark, Amy, Matt, Chris, Stefani, Mitch, Liam, and any other she has attacked without cause.,Not that I can think of right now. We've been on the right side of history and damn, it feels good!,I’m also feeling anger because now with Aaron’s own followers making the same claims that got some of us so viciously, unrelentlessly attacked those claims are now being treated like new information. Where does this leave Claire, Amy, Mike, me and the others who were vilified? Now people are seeing Aaron IS who we said he was months ago. The reasons (not there truly were any to begin with) these people attacked now no longer stand up. This makes the pain inflicted even more senseless. So Liz apologized to Claire. Good. That needed to happen. But the ugly videos are still out there. The thousands of comments, attacks, threats and more by people who went along with what Aaron told them are still there. Liz Gale jumped right on the Aaron bandwagon, now she’s jumped off the SPTV board but no admission of wrong doing. Marilyn Honig acted entirely because of Aaron and his minions. Where are the apologies? Liz Gale just posted that ridiculous video of her crying. OK. But when I spoke to her on the phone and started crying because of all the bullying I was receiving she basically told me I brought it on myself. To this moment I still have not received ONE, SINGLE ANSWER to my challenge to any of them to show actually proof of anything I wrote that makes what they did to me justified. Oh but Liz Gale cried and Liz Ferris is generally sorry. People are jumping off Aaron’s ship like rats leaving a sinking, but does not one of them feel any remorse for the terrible, horrible things they did in his name?,Wow, that’s a lot that probably could have been solved by a FaceTime. Some/all these people are using the drama in some way mostly for 🤑 as we all know. I just don’t get why Marilyn. or even Poe, just don’t move on. 

Where’s Kelli Copter these days? Is she still aligned with Marilyn? Any statements on SPTVF given what was said/revealed about TAF.,Please stop calling aaron sexy..literally makes me feel sick.,She called him sexist. Liz definitely doesn't think Aaron is sexy.",,false
