,post_id,subreddit,title,text,score,num_comments,created_utc,post_url,comments,image_urls,over_18
22,1mbti0p,Turkey,Sad from vacation in Turkey,"Hello. Me and my friends are on a vacation in Turkey and sincerely we feel like everything is going wrong. We have been here for 5 days and we had like 3 interactions where somebody  wasn't trying to trick us in one way or another.

We landed in Istanbul. We booked in Sultanahmet and yes I have later read that's a mistake but still.... I have read the other threads on here about taxi scams, but using Uber as was recommended doesn't help. We were 5 so we needed a bigger car. Calling a bigger taxi means you pay almost double... But you get a classic cab with the guy telling you no problem no problem and asking 500TL for a toll, in cash of course. 
Thanks to reddit and all you guys I knew better but still an Uber from airport took us the long way an the app made us pay 60€ instead of 40€ to which there is no solution.

We rented a car online beforehand via Avis. We made it to the office and they told us that our car was broken and we have to take a different (worse) one. We saw the car we ordered in the parking lot and learned that it had broken engine... 
I wasn't having it and came back to the office looking very angry showing the guy how much we paid and that we (5 men packed for an 8 day trip) ordered a bigger car for a reason... 
Thankfully my yelling magically fixed the car without anyone touching it and we could leave in a car we actually ordered and paid for.

On the way to Izmir we ate at a few restaurants which had good reviews. The food is wonderful and the prices were about 300TL for a plate which is also great. However we were given free (we asked) water by a young boy before our meal which ended up being 200TL per 0,5, and they charged us for 6 even though we only had 5... The food was good and we wouldn't have a problem paying the final amount anyways, by why the tricks?

We went to Kaş and stopped to Efez. The entry was a shocking 40€, half of what was advertised online was unaccessible and blocked by ropes. And as a final insult there is a museum in the middle which is extra 15€. We were so excited and left so disgusted.

Kaş is nice. We went to a 8 hour boat trip and to be fair it was absolutely fantastic. But it still wasn't what was advertised. The website promised a vivid underwater paradise full of fish and lush nature but the spots they took us to were more like an underwater desert. With very little life.

Our priority was a great diving dventure which we didn't quite get as promised. But the price of 2000TL was more than fair and the crew was nice.

We plan to go to Antalya for the last few days so we would more than welcome any tips and advice from you good people of Reddit.


The whole trip makes me sad. The point of a vacation is to escape the stress of working all year just for a couple of days, but so far everything and everyone made us feel unwelcome and anxious. You always have to think 5 steps ahead so you don't end up robbed whenever you talk to someone. We are just 5 students from Slovakia. We aren't exactly rich.

I skipped most of the scams and uncomfortable situations just to keep it somewhat short. We probably won't ever be coming back as not much pleasant has happened to us so far.

I absolutely don't think Turkish people are bad or anything. I love your culture, your history.... The cats and dogs taken care of in the streets are a proof that you have big warm hearts... It's just that we have never been eneywhere so hostile to tourists as here before. You can't trust a man in a shop, waiter in the restaurant, not even the biggest car rental in the country. :(",449,313,2025-07-28 21:49:31,https://www.reddit.com/r/Turkey/comments/1mbti0p/sad_from_vacation_in_turkey/,"These are all normal for turkish people too. They charge us for water like that and you have to argue with people to get what you want like at the car rental place. Tolls are extra in cabs so that's normal too. Although they add on top of the total and ask extra if you want to pay by card. 

Museums are expensive for tourists and cheap for turkish people who has museum cards. 

So overall your experience is what we get too so good job on not getting too scammed. That's life in Turkey. So they were not specifically hostile to you so far.,Nothing went wrong with your vacation. This is the new normal in Turkey.

The only way you can truly avoid being scammed is if you guys stick to the supermarkets for food and solely use public transportation.,Sorry that you had to experience this. I felt the cringe of our people while reading it through. That's why tourism is dying in Turkey gradually and I have little respect, if any, to the business owners in those sort of areas.

Just be upfront and agree to a price in advance for any service you are getting, whatever it may be, and if they come up with extra fees, just argue that you didn't agree to it. You don't need to be aggressive of any sort, just be the jerk and reject to pay if something doesn't sit well with you.

Hope you at least enjoy the last few days in Antalya.,Funny thing is, I feel the same way as a Turkish guy vacating here. It has only gotten worse in the recent years, the comments above explain it perfectly. Year by year, tourist numbers in places like Alaçatı, Bodrum decrease for this. Sorry to hear you had a disappointing experience, but I would prefer Greece for a while.,turkey is home to a very low trust society, tourist or not, though being a tourist obviously severely increases the chances of somebody trying to rip you off. the government is an extremely corrupt islamic dictatorial kleptocracy and the rule of law is simply nonexistent at the moment.

to put things in perspective for you, i, myself as a native to the country have never even thought of vacationing in turkey for the past 10 or so years simply out of fear that i'll be fleeced or otherwise harassed.,These Egypt like reviews are becoming more and more common. Sorry for your bad trip, people should talk more about this,New Turkey is a terrible place for a vacation tbh :(,Kendi vatandaşını sikmeye çalışan tipler ,turiste neler yapmaz.,Unfortunately there is nothing wrong with your vacation experience its just the way the things are in turkey even i as a local get scammed regularly or paying abnormal prices,Tell your friends and let their friends know this: 
Do not come to Turkey UNTIL Erdogan gone!!,For anyone thinking to visit Turkey. You can't trust anyone who you dont know beforehand, every ad is a lie, everything is overpriced, and especially everyone in touriatic areas are trying to scam you.

You can workaround this by being accompanied by locals you trust, have them rent air bnb and cars for you etc.

Or you simply can go to Greece.,My suggestion is go to Greece next time. It is fantastic there. I prefer Greek islands as a Turk. I am sick and tired if our scammers. In greece people are nicer prices are cheaper. Sea is cleaner than Turkiye. There is no taxi scams and so on.,As turkish, I can't stand it anymore and also not living there anymore.I do not recommend in any Case,İn addition to all those comments i agree with, please don't forget to leave 1 star comments on maps and other apps if you use them- each of you. That helps a lot for the newcomers.,Been there 2 weeks ago for the first time in my life. I always told myself I won’t be going there because all what I was hearing about bad experiences people had there. I experienced it hands on. Not a day went by without someone trying to scam us. Doubling the service charge at the restaurants. Additional items we never ordered. Insane taxi drivers. Good I was vigilant and aware of such behaviors. The worst is that they call themselves Muslims!,[deleted],Under Erdogan our country and people are getting worse and worse.  ,Entry price for Efes seems normal to me, if you have ever been in Greece you probably know that Acropolis which has at most 1hr total walking time is 30€. This type of places tend to be expensive for foreigners, super cheap for the citizens. Not saying it should be like this but it is what it is. 

Traveling in winter, early spring is the best time too. We learn from our mistakes and we learn to avoid cons as well.,Sorry for your experience op. Things have been going downhill in Turkey because of the ongoing dictatorship of Erdoğan. He controls the media and half the country worships him, the other half suffers the consequences. 

There’s still good people out there. Try to push back when you sense someone is trying to take advantage of you. And make the best of your vacation. Antalya is a gorgeous city.,Currently on holiday in Antalya. The waters ports guy wanted 90euro for 10mins of jet ski 😂😂😂
It was half that in Cyprus last year.,[removed],Tbh unfortunately 500 TL taxi in Istanbul doesnt sound out of ordinary. The rest is fucked up tho,Really sad to read (especially since I work in tourism). I know you shouldn't have to but maybe next time you should use the service of a reputable travel agency. They would organize all the trip for you, the way you want it.,Same thing happens to turkish people as well. This is why turks are picking countries like greece to have their vacations instead of going somewhere in turkey. Wish you asked in this sub instead of only sticking to reviews, we wouldve told you to not come.,If you’re going to Antalya, maybe try places like Kaleiçi (the old town) for a more chill vibe,Disgusting. I'm really sorry for this. I feel embarassed.,very sorry to hear that but the government is taking so much from the Turks so they are desperate .,In recent years, the tourism sector in Turkey has largely been handed over to Kurdish gangs, known as hırt, which has significantly led to a decline in quality. I'm sorry you had to experience this. The Turkish people are by no means happy with what's going on, but without proper oversight, things end up like this.,Dobrý deň my friend (a Turk living in Bratislava) I'm sorry for your experience.. Even as a Turk I come across few annoyance like this, they stained beautiful vacations. Therefore despite having all those flights from Bratislava to Turkey I'm going Greece for summer vacation which is what I lately suggest to my Slovak friends. Anyway hope rest of your trip will be scam free,As a Turkish guy I feel sorry to say this but next time you should prefer a Greek Island close to Turkey like Kos, Rhodes, Chios, Lesvos or Samos. Same geography, same sea, almost same food(except some special kebabs) yet cheaper, a little lack of history and culture sites, definitely better night life, very few scams and you can meet with higher middle class Turkish Tourists in those islands. 

Apart from that If you are more than five people best way to enjoy Turkish Seaside is Blue Tours, Mavi Tur) minimum 4 days max 2 weeks, you can enjoy swimming, snorkeling in best coves of Marmaris, Datça or Gökova Bays while eating delicious local food prepared by captain or crew on Traditional Goulette (gulet) Sailboats with 2-8 double cabins. Some tours goes to closre Greek islands like Symi, Rhodes and Kos a bit pricier than local ones yet still worth it.,Tourism in Turkey has been deteriorating rapidly. Never mind the shopkeepers or people working in tourism anymore—there’s simply no morality left. 

Everyone but everyone is trying to scam whoever they can. Even someone you ask for a lighter on the street will ask you for money afterwards, and if you refuse, they’ll say things like, “I just got out of prison, don’t mess with me, give me the money.” It’s terrifying.

Many people think that, Turks travel abroad for vacation because they don’t have money. But in reality, it’s not because they can’t afford it; it’s because they want to relax, have fun, and enjoy their vacation without being constantly harassed—and to pay a fair price for the service they receive.

It makes me sad. I’m really grateful that when I was a child, our family traveled all over the country on a teacher’s salary. Now, even though my spouse and I are both engineers, we have to think ten times before planning a trip within Turkey.,I would never visit a muslim country,[https://www.reddit.com/r/istanbul/comments/1mbg6vj/in\_istanbul\_feeling\_lied\_too/](https://www.reddit.com/r/istanbul/comments/1mbg6vj/in_istanbul_feeling_lied_too/),I hate to say it, but go to Greece next time. I’ve been to turkey 20 times at least and I absolutely love the country, culture and people. But tourism is fucked now. Until the tourism culture changes (back), avoid Turkey. ,Hey btw I’m in Poland rn but I will return to antalya tommorow and I am a local there. If you have any questions or anything about Antalya you can text me. Have a great holiday and sorry for what happened.,Im sorry, but when you decide to support a dictatorships economy, i dont think you deserve anything better than this.,Spend your holidays in Croatia/Greece. More cheaper, higher quality, more beautiful nature, more beautiful/honest/hospitable people and so on...,[deleted],>We plan to go to Antalya for the last few days so we would more than welcome any tips and advice from you good people of Reddit.

Looks like noone focused on this part.

Assuming you still have that rented car.

Go to Çıralı beach(https://maps.app.goo.gl/8MYSu8WoA1tb1YzKA). It is a very good beach and what makes it unique is that there is a pretty impressive ancient city (https://maps.app.goo.gl/Jj1CEgkZWT5xXVEi7) at the south end of it a bit inland. You can walk to it from the beach. Yanartaş(https://maps.app.goo.gl/BbaMeoPgvtpT5zU28) is close to this beach which is a place where natural gas leaks from the ground and creates flames. If you go there wear comfy shoes because it involves some climbing.

Phaselis ancient city(https://maps.app.goo.gl/WQQvgggXcPiT9vAu6) is also nice and this one is even closer to the sea but you need to pay to enter it and there may be a queue at the entrance so if you want to go there go early like 9am. This ancient city is smaller but the beach is equally good.

You can also swim in Antalya center. I am not from there so I don't know which is the best place to swim in the city. I swam in Konyaalti sahili which is a long sandy beach. It was fine.

Antalya old town is the main touristy place for restaurant and bars.,I’ve lived in Antalya for 8 years, I could give recommendations but it depends on what you’re looking for? Where are you going exactly there? What activities do you want to do?,Sorry for your bad experiences, there are good people too but most of them are corrupt, think of easy profits cause of the economy, next time try to find a local friend/free guides/coachsurfing and when you’re eating check other people’s tables too, personally i never accept water from restaurants, youre travellers its always good to carry a bottle too for hydration and for savings , peace,Not disagreeing with this, but if everyone tries to scam people in turkey, how is that erdogans fault? Seems like its a culture thing,That is because the kurdish mafia took over the holiday places. Before these years they were not living at west. Their place was east of the country. But now they took over shops and taxis and restorants. Even turkish people dont do vacation at their own country. Turkey coasts are better but we are going to cyprus or greece islands,turkey is bigger then only istanbul or other major city's and also all scammer's are immigrant's you should visit smaller city's which are cheaper very tourist friendly and would welcome you because they get very low international visit alao hotel car cost is very cheap ,I have visited Turkey loads of times. Lost count, but I do know how you feel about being scammed and disheartening it is. When we first visited Turkey, we were seriously put off. Every other yellow taxi wouldn't put their meter on even after telling them. Every other restaurant would charge over the odd for food.  At the end of the first time we visited, we vowed never to visit Turkey again. At the end of the trip, we were tired of being stressed about working out how much stuff cost. And looked forward to going home. After a few years, we decided to give it another go. A few days in, nothing had changed in Istanbul. But lucky we met a local Turkish man who spoke good English. He showed us how to get Metro cards and network links for tram and rail. Public transport is really good and easy to us. He also showed us the best places to visit and authentic food. Main thing at 'normal' regular price. We don't eat at any place if the price isn't shown. We won't even order the drinks till we know how much it is. Some restaurants in Istanbul have two menus. One for tourists and one for locals. We have now made a few friends and don't entertain the tourist areas or taxis. Worst thing is - all they do is put people off coming back or recommending Turkey. But I would definitely recommend coming back but researching the public transport.,That's just how Turkey is now, i used to come to Bodrum for 2 weeks every year (i live in London) and it used to be great but specifically 5 years ago it started being shit and i haven't been back for 3 years now.

I would suggest going to the greek islands or southern italy etc. Tourism in Turkey deserves to be punished and die out.,In terms of scamming and ripping off people, especially foreign tourists, Turkey has always been like that, sadly. I’ve witnessed it so many times back in the 80s and 90s too! 
But at least it was more affordable for people to go on holiday and a cheap touristic destination for people who earn euros or dollars. Now it’s not cheap for them either! 
I’m sure the number of tourists has gone down over the past few years, as it should.,Same here. We were scammed by the hotel we booked and we were placed in another hotel. Do not ever book Galley Hotel, they’re scammers and won’t even return our money.,Stay away Kurdish people so all will be ok,use Martı instead of Uber, where you will agree on the price beforehand. But you need to pay cash or bank transfer",,false
