,post_id,subreddit,title,text,score,num_comments,created_utc,post_url,comments,image_urls,over_18
0,1leprps,BestofRedditorUpdates,My [27/F] GF [30/F] hasn't had a job in 4 years and it's wearing me down,"**I am not The OOP, OOP is** u/[Epicyclez](https://www.reddit.com/user/Epicyclez/)

**My \[27/F\] GF \[30/F\] hasn't had a job in 4 years and it's wearing me down**

**TWs**: >!Financial Abuse, Emotional Abuse/Manipulation, Medical Neglect!<

**OOP Posted to** r/relationships

[Original Post](https://www.reddit.com/r/relationships/comments/jjb9kf/my_27f_gf_30f_hasnt_had_a_job_in_4_years_and_its/) **October 28, 2020**

Hi everyone,

I started a LDR with a girl I met through a friend, which lasted about a year, and culminated her moving across state lines to be with me in the city. Everything was great, and we were truly in love with each other. Because she moved across state lines, and because she expressed the desire to leave her toxic field of choice and try her hand at something more banal, I agreed to take on the burden of supporting her for a while until she had a job. She would take on most of the cleaning and groceries etc. while I was at work. I even agreed to sleep on a mattress in the kitchen because she had chronic insomnia problems and required very specific constraints under which she got sleep (I could not tolerate these while working).

I feel like I've done everything I could for her, including taking care of her expensive medical needs, which destroyed my savings. After around 1.5-2 years, I started to develop an anxiety disorder under the stress of supporting her. What had at first been something I was willing to do out of kindness and love quickly became a consent issue, and has turned into a burden. Fast forward to now, 4 years after she came to the city, and still no job. I am a nervous wreck, and I feel completely emotionally run down by the burden of supporting her. I've destroyed my body by putting on weight due to the stress as well. I used to be pretty happy and carefree, but now I'm just depressed and anxious all the time. We have a nonexistent sex life because my sex drive has tanked completely. I don't know what to do because I still love her and we have a loving romantic relationship otherwise. She's never really done anything... wrong... if that makes sense. She's been loving, helpful, and genuinely seems affected by not succeeding in finding a job and helping shoulder the burden.

I never really cared for my mental health much before, but it's really starting to affect me. I've become emotionally unstable, and sometimes the stress and resentment come through in my interactions with her. The hardest part about this is that I can tell she's trying and just... failing. I've tried to help and I've been rebuffed several times and only able to help a bit, but otherwise, she hasn't done anything wrong. If she has, I haven't been able to tell what's she's doing wrong in particular, because I can't and don't want to be there 24/7 to monitor every job application! But I am resentful because I feel like I've sacrificed everything from my body to my mental health to make this relationship happen, but it's just not happening. What do I do?

To make it clear, this is a big, deal-breaking issue for me that I've told her is my primary source of stress and anxiety. I don't see much change, and I think she's too ashamed at this point to give me updates, which just compounds my stress because of the radio silence.

tl;dr ldr gf turned irl hasn't had a job in 4 years and I've gone from happy to anxious wreck supporting her. What do?

**RELEVANT COMMENTS**

**nafets\_xx**  

>How is she failing? To what kind of work is she applying? What field did she leave? I understand you love her and want this to work. Based on what you said, this isn’t her taking advantage, she’s just having a hard time. However, you are too and there needs to be a solution if you want to stay together. Why can’t she take SOMETHING just while she searches? I imagine the four year gap is working against her, she might need to start from scratch.

>Also, you need help. As in, help taking care of yourself and your finances. If she can’t get it together, maybe she needs to go home for a while so you can get a break. Re your emotional state, I don’t know if you’re insured, but perhaps speak to a therapist.

>Good luck, friend.

**OOP**

>>How is she failing? To what kind of work is she applying? What field did she leave?

>>She has an MBA, but she doesn't seem to be getting any responses from recruiters, and hasn't been to a single interview in the 4 years. She left politics after 13 years (starting from teen volunteer), so this is a huge shift. I believe she's applying to Director-level or senior level positions, but I can't confirm it. I know that this would be a huge error if it were true, but like I said, I'm trying not to micromanage how and where she applies to, hoping she'd do the right thing on her own.

>>Based on what you said, this isn’t her taking advantage, she’s just having a hard time.

>>I'm inclined to agree with this. I'm fine with temp jobs, but I previously asked that she not take a minimum-wage hourly role, because I thought it'd be a waste of time and a bit of a cop out given her experience and degree. That may have been a mistake.

>>Also, you need help. As in, help taking care of yourself and your finances. If she can’t get it together, maybe she needs to go home for a while so you can get a break. Re your emotional state, I don’t know if you’re insured, but perhaps speak to a therapist.

>>We've done the week long break thing before, but it seems like I need it every quarter or so to stay sane, which is a big ask. I am insured and I've recently started going to a therapist where I'll be talking about this stuff. I've previously asked GF to go to couple's therapy, but she's against it.

\~

**Additional comment from OOP**

>>You can be a safety blanket but not an enabler.

>>I believe I made a mistake which erred into the enabler territory. I was expecting that if I removed all barriers to success, then she would be successful. However, that didn't seem to have an effect on the outcome, and I wound up failing to advocate for myself instead.

>>Talk to her OP, set expectations and tjme- bound goals.

>>I spoke to her tonight about professional career counseling. She is going tomorrow to see one. This weekend, I'm going to review her applications and resume. In the meantime, I've set a 2-3 month deadline (technically, January is her 4 year anniversary). We haven't spoken about concrete splits, but I did make it very clear that 4 years is unacceptable, and that, while my thinking has been when she gets a job, I've started to think about what happens if she doesn't get a job. And I think the situation calls for breaking up, because it's simply not healthy for me, mentally or physically.

>>Has she taken online courses, certifications? Free self-directed resources or improvement books? Mock interviews? Networking/cold emails?

>>We've been over certifications and online courses. At one point I pointed her in the direction of Project Management certifications, but she didn't show interest in following through with the certs. She does not network, but she does do cold emails, and tries to work with recruiters. No mock interviews.

>>Four years is not an acceptable gap, she needs to start. She needs to be held accountable with follow through and/or deal with repurcussions. You know she can flourish.

>>I agree. I haven't been good on accountability, but I think we're at that point.

[Update](https://www.reddit.com/r/relationships/comments/qb0cip/update_my_27f_gf_30f_hasnt_had_a_job_in_4_years/) **October 19, 2021 (Almost a year later)**

TLDR: Broke up. She was taking advantage in the last two years.

I posted about a 4 year relationship causing me mental, emotional, and physical health problems due to said partner failing to find a job or contribute to the finances in any meaningful way. I made the post at the height of the COVID in my area, trying to keep the relationship alive. At the time, we had moved to a new state and a smaller town to live more cheaply, and to help address my physical needs that couldn't be met in the city with everything and everyone locked down.

Things were good for a few months. However, the job question came back again. I was working full time, and had taken on new responsibilities for keeping myself in shape, working hard to lose the weight. That's when I noticed she was just kind of... existing. She wasn't excited about anything in the area, and wasn't doing much to find jobs. I had a talk with her in October, and we agreed that perhaps my request that she find a salaried 9-6 job could be relaxed, and part time would be sufficient to help out. After all, I only needed two things from her: space from time to time, and her to help out in any way she could with the finances.

The first of two final straws occurred that winter: I was working to build a new business from scratch, and I had to leave my job in order to do it, which meant around \~4 months of negative income. It was going to be tight, but she agreed to help support by finding an easy job. This support never came. She couldn't do it, or didn't want to. I began to notice it felt more like the latter. As a result, we barely made rent in February, thanks to my taking on contract work on the side (effectively working two jobs).

We had a huge fight in February over this. I wasn't willing to be that close to being homeless just because she didn't want to work a job that was beneath her qualifications. I made it explicit that this was a deal breaker for me, and that I would not move an inch in the relationship until she started contributing in the way we discussed. She agreed.

Another 5 months went by with no job. At this point, frustrated with her lack of success, she asks me to move with her to her hometown and move in with her parents while she looks for a job where she had a network. I flat out refused and we went on break. I moved to a new state and hoped that maybe some space would allow me to think clearly about the relationship.

By September this year, I realized I felt completely happy to be on my own, and stress free. We broke it off completely. To my knowledge, she still doesn't have a job as of this post.

I feel used, emotional, physically, and financially abused, and hurt by how casually someone could run me into the ground like this. But I also feel hopeful about myself, and I'm seeing a therapist who's helping me unpack it all. Further, my business was worth it, and it's taken off and given me enough time and space to deal with all of this while maintaining a healthy lifestyle.

Overall, the biggest downer is I feel like i've just wasted 5 years of my life with someone who I'm fairly sure was a subtle abuser the whole time. It hurts to say it, but the way I always felt like the bad guy, or the way she would guilt trip me and keep me from my friends... bad news. I'll never let anyone do this to me again.

**THIS IS A REPOST SUB - I AM NOT THE OOP**

**DO NOT CONTACT THE OOP's OR COMMENT ON LINKED POSTS, REMEMBER - RULE 7**",4421,331,2025-06-18 19:11:29,https://www.reddit.com/r/BestofRedditorUpdates/comments/1leprps/my_27f_gf_30f_hasnt_had_a_job_in_4_years_and_its/,"I got as far as agreed to sleep on a mattress in the kitchen due to her insomnia and knew exactly where this was going 😑,I can’t believe no one queried the mattress situation. Was OOP still being expected to sleep in the kitchen after 4 years?!,She was applying for director-level positions at 26, with an MBA and political experience that started in her teens. That is sheer insanity.,Good job on OP for leaving but damn… FIVE YEARS?! I don’t think I could last a year with an unemployed partner.,[deleted],Admittedly I don't know much about MBAs, but my understanding is that the most useful ones both cost an absolute bomb because it's more about the networking than the education, and they require you to have a couple of years of work experience before even applying. If the GF's MBA doesn't fulfil these, alongside her general unwillingness for whatever reason to find a job I'm not surprised the MBA didn't do any favours.,You know… I’ve been disabled for some years now and am highly qualified in my fields of expertise, but even I know that if you’ve been out of work for that long you need to restart at the bottom.

She could’ve done literally anything to help out but seems to be the type to not bother with it if her needs are being taken care of. Just… staggering levels of selfishness, even from the day she moved into OOP’s place,For the record in case anyone runs into this in a current year relationship, with some rare exceptions for particularly oversaturated fields or difficult-to-employ people (e.g. felons), it is extremely unlikely that someone actively trying to get a job would be unable to for YEARS, especially near the end when they were discussing anything that brought in money.

If your partner has been unemployed against their will for multiple years, the odds are pretty good they're using you.,Oh poor OOP! Being used like that really creeps up on you slowly... But dear God, never EVER let a partner of only over a year cause you to dip into your savings!,It would have been over for me the moment I had to sleep in the fucking kitchen, oof,[deleted],I have an MBA and the idea of trying to get senior-level jobs with an MBA and no relevant work experience in whatever field she was applying to is absolutely insane. An MBA alone without experience is pretty much useless for anything but entry-level jobs, which still pay way more than part time minimum wage jobs. How did the OP not realize for four years that there was an in-between option?!,>I believe she's applying to Director-level or senior level positions, but I can't confirm it. 

Please

I've met doctors who **had** to work cafes or something while figuring themselves out in another country

Clearly she was just hoping to **not** have to work at all

5 years, OOP?

Dang,desire to leave her toxic field of choice 

and she's applying to Director-level or senior level positions

\^\^\^ That isn't how it works when you change fields. (I also changed fields after burnout.) You start over, you can't expect to come into a new field as the Director!!,Wasting 5 years on someone is bad, but not as bad as wasting 5+ years on someone. 

Good for OOP,Hobosexuals really do know to pick their marks. ,I have a friend who went through this.  Wife finished medical school but didn’t get either residency she applied for (she only applied for 2). Then spent the next 2 years unemployed because all jobs are beneath her because she’s a doctor.  Then they divorced because she was just lazy (also refused to clean because people who go to medical school don’t clean toilets) and she moved back in with her parents. That was several years ago abs last I heard she was doing Botox clinics at some hotel on the weekends.  No one in the friend group missed having to deal with her.,Lesbians think being single is a fate worse than death.,She sounds like Cousin Eddie. Holding out for a management position.,JFC what a black hole that woman was. Just a black hole of needs and weaponized incompetence. Glad she got out, and that she's seeing a therapist. She seems like a great person, I'm sure she will find someone more on her level.

Edit: didn't catch oop was a woman.,An unemployed *spouse* is one thing, but a boyfriend/girlfriend? Nah. 

We'd have been done a long time ago.,I was flabbergasted how long OP put up with this shit until I realized they were a lesbian. Then it fit together like a set of fuckin' legos.,Anyone who's out of work for four years isn't actually trying. Finding a job is actually not that difficult. Finding a job you LIKE is the hard part. Finding a job where you're supported, paid well, good culture, good benefits, room for growth, and which gives you a sense of satisfaction, that's difficult. 

But finding something, even part time? Not that difficult if you actually try and apply for everything. And I mean EVERYTHING. 

The fact she had an MBA but no experience using it, and was demanding high-level jobs? Yeah, she was doing the bare minimum application to keep him off her back so she could continue taking advantage. I'm glad he finally woke up.,4 years without even an interview is almost impossible if you're actually trying. Then I got to she's applying for director roles well yeah, bud, an MBA and some years in the political field alone won't get you the role of a company director. The job market is brutal I'll give her that, but frankly if you've not had a single response from a recruiter in 2-3 months you need to be evaluating your approach thoroughly. ,Applying for senior positions in pursuit of a career change while doing zero networking is the behavior of someone who has no intention of getting a job. Absolutely hobosexual of her.,Some people are their own worst enemy. By the end of the first paragraph it was clear OOP was one of those people. 


And NGL I find her lack of accountability annoying. Sure her GF absolutely took advantage but OOP let her. Because let's face it she initally enjoyed being GFs savior. It was only when that wore thin that she decided GF was into subtle abuse. SMH. ,People like this girlfriend piss me off. And this makes me feel horrible at the same time. I am permanently disabled due to MS and my only contribution to our family’s income is what I get from disability benefits which isn’t much. I have spent the the last decade and a half raising our son, but at 15 he doesn’t need a lot and he’ll be off to college soon. 

I get so angry when I read about people like OOP’s girlfriend. How can they run their partners into the ground like this? How can they take advantage of someone they profess to love? What did *I* do to deserve MS (when I desperately wish I could work)  but they did not, despite watching their partners wear down to their bones? In my final years I took a job that was “beneath” my qualifications - I have an MSW and was a practicing therapist, but I switched to working as a mid-level manager at my family’s home improvement company because it met my growing medical needs. Eventually I couldn’t even do that anymore.

It’s a shame I can’t switch medical needs with this woman.

Sorry for the word vomit/rant, im just awake dealing with one of my chronic illnesses and I needed to scream into the void.,This makes me wonder if the ex truly had a job and a real MBA beforehand or she was just lying to OP,Why on Earth would OOP quit their job to start a new business with the assumption that she would get a job to help... when she hadn't in 5 years?

I mean I know she is the one in the wrong but it doesn't seem like a smart business decision to rely on someone who hasn't worked to suddenly get a job.  It doesn't sound like they had enough money saved up to do that either if they only made rent because she was able to get some side-jobs done.,I'll never let anyone do this to me again.

Good. Glad to see the OOP finally left. Better late than never.,Ah, I’ve been where OP was. Am now divorced and dealing with a $150k loan that I’m repaying by myself.

I’m glad OP got out as fast as she could and came out relatively unscathed.,I was laid off 2 months ago and I'm still looking for work. **4 years** without a job would be a nightmare to me.

But what this woman put OOP through? **YIKES**. OOP deserves someone better.,I've  noticed posts with long term unemployed people, they think they're too good for a normal job and think they deserve to be top management without experience.  Too bad they never think they're too good to be bums.,>I'm fairly sure was a subtle abuser the whole time.

Ma'am, it wasn't subtle.,So I've had gaps of unemployment for various reasons. Actually trying and not being able to find a job is devastating.  The job before my current I had to take a huge pay cut and do what waa essentially an entry level job in my field. But that is what you do.

I think it was very telling she wasn't getting call backs. Also she is an MBA at 26. Even if she had relevant experience she wouldn't have enough for senior level roles. She sounds like a caricature of an MBA with too much school and no experience.,Think this resonates with me because I have a similar ex/friend.
 
I've known them for 10 years(they're 35 now) and they've never held a job longer than 3 months at a time. Always comes up with an excuse too like oh my boss was transphobic or they're out to get me because I spoke out against xxx and similar stuff, then stays unemployed until they get kicked out and have to couch surf in whatever state the next sucker is in.

It sucks because they're an amazing person to talk to and hangout with but after the 3rd rotation of this happening you start to question how truthful they are as a person and if they're putting up an act to get an in with their next mark. So now they're permanently relegated as someone I don't take seriously outside of letting them vent

Definitely put my blind optimism down a peg for the better though,When you’ve been unemployed for 4 years, no job is “beneath” you.,Dude. My wife hasn’t worked in over 20 years. I didn’t want her working. 

But that woman you gave us a parasite. Also I only read a bit if this. It’s too long. Sorry. Cut her loose.,I cannot—absolutely CANNOT—believe I'm saying this but... fuck me, here goes:

Those supporting comments? The ones scraping for excuses and soft-playing the obvious problems? Yeah those are _fucked in the head,_ and never ever would have been made (rightly!) if her partner was a dude.,The audacity of this leech to ask OP to move into her parent’s house when asked to simply get a job.,It is not possible for an able bodied, mentally able person to go 4 years without being able to find a job without it being willful. Not in this country and time period. Even if it's some piece of shit job a person who isn't taking advantage of the position would find something at some point to be able to contribute something.,Too bad she was slow on seeing how she was being used. 

For some reason there are high number of under 35 women that think an SO should support them in all ways and their mere existence is reward enough for that. Have to act faster when come across those.,5 years of simping and being taken advantage of... The only brightside is she didn't put a ring on that finger.

I hope OOP _never_ forgets this lesson.,Interesting how the real info is dropped at the end, the controlling behavior and guilt tripping. ,She was holding out for a management position…,Crazy how OP never realized she was being used and taken advantage of until the very end. Her gf was NEVER looking for jobs,As soon as they said that the girlfriend said no to couple's counseling, I knew it wouldn't last. When one partner says, we need help communicating, and the other partner says, no, we don't need that you know things aren't going to get better. I'm not saying that couple's counseling is a magic cure all, but rejecting it when requested is a sure sign that things are not going to get better.,What a terrible fucking human being. How can you treat others this way and see how they suffer? Fucking gross.,She got a free ride for 5 years. I’m not saying that’s what it started out as, but damn she didn’t give a shit what kind of stress, or anxiety she put you under.,Maybe it's just me, but it's wild to start taking care of someone financially only 1 year into a relationship.",,false
