,post_id,subreddit,title,text,score,num_comments,created_utc,post_url,comments,image_urls,over_18
36,l5t6dl,WorkOnline,United States. Husband and Father Looking for Low-Stress Online Work,"First and foremost, this might be a bit long so grab a snack and something to drink. Little bit of background, my wife ended up losing a job she had for a little over a year for an absolutely stupid reason and ended up getting another job a week later. However, her new job wasn't quite what she thought it'd be so she ended up quitting because she didn't feel comfortable there. 

Since the pandemic hit, I've been the one who's been staying home with our daughter while she's been doing her virtual school work because we don't want to send her back to school until all this mess is done and over with. My last job ended in December of 2019 and as luck would have it, the pandemic hit only two months later. Since all this stuff has hit, it has opened my eyes to some things I haven't realized about myself or haven't seen as severe as it has been. I've always known I've had some form of depression and anxiety and since all this has hit, it's made me become even more leery about going out and facing any sort of crowds or being around people in general. It's made me take a look at how I've been pre-COVID compared to current-COVID, and it turns out I've always been uncomfortable around crowds and people in general because of my anxiety (I've been known to have anxiety attacks while out during COVID and even some pre-COVID). I also have some form of mobility problems from a previous work related injury where I have to use a motorized cart to get around in the store, whenever I feel brave enough to go that is. 

So right now, I'm looking to find a job that is as low stress as possible. I'd prefer to have as little interaction with people as possible and I don't want to have to install a bunch of stuff into my MacBook Air. I have some college experience under my belt (I was only 2 classes away from my bachelor's degree but I ran out of financial aid), I'd like to think I'm decent-ish with computers (that's what I have a associates in, but I'm horrible with recalling how to do specific things), and when it comes to writing, I guess I'm okay. I'm open to any suggestions and leads that anyone may have. 

Tl;Dr - Looking for an online work from home job that won't cause a panic attack with minimal to no human contact. Also, I'm located in the US.",166,54,2021-01-27 01:36:04,https://www.reddit.com/r/WorkOnline/comments/l5t6dl/united_states_husband_and_father_looking_for/,"Lionbridge has paid me $14 an hour for the past year and I've never interacted with the company past my initial application / forms. They cap hours to 20-24 per week so it's really just a $1k/mo side hustle. No interview or human contact necessary. The job itself is nowhere near stressful. Could be worth checking out in your situation; just keep in mind most people don't get through the initial exams so you really need to pay attention and take your time on them. Appen is another company that does similar work but pays differently I think, so that could be another opportunity.,What kind of work experience do you have? Might be worth posting a resume to r/resume to get some feedback - without identifying information.

I totally get you. Work is... A lot. No matter what I do, I'm chronically burnt out. Good luck ❤️,Copywriting
Unfortunately not many jobs exist in a vacuum, most are providing a service to someone.,Try [https://www.openenglish.com/](https://www.openenglish.com/) , its an online English school very popular in Latin America. Tho, it may not be the best due to the fact that you don't like crowds, but I think they only teach private lessons. So maybe you can get a couple of student and work something out. Hope it works!,I understand how you feel, but you might be surprised by trying things you think you might not be comfortable with. Like teaching English 1 on 1 with kids online in China. It might be against what you think you can do, but you might want to at least try it and see if you flourish and love it. 

That's been my experience in life. Surprised by what I think things are like compared with how things turn out.,Have you tried call-center or contact tracing work from home type jobs? Indeed is littered with them. I applied to some in the beginning of the pandemic and a couple replied. Had a couple of interviews but got lucky and found another opportunity. 

Also MTurk and Click Worker, while not crazy money, you can make $300 a week if you put in 4/5 hours a day. Sometimes more. I made $200 in 7 hours with a really good HIT on click worker. The issue is you’re at the mercy of when they give you good HITs to work on. Sometimes they come in abundance and sometimes it’s scarce. 

I hope you find something. I suffer from anxiety and panic attacks as well. Not pleasant at all and I relate to a lot to your situation. I hope you find something that helps you and your family soon.,Hey, hang in there and good that you are looking. I wonder if any gig economy work like uber, amazon delivery or whole foods delivery work is available in your area. 

There are small task work online here and there (some good people have made lists of where you can find online work so try to look for those). Small gigs can be non consistant so can't really recommend unless you want to do them just as a side thing. 

If finishing your degree is an option sometime along the road, I say go for it. It can expand your options even for online work when it comes to bigger online gigs. 

If writing is your thing, make a nice portfolio online and showcase them for potential clients so you can build your writing business. 

Most important thing is to just start somewhere and build up. Best of luck!,[deleted],Ok, OP your handle suggests you like to play video games.  Did you know that many people make money playing video games live on Twitch & Youtube?  I have seen people of all ages doing this too!,Husband and father? What's the difference? I don't understand...,I've looked at some of these jobs. Do they allow you to work 2 positions so you could get closer to 40 hrs?,I just got the email today with the exam information for the rater position there. How hard are their exams? I don't really know much about Lionbridge besides what I've seen here on Reddit,I'm doing the Lionbridge exam now. I too want it as a small side hustle. Can you tell me about your taxes, how much you set aside, and if you ended up paying in at tax time (assuming you also have a primary job),What education is required for this?,You work for them? If so, how do you get in?,This is rather inspirational.,What are the requirements for doing this,I loved teaching English! Most of the kids were wonderful and it was a blast. I get social anxiety, especially now because of covid, and kids are pretty easy to interact with lol.,[deleted],trying to #own a desperate and horribly stressed parent who needs money to support their child is the most /r/redditmoment shit ive seen in a while. get your head out of your ass.,This comment would be helpful if you offered advice.,> You have very little education

I mean, he almost has his bachelors degree. Thats not little education,I'm going to take it at face value that you really don't know what he means and answer seriously. 

One means he has a partner that he is married to, and the other means he has at least one child.,I don't have any experience with Lionbridge but I have worked with Appen for two years now and am currently on multiple projects, so I can work 40-60 hours a week.,You should spend about 10 hours studying. If you do that you'll be good.,This pays better than my my fulltime job as an over the phone terp, do these guys take people working outside of the us? I am american, but I'm currently living in costa rica.,I really don't know, I've just seen a lot of publicity about it.,No I don't. But I see a lot of ads, and just wanted to help.,Usually, they require a degree, any degree, but it's not always the case. Here's some info I accummulated when I got laid off and was going to get into this. I'd verify, confirm, but its a general synopsis of what I'd read over time on other subs.

Work online teach English

This is what I have culled more or less, verify please: Many different schools. Many. You set your own hours within their window of available. Interviews of sorts, there's regular feedback, your pay starts low, but goes up, you are self-employed, 1099, paid via PayPal, some people thrive doing it, others worn down (that's teaching for you), important be on time, you can work as much as you want (according to their schedules), you can make good money, there are lesson plans you work with. That's for China and mostly kids.
You can teach adults in China, pay is lower, but advantages to teaching adults than children.
Also, as I mentioned, you can teach people all over the world, so there's business online that provide that, or your start your own thing? IDK.
This will keep you busy:
/r/esl/
/r/ESL_Teachers/
/r/OnlineESLTeaching/
/r/online_tefl/
and..
/r/WorkOnline/
/r/WFH (work from home)
and Dave's ESL Cafe might have something:
http://www.eslcafe.com


Also, you might want to read up on canceling sessions when teaching. There's something about being penalized for it, so you don't want that. I think it's for short-notice cancellations, and if you want to take time off, you can for vacations and such, it's all up to you.

Some people have taught without a degree. Some of the schools are not strict. 

Look for referrals, to help others out, they get money for it.

If teaching kids, I think there's something about making it fun and entertaining a bit, you will have to read up on this, but often the kids don't want to be there, studying all weekend, so there's the social skills part.

It takes time to get paid, about a month I think, for the process, getting the payroll stuff.

You might be able to teach without a 1099, I don't know anything about that, but doing it informally as a hobby.

Make sure you look presentable, of course, have a place to teach, like a spare room, some place quiet, make sure your webcam is set up and good to go (quality) and you have a decent internet connection. They will specify.

Again, I'm just passing along what I studied. I got laid off last year and was going to do this, but it didn't pan out. When my wife and I move to Thailand, I may teach this way to make enough money to get by (not that I need it, but something to do and to avoid touching my savings).,100% agree. I have yet to see a low stress call center job. I haven't worked on one but I know friends and family who has. Everybody has different experiences but I would highly avoid this.,Very true. I did consider that prior to accepting any jobs that were call center based because of my anxiety and got really lucky with another opportunity. My wife mentioned, call center was no walk in the park. None the less, the financial stress for me was greater, and the option for me going out to work (becoming an essential worker) being my last option. With my wife and housing my parents who are high risk, the call center job looked to be the best option at the time.,I was thinking this,Until he can frame and hang it on his wall, it doesn't really mean much.,Thanks, and how or why is that relevant for a workonline post? .... no need to reply, it's not.

Thanks,Thats awesome! Smart way to rake in the cash,Is the pay good?,Alright, thank you for the advice! :),Depends on the project and where you are located, the pay varies.",,false
37,1qrhsdz,india,My experience with indians as an european,"Hi, I am a romanian guy that worked in a warehouse in UK and had plenty of indians as colleagues, this is not meant to offend any people here, in case I do I apologize, I simply am saying my experience with indians and what I saw.

Most of my interactions have been good, especially with sikh people. I did not make like proper friendships, however we would chat, laugh and have fun at work whenever we would cross paths. My impression is that most indians are kind and friendly.

Probably the only bad interaction I had was with a guy that rammed into my truck because he was in a rush, but that was not because he was an indian, but because he was a dickhead. However apart from time, there were plenty of times where some indians would not have a work etique. Not that they were lazy, but like they would block you to get their assignment done faster. It was not against the rules, but it just how things were there, you do not block others if they are there first . They would rush as well while driving the LLOP and put others in danger. And some indians did smell bad and not like ”I did not have water today” but more like ”what is water for washing?”. I want to stress that not all indians were the same, many were good colleagues that had work etique, would not rush and would smell like any other person, however there were some indians that were like that. And I even talked to some other indians about that and they were aware as well. But all in all, my experience was good with you people.

Now, honestly some europeans would abuse indians. To simply explain, if I were to make a mistake, somebody would explain to me calmly where I was wrong. If an indian would make the same mistake, that same person would scream at them and talk badly. To my shame, many romanians were like that, but east europeans were like that and while some english people would be more reserved, they felt just the same. I would not say majority were bad, but quite a few. And sometimes I would talk to romanians and they were like ”these fking indians are coming here and taking all jobs” and I would say ”bro they are just poor fuckers as we are” and they would shut up and nod in confirmation. So the attitude towards indians can be bad. I will say though, the indians that were friendly and open to talk and jokes, would not get abused by even the biggest idiots. Like even the europeans that were dicks would go along just fine with the social indians, laugh joke talk etc.

So all in all, personally I had good experiences with most indians. Some I guess were bad apples, but all nations have bad apples. The general attitude of europeans towards indians is ok, however indians in europe/uk will surely get to meet some idiots along the way. Why are idiots like this? I think this stems from the fact that immigrants in general, so not an exclusive indian problem, tend to group together and just ignore the others. And ofc some people are just plain stupid. However the indians that were open to chatting to anykind of person were treated just as any other european by the idiots, no exagerration.

I think if warehouse workers, people that tend to have lower education, can get along just fine with indians, I am pretty sure better work enviroments indians would have no problems.

The online enviroment of europeans sound pretty racist I guess, but its not all doom and gloom in reality, however UK is in general more tolerable, I cannot speak about how other countries behave.",467,106,2026-01-30 20:57:08,https://www.reddit.com/r/india/comments/1qrhsdz/my_experience_with_indians_as_an_european/,"It seems like you’re saying that some Indians have good traits and others have bad traits….just like literally any group.  Congratulations on figuring out that Indians are people.,Are these Indians from India or Indians grew up in UK?  
Who is giving Indians from India visas to work in UK in warehouses? I've only seen students working as part time work during their studies but otherwise how are these folks getting visas to work in warehouses.,Okay. Maybe this would be better poised at a Romanian/UK sub..? Indians are aware that we are people 🙂👍,I am also simply sharing my experience living in Europe for the last 6 years. All my cleaning ladies over the years have been Romanians. My friends who bought old houses and had to do a lot of refurbishment, when they could not afford to legally hire a contractor the ones they hired to do this work in the black and for cheaper were always Romanians. Looks like Romanians are mostly a poor lot looking for illegal work in western Europe but my personal experience with them has been good. 
Do you see how ridiculous and pointless this sounds?,What is the point of this post? Why do you think your opinion is important?,[removed],[removed],Chill guys they're just reflecting on the relationship after the Mother of all deals 😂,From my own personal experience as a good proper western white, is that well over half of the Romanians I know are toilet people. Now, that has nothing to do with all Romanians of course but I just felt like I wanted you to know this hateful fact about my life. I only know 1 person really from India and he's very nice. Same for 1 actual Russian, he's cool too.,[removed],Looks like a made-up post by some Indian. Romanians neither speak nor type in English like the one that’s been used here.

Karma farming maybe? ,[removed],Great take.. Bad apples are everywhere... The kicker is on low paying jobs, you find more bad apples (from everywhere)..,Stop stealing,I never offered validation, I shared my  experience and you can make of it what you like.

As for the smell, the indians I talked to had deeply rooted racial prejudices against themselves I guess, as they thought the same. I never said it is a specific smell of indians, it is a smell of bad hygiene and it was not after a day of labouring, it was anytime of work schedule, for every day. And I said there were some indians, but most smelt just like as any other person.

Now I understand it sounds racist, but I am being honest in this situation. As others like to point out romanians are the toilet cleaners or whatever of Europe and I accept that many romanians take low skill jobs in western Europe. It might be upsetting to hear it, but it is the truth. I am not calling any indians here smelly, I am just saying that at work there were some indians that would smell bad.,A whole lot of words to say people from a place could be both good or bad.,What the fuck kind of post is this…,I am an Indian. I have working and living in Europe. Some are are good Europeans. Some are not so nice. But most are racist, not intentionally, but it’s so strongly ingrained. Even Europeans block other people to get their job done first. It’s okay. Let’s accept as humans we are in hurry.,I've met many Indians and have been employed by 2. I have had good Indian friends . I'm not keen on the people who live in the country to their west , next door to them,Imagine an Indian going to a European subreddit and saying “My experience with white people as an Indian”,Thanks for your post man, when I was a student in germany, I used to do my part time in McDonald's and I remember all of my colleagues were Romanian, they were so hardworking and sweet guys, treated me one among them and taught me some Romanian too😋😋. Few of the best people I met are from Romania.,Racism is the pillar for the current system. You and I, Romanian and India have to accept it. But you have to control your behavior based on awareness. Indians can't control much in this situation. There is no basis of sympathy i van extend to you, but empathy is a must. Amd it has to be bidirectional,**Your experience with Indians depends & differ, based on which region of India they come from.**

Many Indians don't tend to play a fair game, they often tend to take shortcuts. At work place they resort to nepotism or favoritism once they get to an authoritative position. 

So, I agree with work etiquettes part and there is some level of truth in *...Indians are taking our jobs...* part.

As Indians, even we face the shenanigans of our bad lot, so I understand when you say all these thing.,In India, humans do not respect each other being humans. One Indian respects another Indian, only if the another Indian is richer, muscularly or politically powerful or higher in the caste hierarchy. This is the general rule, and there are personal and geographical exceptions.,[removed],Fascinating. Not my experience or opinion of them at all.,Due to  the trade deal that happened, people were talking about european and indian attitude towards each other and the internet makes it sound like it is really bad, when it is not in my personal experience. 
Perception plays a big role when seeing somebody from a different country, as some  people in here pointed out about romanians for example, which is fair. I pointed some characteristics of indians I noticed, some good, some bad, so that indians understand where some european stereotypes about indians come from. 


You can care or not care about what I shared, I simply was in a position to actual interact with indians in real life and see how others act towards them, unlike many basement dwellers in here who know the world only through tiktoks. 


I will say this though if you come to western europe, know that western women are tired of western men. They complain about soft dicks and that the men are a bunch of sissies that are afraid to approach them. As long as you are confident and well behaved, you can drown in pussy there as the western men are a bunch of losers that live off their history. 
Actually I recall one of the few nights i went out, some english guy went mad because his girlfriend went away to spend time with an indian guy. 🫡,Hey! I'll give OP that congratulation with no sarcasm. I also grew up in Eastern Europe at a time when it was a closed society and I remember vividly the time I first met people from other places and eventually, somewhat later, figured that all people are people. An important realization many don't ever get to even when it's right there for them to see. Well done, OP!,This is a shit take,Yeah amazing hold the front page!,Your comment has the right amount of kindness and Tone. Far more polite than other subreddits I would say.,Bluecollar jobs can pay well here.,They came from India to UK.

 As to how they get visas to work, honestly no idea, never cared about it. All I can say is it was legal as the company we worked for is one of the biggest supermarkets in UK and I really doubt they would risk doing shaddy stuffs.,[removed],[removed],[removed],You don't have to respond either🤷‍♂️,[removed],I had AI analyze the syntax and it said 85% chance Romanian vs 15% chance South Asian.,[removed],the structure and tone of what you wrote make it sound like validation, there’s no takeaway, no question and no larger point. Just listing personal observations about a group of people and then defending them with disclaimers, doesn’t really add anything meaningful to the discussion here. Like wtf am i supposed to do with all that information.,Funny how you’re lecturing about “human respect” in India while nodding along to someone from the Balkans.
Boy, oh boy… I genuinely wish you’d spend some time living there. It’s a great way to cure this sudden belief that Indians are uniquely bad at respecting other humans. 😂😂😂,Yes I am braman make I am coming for you 👺,I disagree, caste system exists but times are changing

Edit: Every race has good and bad people. People exist in india that don’t treat people based on caste lmfao. The system I understand some jobs are limited to caste but general respect idk,[removed],What a bunch of generalizations and macho sexist tropes!,>I will..............guy. 🫡

OP idk what are your views over this, but truly I want to say that, anyone shouldn't care about which girl is going with which race etc , now don't get me wrong i m just saying that I have seen a lot of post of X in which some white MAGA grp people argue over female facial characters saying the they are better than them however same grp cries a lot when their ideal women chooses not to be with European man and rather chooses to be with some asian or other. 

Anyways, X however is an extremely hateful i feel,Fair enough and maybe the sarcasm wasn’t very kind.  But, it’s kind of bold to come to a subreddit that is going to have a big Indian user base to explain to Indians that sometimes people have good experiences with them and other times they don’t.  And sometimes people are nice to Indians and sometimes they’re not.  Glad OP is open to meeting people from other cultures but this just seems like a weird forum for this “insight”.,Mushrooms,Thanks!  That’s what I was going for.",,false
