,post_id,subreddit,title,text,score,num_comments,created_utc,post_url,comments,image_urls,over_18
9,1mit2ec,Indian_flex,I was crying quietly my cat woke up to comfort me,"so i was crying and trying to keep it down my mom was in another room and he was sleeping near me and i started crying he woke up looking worried and started rubbing himself on me

i just wanna rant i dont have anyone to talk to my mom and dad are already stressed and i am working my hardest to earn money (i got a small internship 4 days ago) i been unemployed for 6-7 months now recently for a 15k per month 11 hour hours with break and travel

i have skills but honesty the company standards were way better in my defense my laptop is 8 years old and their costs a arm and a leg.

i had a remote job before but lost it worked freelance but made not alot of money and it was just getting hard tbh . ( im a 3d artist)

my health sucks 3 years ago i had a attack i was not able to breath properly then months later it happened again and vanished then after 3 doctors (even now not sure) they said its asthma i could have tired i was on bed for hours 5 hours 6 hours at a time just trying to breath and their so called meds not working (fuck homopathay)

and as i am 19 most people low ball my pay , dad is trying his best his ventures arent just working rn he lost all his saving by a scam by his friend. i understand man works hard only to provide for his family and when hardwork does not even cover most things hurt i feel it now when i come to home my kittens wait for me the feeling of wanting to buy them toys with my pay and not being able to

i got the kittens to cope with my stray cat loss when i had a job and got 2 of the brothers i love them we love them but cat food and litter adds up quick

shout out to the did who sent cat food and litter to my house once from reddit and some people who got me my asthma meds

i feel exhausted i crash on bed after work i dont feel like eating i eat once or twice a day im very greatful coz most people dont even have that

i feel bad for my parents they try their best but its just not happening u know and plus my meds

i got no one to talk to for the past 4-6 years changes schools in 8th grade covid hit changed cities later

yes there been mates hi and hello but not proper friends recently there is a girl at my office and she says hi first to my shes a intern too and i really felt like crying coz no one says hi to me first i m always the nosy one

most my social interaction is online im kinda awkward times

i feel like i am not doing enough i cant even play with my kittens properly coz im tried

  
but my kittens made my day ",3058,101,2025-08-06 02:40:05,https://www.reddit.com/r/Indian_flex/comments/1mit2ec/i_was_crying_quietly_my_cat_woke_up_to_comfort_me/,"u/IndependentPension36, there weren't enough votes to determine the quality of your post...,my flex is they love me,https://preview.redd.it/nj0h9a3udbhf1.jpeg?width=320&format=pjpg&auto=webp&s=3c3b0a9630d8546a37fcff0b507bd4e99977147b

That's so cute,First time I am jealous of someone in this sub 😭,https://preview.redd.it/4pxcv9y7gbhf1.png?width=249&format=png&auto=webp&s=a0fb8fc546d5377ef760f0119a24aca4d08ca650,Hang in there brother (/sister) 🫂,Cute santra,Dnt worry mate,this too shall pass.,Dharampal humesha sabki madad karta hai.,Orange car to the rescue 🥰,Emotional flex,real flex,https://preview.redd.it/r5blnqe4hchf1.jpeg?width=1080&format=pjpg&auto=webp&s=640f8c1404f8b091c156283d2531e8febe7e978e,Op behen you are really lucky to have this much of maturity at this age.

8 year old laptop is not bad, mine is a 2009 lenovo model.

Believe in yourself.. one day your hardwork is going to pay off.,Rote huye vud keese bana lete hai log 💀

https://preview.redd.it/9upb67nphbhf1.jpeg?width=2160&format=pjpg&auto=webp&s=830170ee76d8aa4ddc584d64ac1e6580c22751b6,![gif](giphy|MDJ9IbxxvDUQM)

😘,Dame bro, you really are lucky to have such a wonderful cat,My rabbit once-twice did that when sad and alone 😍

But whenever I tried fake dying he always runned 😭 (sala kya madat karega)

Ya we are also in tough phase. Despite how humble I & my family and helped (people used to just gain and create issue).

And papa 8yr se 0% incr & no own property or house.
Mummy ka operation (1kidnet) & again some issue of health.
I have to took 2 drop and still not getting ews or ebc despite family income is 2.4L (real).,Post status, life status...that baby loves you = win. Keep the strength in knowing you have support. Things will get better.,Bro DM me your portfolio, looking for hiring a 3d artist,Keep Hustling mate. Victory is near. More power to you!!!!,[Hopebot](https://hopebot6886.pinet.com),🥺🥺🥺 this is the sweetest !!! You’ve got this, OP,Real flex,Stay strong bud. You really have a cute cat 😸,Greatest flex.,https://preview.redd.it/ddi96owg4chf1.png?width=1169&format=png&auto=webp&s=b637486a92bd7d27065ca3b2ef6236e40043a832,Cats can understand when their humans are sad. I used to keep the cat near me when I feel like crying. It's a warm feeling no other person can give.,Cute,This is the real flex❤️,Awwieee made my day ,Don't worry everything will be fine. Keep your chin up.,You're just 19 lol i mean 😭 
Im not being rude but 19 is still young and wym people law ball my pay??! You should be proud that you're earning something at least. 

And yeah again, not to be rude but crying wouldn't help, just get up and go through it ( as someone who cried so much ),Sorted hai bro... You are a lovely human being doing his best... Don't give up bro...  Even your cat gets it... Be grateful and enjoy,You're just 19 don't lose hope. Focus on your skills, workout I can assure you workout really keeps your mental health in a better state.,https://preview.redd.it/30piksyewchf1.jpeg?width=688&format=pjpg&auto=webp&s=7a03649d8e7268f1eac740316aecd84a7fa82f44,Cats are very good to make your day, but you can't have a two way convo with them.

You need good human interaction 

I turned 19m 2 days ago, i also I'm unemployed, but I'm grinding all the time with a hope of making it someday, 

So just don't cry alone there are lot of people out there to cry with you, who needs an shoulder and are willing to give theirs to a tired soul

You are too young too ruin your mantel psychy.
I was used to cry for nights coz I have a really really bad trauma from my childhood, but one day I shared it with one of my friend, and now I don't cry that often 

I would suggest meet people, struggling days can break your back, but you must keep your will intect, and just don't cry alone,

Cats can be helpful but they can not give advices that you really really need rn.

Just be safe, I hope you find someone with whom u can cry freely, my DMs are open for if u need any assist.

Stay safe,https://preview.redd.it/k6l4j32j0dhf1.jpeg?width=1080&format=pjpg&auto=webp&s=60c1f0a7c125d4708e0dece76e6bd7243ed7e7d1

Don't cry op here u can have my chinese cat(he's a lil racist),Orange cats are good bois,My dog runs away from my room if she gets a single hint of me having mood swings,Baaki sab badiya h bhai but this mouse sucks ass bohot jldi battery khata change krlo,Most biggest flex,Kya ri chirkut... Kaiko rota hai... Tu,Hang in there buddy. Keep your cat close. The right time will be here anytime,When I was 17 I was in love with a girl but it wasn't possible for me to get in a relationship with her. I got depressed and that time I had no one beside me except my cat. She didn't realise anything but I used to hug her gently whenever I wanted to release some internal pressure. Surely not hardly but it helped me alot,Kind of flex I joined this sub for🤍,https://preview.redd.it/tbnkicftdchf1.jpeg?width=720&format=pjpg&auto=webp&s=48403f1585fcd8da46ca8ea36ac71f60bce8b669

Sir,https://preview.redd.it/f4pssde0echf1.jpeg?width=720&format=pjpg&auto=webp&s=76705ae1a8397a63e20231cf9f31aa5042b578d6

Sareaam dhoka hai,Internet was a mistake,*Jldi se record kr leti hu!",,false
