post_id,subreddit,title,text,score,num_comments,created_utc,post_url,comments,image_urls,over_18
1ajo6lf,TrueOffMyChest,My daughters eating disorder is killing me financially.,"My daughter hates food. I think she has arfid but I've been ignored by countless doctors so fuck me, I guess. She had a three day anorexia workshop (which did absolutely nothing).

She's always hungry but won't eat. She's gone weeks. If you give her food she likes she'll eat until it hurts - but the food she likes is so expensive. I'm living on plain rice this week just to afford her food. Literally three times a day. My son hates her because of the food. I've applied for financial assistance so many goddamn times. I work over forty hours a week and after bills I barely have £70. At least fifty goes on feeding her and it never lasts her that long. 

I am so tired. I'm hungry. My son fucking hates his life and he's told me so many times how much he wishes we could just let her starve. 

I'm going to drag them both in to the doctor tomorrow, have them express their feelings, be called a bad mother and go home to a freezing house because we can't afford to eat and have heat.

I fucking hate my life. What did I do to deserve this?",8760,1947,2024-02-05 18:50:20,https://www.reddit.com/r/TrueOffMyChest/comments/1ajo6lf/my_daughters_eating_disorder_is_killing_me/,[],[],False
mgjzn7,EDAnonymous,My GF just died from an eating disorder. I'm devistated.,"My GF was diagnosed with anorexia, binge-purging subtype.  We met after her last time in treatment.  She seemed to do okay for a while.  I didn't notice any issues, but I wasn't too familiar with the signs and symptoms of her disease.  Now that I have read up more thoroughly, all of the signs were there.

She wasn't losing that much weight.  She had always been thin, and was recently looking much thinner, but not scarily so.  A lot of weird things were happening though.  She would have nights where she would send me these illegible, very off texts.  I figured it was because she was drinking, but now I know it has to do with periods of confusion brought on by malnutrition and heart issues.  I think now I can remember her cheeks being swollen.  She had dry skin and was always cold.  She would just not remember things that we talked about recently.

Anyway, I had gone over to her house randomly last Wednesday and her roommate let me in.  I walked into her room like covered in food and trash.  Literally shit everywhere.  I knew immediately something wasn't right.  I comforted her, threw out all the trash, and talked to her about treatment.  She agreed and I called her mom who got the process started.  They said it would be like 4 weeks till their was room, but she was going to call on Monday to see if she could get in sooner.

I didn't hear from her all day Saturday.  She was going through a lot, and thought she needed space.  She also had a habit of sleeping during the day for like 10 hours at a time when she wasn't working. Her mom hadn't called me or her roommates so I didn't really worry.  I had told her everything was going to be fine I was just proud of her for agreeing to go to treatment.  

I didn't hear from her on Sunday either.  I texted her a bunch and also called her parents.  I gave them her roommates number to check in on her.  Even at that point, I was just worrying about her mental health.  I didn't think she was at risk for dying or anything.

On Monday her roommate called me and told me the news.  They found her dead.  I'm guessing it was due to heart issues from all the purging and restricting.  I don't know.  I'm just devastated and don't know who to talk to about it.  Despite this disease, she was a truly amazing person.  She was honest and kind and genuine and all we ever did together was laugh.  She was only 24.  I didn't know this disease could strike so suddenly. 

I feel so guilty.  I wish I would have read up more about her disease and acted sooner.  I just want to crawl into bed and die.",2530,77,2021-03-30 16:31:29,https://www.reddit.com/r/EDAnonymous/comments/mgjzn7/my_gf_just_died_from_an_eating_disorder_im/,[],[],False
jx389a,starterpacks,Eating disorder starter pack,,212,21,2020-11-19 14:04:00,https://www.reddit.com/r/starterpacks/comments/jx389a/eating_disorder_starter_pack/,[],[],False
1892jar,EDAnonymous,"No hun, you did NOT have an eating disorder, SHUT TF UP OH MY GOD.","Most women have had eating disorders, one of those is sitting in front of you right now!! 1!1 - the phrase said by one of youtubers I stopped liking right after she said it. 
I may get downvoted but I do not really care srry
It might be a rant, but I am so sick of people who say they are ed surviviours but then you listen to what they mean by that and get so freaking annoyed. 
I genuenly do not want to minimize other people's problems, but no hun, trying a stupid low cal diet once, failing on the day 2 and then feeling kinda bad about it for about a week was not your anorexia story. 
The thing is - we cannot really questions if they actually had an ed. And I get why. But bae could you please maybe STOP using the fact you might have been having a period of disordered eating for a month to then use it as a free pass to advocate against ed forums, if they are not recovery-oriented, and argueing that the sole exhistence of uw people on the Internet is harmful and they should be all banned until they gain up to the weight that you personally find not toxic, like wtf. 
I have had a collection of debilitating EDs for almost a decade, I had no fkin social life, I lost almost all of all my friends and family, I lost my job, I nearly dropped out of school, I made a total emberassment of myself in my home town, I have totally ruined my health, I relapsed more times then I can count, I became broken because of the Medical bills and buying food for giant b/P sessions, I will have to be on medication to the end of my life and will most probably not live past 40. There are people whos life and mental Health was damaged forever, those who will live in constant suffering because they will become chronic, my heart goes to them, please be safe. The thing is, even those guys, girls and nb pals most likely still feel not sick enough to speak up. Only 1 person knows about my eds, for example. 
Now, how can people who are priviliged af and just want to feel more like a victim use the unspoken rule of not questioning mental illnesses as a free pass to act like total morons and send so much harmful misinformation to the world for clout??? I just don't get it.",436,97,2023-12-02 12:16:18,https://www.reddit.com/r/EDAnonymous/comments/1892jar/no_hun_you_did_not_have_an_eating_disorder_shut/,[],[],False
1qfv6h3,AnorexiaNervosa,what’s something you didn’t know was an eating disorder symptom until you found out?,"a few that come to my mind: 

\- needing my food to be piping hot. i will literally put it back in the microwave halfway through eating it because it cools down a little. 

\- needing to be alone when eating 

\- barely eating all day and then saving most of your food for the end of the day ",250,121,2026-01-18 01:35:10,https://www.reddit.com/r/AnorexiaNervosa/comments/1qfv6h3/whats_something_you_didnt_know_was_an_eating/,[],[],False
13dyh5g,PetiteFitness,"In college I developed an eating disorder unknowingly due to anxiety. Luckily those around me noticed and helped me get the help I needed. Now I’m at a healthy weight, my hair grew back, and my memory has improved SO much.",,543,32,2023-05-10 18:06:28,https://www.reddit.com/r/PetiteFitness/comments/13dyh5g/in_college_i_developed_an_eating_disorder/,[],[],False
1m7142t,AskReddit,What's something only someone who's had an eating disorder can understand?,,6,48,2025-07-23 05:40:13,https://www.reddit.com/r/AskReddit/comments/1m7142t/whats_something_only_someone_whos_had_an_eating/,[],[],False
1jd24ya,redscarepod,I can’t stand people with eating disorders.,"I have a stomach condition that causes me to only eat a few bites of food every few hours otherwise I get super nauseous and throw up. It has caused me to lose 20 pounds in a few months and given me heart conditions that are going to permanently affect my life forever. 

My friend has an eating disorder and I just can’t stand to hear her talk about it. Her family has the resources (and they’ve used them constantly) to send her to residential but she still restricts and becomes hospitalized for the health issues it causes. 

I am trying to be understanding but it’s honestly starting to annoy the fuck out of me. I can’t for the life of me understand why someone would waste so much time and money just to purposely make themselves sicker. I don’t get why she chooses to give herself these conditions.. I would kill to be as healthy as her but she completely takes it for granted. 

I don’t know if there’s something wrong with me for thinking this way or what. ",35,17,2025-03-17 02:12:35,https://www.reddit.com/r/redscarepod/comments/1jd24ya/i_cant_stand_people_with_eating_disorders/,[],[],False
1ptgd66,mildlyinfuriating,TW: talks of eating disorder; I worked hard to hit my goal weight. Friend tries to give me a complex.,"Just before Thanksgiving I hit my goal weight of 135lbs, down from 165lbs. I worked so hard, measured food, counted calories, learned serving sizes, created healthier habits, etc. Now that I’ve reached my goal weight, I’m back up to 2,000ish calories a day (sometimes I go over, sometimes under, I’m barely counting and going off of what I learned over the past 8 months). This weekend I was at a family party and my friend was there with her family. Her mother said she could tell that I lost weight and that I looked great, to which my friend replies, “yeah, but in my opinion you lost a little too much weight.” She later texted me and saying that her dad said, “I’m concerned for her. She needs to eat a hamburger.” 

I have also had 3 other people imply that I have an eating disorder because of my weight loss. 

I miss the days when people kept their opinions to themselves unless specifically asked. ",25033,2530,2025-12-23 00:58:15,https://www.reddit.com/r/mildlyinfuriating/comments/1ptgd66/tw_talks_of_eating_disorder_i_worked_hard_to_hit/,[],[],False
1pj92bx,AITAH,AITAH for refusing to spend Christmas at home if my sister is released from her eating disorder clinic for the holidays?,"My sister (18f) has been in an inpatient eating disorder clinic since September. This is her 3rd or 4th time doing a clinic like this. It's been 7 years of her eating disorder and it's been hell for her, yeah, but it has also been hell for the rest of us.

Ever since my sister started getting sick she has turned into a monster toward me (16f). We were never bffs or anything but I never thought she hated me like she has claimed to since the eating disorder stuff started. For years she has called me repulsive and humongous. She told me she would rather die than look like me or be my size. I'm not even overweight. My body is just shaped different to hers. She's naturally slender and doesn't have bigger curves. But I do. I developed different. To her that makes me even fatter than her and she already thinks she's fat when she was never even a pound overweight. She was always super skinny.

At her worst (and this was this year) she told me she wanted me to die because I was so fat and disgusting and it made her rage that I was taking life away from a skinny person who deserves to be here. She actually had to be taken away from me because she was mad when she said it and she acted like she wanted to make sure I didn't keep taking a life away from someone skinnier. When she kept trying to find me and take care of business I had to leave the house for several hours while they called people to come and help her. I was legit afraid of her doing something to me, and so were our parents.

I don't have to say anything to her for her to attack me and how I look. But to wish me dead over it was a new low and it was how she said it and the way she was acting that made it a million times worse.

My parents and my extended maternal family always expected me to be understanding and forgiving and to not hold onto any of what my sister says to me. They told me she's sick, she can't control what she says, that the eating disorder is doing the talking for her. My paternal grandparents were the ones who sided with me and defended me having some hard feelings toward my sister. They told my parents and maternal extended family the last incident should be more than enough for them to understand why I wouldn't want to be around her. My parents argued that she's still my sister. I told them I was tired of being her emotional punching bag and that I was almost more. They told me it wasn't my choice and we need to pull together as a family.

My sister wrote me a letter from her clinic and it was so fucked up I can't say what she wrote to me, but it wasn't the apology it was meant to be. My parents know about it, so do my extended family on both sides and so does the clinic treating my sister. It's known and still my parents fought for my sister to be able to spend Christmas Day with us. They said she needs to be around family to help her keep healing. When I found out I told them I couldn't believe they'd ask me to spend Christmas with her. We fought and I told them I was going to my (paternal) grandparents house and they could spend Christmas with my sister if they want. They told me I need to stay home this Christmas. I told them I won't be home if she's there and that it would be the worst Christmas for me if I had to spend it with her.

My parents keep reminding me that I'm still a minor and they have final say. But my grandparents and I have planned it out so my parents can't stop it without grabbing and dragging me home.

AITAH?",9541,1403,2025-12-10 17:42:32,https://www.reddit.com/r/AITAH/comments/1pj92bx/aitah_for_refusing_to_spend_christmas_at_home_if/,[],[],False
1kh0am5,Millennials,Any other women remember the *insane* eat disorder culture?,"TW: In high school there were a few times I would just pass out while walking. I remember happily telling my friends I fit into a 00 and my best friend said “well that brand runs big, I wouldn’t count it.” 

Looking back like wtf was that lol. ",5361,1081,2025-05-07 15:32:12,https://www.reddit.com/r/Millennials/comments/1kh0am5/any_other_women_remember_the_insane_eat_disorder/,[],[],False
1ihquwm,GlowUps,(30) to (31) - eating disorder progress!,"From severe eating disorder (138 lbs, less than 1000 cal per day) to healing! Currently at 230 lbs. Technically I'm considered obese now, but I feel that I look much healthier and am in the gym!",14877,497,2025-02-04 19:59:42,https://www.reddit.com/r/GlowUps/comments/1ihquwm/30_to_31_eating_disorder_progress/,[],[],False
1gz3lzy,okbuddycinephile,Best representation of eating disorder in cinema?,,9655,517,2024-11-24 22:36:03,https://www.reddit.com/r/okbuddycinephile/comments/1gz3lzy/best_representation_of_eating_disorder_in_cinema/,[],[],False
1igksbf,MadeMeSmile,[OC] 1st of Feb marked 4 years since I kicked my eating disorder and drug habit!,"Four years clean. Four years of choosing myself over the things that once controlled me. I’ve grown, healed, and found strength in places I never thought possible. As part of this new chapter, I’m also retiring my username—it’s time for a fresh start that reflects who I am now. Here’s to the next four years and beyond!",22257,292,2025-02-03 08:47:47,https://www.reddit.com/r/MadeMeSmile/comments/1igksbf/oc_1st_of_feb_marked_4_years_since_i_kicked_my/,[],[],False
zztnbe,science,"Self diagnoses of diverse conditions including anxiety, depression, eating disorders, autism, and gender identity-related conditions has been linked to social media platforms.",,46483,3668,2022-12-31 13:02:10,https://www.reddit.com/r/science/comments/zztnbe/self_diagnoses_of_diverse_conditions_including/,[],[],False
1p4q8tl,technology,"According to the brief, Meta was aware that millions of adult strangers were contacting minors on its sites; that its products exacerbated mental health issues in teens; and that content related to eating disorders, suicide, and child sexual abuse was frequently detected, yet rarely removed.",,5532,146,2025-11-23 15:59:47,https://www.reddit.com/r/technology/comments/1p4q8tl/according_to_the_brief_meta_was_aware_that/,[],[],False
1jchglh,SeveranceAppleTVPlus,Helena's eating disorder is telling us something more sinister,"The intro scene in 2x09 was hard to watch.  
>!When I saw Helena cutting the smallest pieces of her only egg, it reminds me of the huge disgust and desire to gain back control we can see in eating disorders. !<  
>!And then, James take them raw. !<  
It hit me like a car.

We're truly at the beginning of scientific psychology thanks to neurosciences.  
This show had the best way to illustrate complex psychological concepts (severance seems to be the conscious version of dissociation after trauma for instance), and there are many researches about the link between anorexia or eating disorders in general and incest or sexual abuse as a child. (I've put some links below, there are so many studies about that! !)

The worst part ? Sometime the abuse can be an incestuous environment without act. It is called moral incest or emotional incest.  
Years of putting a child into an adult position, sexual allusions, intimacy violations... (https://www.sciencedirect.com/science/article/abs/pii/S0222961718301685)

And I think this is what we can see with Helena and James.  
Forcing an adult to work was just the tip of the iceberg. I feel like this season is all about seing the truly evil nature of Lumon (kidnapping, child labor, torture, murders...). And as always, Severance is about showing not telling.

This intro scene once again showed us Helena as the product of years of abuse of so many different forms.

( For those who are curious about the link between ED and incest : [https://pubmed.ncbi.nlm.nih.gov/8863064/](https://pubmed.ncbi.nlm.nih.gov/8863064/)  
[https://pubmed.ncbi.nlm.nih.gov/3465427/](https://pubmed.ncbi.nlm.nih.gov/3465427/)  
[https://pubmed.ncbi.nlm.nih.gov/8477296/](https://pubmed.ncbi.nlm.nih.gov/8477296/)  
[https://pubmed.ncbi.nlm.nih.gov/8032346/](https://pubmed.ncbi.nlm.nih.gov/8032346/)  
[https://pubmed.ncbi.nlm.nih.gov/2095947/](https://pubmed.ncbi.nlm.nih.gov/2095947/)  
[https://pubmed.ncbi.nlm.nih.gov/8477269/](https://pubmed.ncbi.nlm.nih.gov/8477269/) )

EDIT : I'm not english native, and tried to express my opinion the shortest way possible. It is of course just my opinion and I always hope I'm wrong when I think I see the signs of an ED. ",2696,850,2025-03-16 09:06:06,https://www.reddit.com/r/SeveranceAppleTVPlus/comments/1jchglh/helenas_eating_disorder_is_telling_us_something/,[],[],False
171fde1,science,Experts have warned that ‘fat talk’ by mothers can unwittingly create problems for their daughter’s body satisfaction and even cause future disordered eating.,,12010,978,2023-10-06 15:31:30,https://www.reddit.com/r/science/comments/171fde1/experts_have_warned_that_fat_talk_by_mothers_can/,[],[],False
1luocim,notinteresting,I am unable to relate to this post as I do not possess an eating disorder.,,4102,269,2025-07-08 13:18:22,https://www.reddit.com/r/notinteresting/comments/1luocim/i_am_unable_to_relate_to_this_post_as_i_do_not/,[],[],False
18fcyk4,AITAH,AITAH for telling my wife to stop making her eating disorder obvious to the kids?,"
My wife Alice has an eating disorder basically her whole life. She doesn’t allow herself anything with too many carbs or sugar in it. Her meals are mostly veg and protein. 

When we first started dating, she was so motivated to change that about herself and develop a healthier relationship with food. She started seeing a therapist and a doctor and was doing really well. She came a really long way and I was doing whatever I could to support her. But when we had our two daughters (8 and 10), she went right back to square one because she was insecure about her body. She completely refused to get any help after because she didn’t want to gain weight. I’ve done everything I could to try help her but she’s completely against it now. 

My daughters and I usually have the same thing for our meals and Alice eats the low carb low fat version of it. Recently, our 10 year old expressed that she wants to start eating what Alice has and she’ll give reasons that sound like exactly what Alice would say. For example, one night we were having rice, salmon and veggies for dinner. My daughter said “dad don’t put rice on my plate, I’ll be bloated tomorrow”. I asked her why she said that and she couldn’t give me an answer. She completely refused to have the rice and I obviously can’t force her, but she’s been doing it more often lately. I sat her down and explained that carbs aren’t bad for her and it’s essential to her growth and health that she has a balanced diet. I thought she understood what I was saying but it hasn’t helped one bit because she still refuses to eat any rice/potatoes/bread or snacks at all.

I told my wife that she needs to stop making comments about her appearance and labelling certain foods as bad because it’s affecting our daughter and I’m scared what level this could get to for such a young child. My wife said “oh sorry, let me just switch my eating disorder off for you darling, didn’t realise it was such an inconvenience”. This ticked me off and I told her to stop being sarcastic and passive aggressive. I said I’m genuinely worried about our daughter and we need to do something to nip it in the bud before it gets worse for her. She said I’m daft for bringing that up with her when she struggles with food too. She said “if I knew how to help someone who struggles with food, I wouldn’t have spent my entire life struggling”. 

My mind is a jumbled mess. I think Im just going to seek help on how to help my daughter and do it on my own but I feel like we won’t make progress if my wife keeps making comments about food in front of her.",7250,1116,2023-12-10 20:46:28,https://www.reddit.com/r/AITAH/comments/18fcyk4/aitah_for_telling_my_wife_to_stop_making_her/,[],[],False
1e1h6sf,science,Taylor Swift’s openness about her struggles with body image and disordered eating has been found to positively influence her fans’ attitudes and behaviors towards these issues. Fans take inspiration from the fact that Swift had recovered from disordered eating and appeared to be thriving.,,7316,513,2024-07-12 13:04:34,https://www.reddit.com/r/science/comments/1e1h6sf/taylor_swifts_openness_about_her_struggles_with/,[],[],False
1qn8aby,crochet,Making a snake to track my eating disorder recovery,"Finally gonna try recovery (with my progress snake to motivate me)

I’m terrified of the idea, but I’ve had an eating disorder for 8 years and I can’t keep doing this shit. Spent the last few months trying to decide if I want to get better or worse, cause I can’t stay at this level. Finally decided a couple days ago that Ana can get fucked (obviously not that simple, but I’m riding on the spite as long as I can)

Inspired by a temperature snake I saw on here, I’m making a crocheted recovery snake to keep a record and to motivate me. 7 rows of 8sc per day, dual strand to show the category and accuracy of my intake. As I reduce the accuracy of my tracking he’ll get lighter, and as I start eating more types of food without tracking them he’ll get brighter. Gonna go for L1 of grains tomorrow cause he needs some yellow

The contrast of the colours is a little better irl lol, but I wanted to do it without buying any new yarn (only had to buy 1 in the end). I’m excited to watch him grow, and I’m hoping it lets me feel like a person again",3437,125,2026-01-26 06:21:46,https://www.reddit.com/r/crochet/comments/1qn8aby/making_a_snake_to_track_my_eating_disorder/,[],[],False
15gm5jr,popculturechat,"Arianna Davis, one of the dancers suing Lizzo, tells TMZ that after she gained weight, Lizzo held a meeting where she stated that “dancers get fired for gaining weight.” She was terminated after revealing to the team that she was struggling with an eating disorder.",,11956,905,2023-08-02 22:31:10,https://www.reddit.com/r/popculturechat/comments/15gm5jr/arianna_davis_one_of_the_dancers_suing_lizzo/,[],[],False
1fxsa7m,RoastMe,"21f- got cheated on, moved out..  Umm.. I'm working, but broke.. sleeping on my friends floor currently, recovering eating disorder and have mommy & daddy issues.. Do your worst but be creative🫶",,2280,4617,2024-10-06 22:08:04,https://www.reddit.com/r/RoastMe/comments/1fxsa7m/21f_got_cheated_on_moved_out_umm_im_working_but/,[],[],False
1jlk1bt,MadeMeSmile,Took control of my binge eating disorder. Now I feel like a whole new person.,"I had undiagnosed ADHD. I had a daily battle with task completion, doom scrolling, etc. Which led to severe anxiety, which then led to severe depression. Where i would use food as my comfort.

Once the ADHD was under control, therapy and a prescription of Strattera. My anxiety and depression came back down to earth, still there, but in normal life levels. 

I was finally able to get back to the things I loved and no longer needed to use food as my only form of comfort. 

I now see food differently and continue to improve on healthy mental and eating habits. 

Currently down 80lbs and counting 
",13545,185,2025-03-28 01:50:15,https://www.reddit.com/r/MadeMeSmile/comments/1jlk1bt/took_control_of_my_binge_eating_disorder_now_i/,[],[],False
