post_id,subreddit,title,text,score,num_comments,created_utc,post_url,comments,image_urls,over_18
1ozvk5l,TrueUnpopularOpinion,Ariana Grande should take a break from film and the spotlight until her eating disorder is under control,"Nothing against her as a person, she seems like a genuinely great person.  Why I don’t think she should be in movies is the Wicked movies are TREMENDOUSLY influential to young people and she clearly has an eating disorder, we should not treat her like it’s normal to look like that, nor promote her in roles where she is in a position to influence others who are in a very impressionable period of their life.  I understand it’s a sensitive subject for her, but the press pretending like its normal or still promoting her in movies I don’t think is helping her or others either.  Honestly, I don’t want my daughters to watch the Wicked movie and think women should be that skinny.",1530,366,2025-11-17 23:09:33,https://www.reddit.com/r/TrueUnpopularOpinion/comments/1ozvk5l/ariana_grande_should_take_a_break_from_film_and/,[],[],False
mktmg7,MadeMeSmile,Recovery from an eating disorder,,96184,1928,2021-04-05 20:07:52,https://www.reddit.com/r/MadeMeSmile/comments/mktmg7/recovery_from_an_eating_disorder/,[],[],False
mg1oa9,iamatotalpieceofshit,Recovering From An Eating Disorder,,62858,2015,2021-03-29 22:46:05,https://www.reddit.com/r/iamatotalpieceofshit/comments/mg1oa9/recovering_from_an_eating_disorder/,[],[],False
1dh85am,Damnthatsinteresting,"Stomach contents of a psychiatric patient with pica,an eating disorder in which a person eats or craves things that are not food:1,446 items,including ""457 nails,42 screws,safety pins,spoon tops, and salt and pepper shaker tops"".",,9545,339,2024-06-16 13:57:40,https://www.reddit.com/r/Damnthatsinteresting/comments/1dh85am/stomach_contents_of_a_psychiatric_patient_with/,[],[],False
1qhq2kj,AITAH,WIBTAH for refusing to eat 3 meals a day so my cousin “doesn’t develop an eating disorder”,"I (17f) am about to move in with my aunt and uncle for college next fall. My family has always struggled with being overweight, and their perception of what counts as “enough food” is really skewed. I realized I did not want this for myself, so I’m vaguely conscious of what I eat. I am 5’0 and 100 lbs, so naturally my maintenance calories are low (around 1400 a day). To maximize satiety, most days, I eat one very large meal a day with the whole days nutritional needs. I eat it around 4 pm. On weekends I don’t track calories at all.

My aunt and uncle are worried that my habit of eating one meal a day might influence their 11-year-old daughter, my cousin, and potentially cause her to develop an eating disorder. I want to be clear: I never talk about food, bodies, calories, or label foods as good or bad in front of her EVER (or in general).

They’ve asked me to change the way I eat because they think it’s a bad example, even though I eat a nutrient dense, well balanced meal and I do eat plenty of food overall. It’s creating tension, and I don’t feel like I’m doing anything wrong.

WIBTA for sticking to the way I eat?

  
Read this thx: 

\- I eat like this half of the week, not every single day. and I eat 1400 CALORIES. Not a normal portion size

\- These family members are OVERWEIGHT, they do not know what a normal portion size is for their own height, much less foe my size. This is why they think what and how I eat isn't healthy and they are concerned

\- I was previously overweight, lost 35 pounds which lead me to become aware about calories and nutrition intake AND I have PCOS which quite literally requires me to be mindful about my body. Counting calories is not indicative of an eating disorder. The world is not black and white. Like someone articulated well in the comments - it was something to the effect of if someone is on a budget, that doesn't inherently mean they're in debt

\- I am NOT malnourished, people are overestimating what a 5'0 sedentary females caloric needs are, it's very achievable to get them in one meal. I've eaten like this for 3 years now, no adverse reaction. 

\- Stop projecting your struggles onto me based on vibes. Get help for your own disorder. It will get better. 

\- Demonizing young people for getting nutritional advice and labelling them with disorders is precisely what pushes them into proana spaces solely since they feel ostracized from healthier avenues. People who feel comfortable labelling a stranger on the internet with a disorder are directly contributing to the ED pipeline",874,459,2026-01-20 03:32:44,https://www.reddit.com/r/AITAH/comments/1qhq2kj/wibtah_for_refusing_to_eat_3_meals_a_day_so_my/,[],[],False
mzletc,AmItheAsshole,AITA for triggering a girl’s eating disorder by ordering a salad?,"Edit: I didn’t expect this to blow up but wow. Thankyou for all the love and support guys. I truly appreciate the people who gave me legal advice on the issue and how to deal with it without any repercussions and the all kind people who took their time to learn about my culture and also the kind people who stood up for me against trolls who invalidated my feelings and dietary concerns. Thankyou for all the awards btw.



I am part timing in an IT company that is very close knit. My boss Steven and his wife were always sweet. 

It was my first month and it was my boss’s “birthday week” so he and wife Melissa were kind enough to include me in this fancy dinner they were taking everyone to. A week prior to the dinner, Melissa added everyone to a group chat and asked whether we had any suggestions on where to eat. I told her that I am fine with anything as long there are vegetarian options available or at least chicken.

They brought their daughter Stef(15) to the dinner and she is a sweet little girl. Now Stef was really interested in me and she kept on asking me questions about how I look the way I look. Now I am short(5ft) but can be somewhat deemed as “fit” to today’s generation. 

I was transparent with her and told her that I don’t restrict myself to certain foods but rather eat everything in moderation. Plus I have a plant-based diet and home cooked meals so that helps and I also lift weights. Now Melissa overheard our conversation partially. She pulled me aside and told me that Stef was recovering from eating disorder so she encouraged me to be honest with her and not lie to her and not to order anything that screams “diet!”

When I saw the menu, there were little to no vegetarian options available. It didn’t have anything for me. I was very disappointed and made a comment that oh wow there are no vegetarian options. Melissa chimed in and said that eating meat once in a while won’t affect my weight. Now, when I say plant-based diet it’s not that I don’t eat meat but I only eat chicken maybe once a week as a side dish and certain types of fish occasionally but other than that I mostly eat vegetarian dishes. My food habits are not for my “weight” but for my religion/culture. It has nothing to do with my weight. 

When the waiter came in, I was still glued to my menu when all the others had already ordered. Melissa said that oh she will have the duck too and I interrupted and said that no I will have the garden salad(I hate salads but there were no other veg options). 
Melissa got quiet.

After a few mins she told me that I shouldn’t have lied and lead on her daughter if I was going to order a “skinny” salad and starve myself. She said that I am just like those IG influencers who lie to impressionable young girls about their food habits and bodies and I just proved that by ordering a salad after giving her daughter a “don’t restrict yourself” speech and I probably triggered her eating disorder.

I tried to explain that I only ordered a salad cuz there was no other option in the menu for me but then she said that I should have just sucked up and eaten the damn duck as it isn’t going to affect my weight but then again I corrected that it is a religious thing and not a diet thing. She said that if I eat chicken then obviously I would eat other animals too and I was just putting up an act. It was horrible. She completely tore me down and I immediately left",22346,2259,2021-04-27 10:27:57,https://www.reddit.com/r/AmItheAsshole/comments/mzletc/aita_for_triggering_a_girls_eating_disorder_by/,[],[],False
1k4vcwm,science,"Over 1 in 5 boys and men in Canada and US may meet diagnostic criteria for an eating disorder. Yet they remained overlooked. Boys and men often face barriers to seeking help for eating disorders, including stigma and shame, fear of judgment, and lack of gender-affirming treatment options.",,3502,264,2025-04-22 02:17:54,https://www.reddit.com/r/science/comments/1k4vcwm/over_1_in_5_boys_and_men_in_canada_and_us_may/,[],[],False
nhxtam,AmItheAsshole,AITA for having flavored sparking water at my teenage daughter's birthday party? Another mom accused me of trying to give her daughter an eating disorder.," My daughter birthday party was on Saturday morning; she is 13 years old. We just hosted it in our backyard. For food we ordered pizzas, wings, garlic bread, tortilla chips, guacomole, salsa, pasta salad and burgers. When it came to drinks, We had water, sparkling water, lemonade.

So we have the birthday party everything is going well. One of the moms call her Lacy comes to pick up her daughter. She then finds her drinking a La Crouix. She tells her daughter to toss the drink, and then she comes up to me and is like why are you offering diet products to my children.

I’m like it’s just sparkling water, she then flips out saying that her daughter does not need artificial soda replacements. She goes onto say if I want to give my children eating disorders I can do that but not for her children. 

I was taken a back and just how aggressive she was, and I didn’t feel like I did anything wrong. I was like look I have pizza, wings, brownies this is not a diet party at all. She then tells me I have no right to judge what is a diet product or not. She and her daughter both left. Also she later posted on Facebook (I am not friends wit her) that 'some people are trying to push diet products onto children that aren't even theirs.'

FWIW if my children want soda I am cool with them having it in moderation, but none of my children do. And it was just really odd for me too, like I have never heard of anyone say that flavored sparkling water is an artificial replacement for soda?? Also I didn't say anything to her but it was extra odd because both her and her daughter were obese, so its just extra odd they are accusing me of trying to give them eating disorders?",17636,1851,2021-05-21 17:18:21,https://www.reddit.com/r/AmItheAsshole/comments/nhxtam/aita_for_having_flavored_sparking_water_at_my/,[],[],False
z4n0fc,BestofRedditorUpdates,OP Accidentally Trained Her Cat To Be An Eating Disorder Support Pet (July 2021 TrueOffMyChest),"Originally posted by u/moonchild_86 in r/TrueOffMyChest on April 12, '21, updated on July 19, '2.


Trigger Warning: Eating Disorder 


Mood Spoiler: >!Heartwarming & Positive!<


[Original post ](https://www.reddit.com/r/TrueOffMyChest/comments/mpi934/i_accidentally_trained_my_cat_to_be_an_eating/)
 


I accidentally trained my cat to be an eating disorder support pet...


I'm feeling guilty today.


I've had this cat for 3 years now. My Ed got significantly worse about 2 1/2 years ago.


At first, I didn't even realise what she was doing. I had a problem with purging for a long time... She would get between me and the toilet, demanding attention and fuss, while I cried. She would sniff my face and lick it, making it impossible to purge. If I locked her out of the bathroom, she would meow so loudly that I'm sure the neighbors heard.
 

I finally managed to stop purging last year after recovering and relapsing a few times. The lockdowns have been really difficult, and not being able to go to the gym hasn't helped.
 

A couple of months ago, my cat stopped eating. She got so skinny, she was really underweight. Vets couldn't find anything wrong, I hadn't changed her food, there was no reason for it.
 

I'm not sure how it happened... One day, I decided to have breakfast, too. So I sat down with my food and put her bowl next to me. And she finally ATE... I did the same at lunch time. And again, she actually ate.


The same the next day. And the next.


We've been doing it for a while now. She's still underweight, but she's getting there.


I wake up at 7am every day. We have breakfast at 9/9.30. I need those couple of hours to build up to breakfast.


I slept really badly last night. I woke up at 9.10, and I just couldn't do it. Lunch is at 12, I just couldn't eat.


I put Lily's food down by me. She stared at me. Stared at her bowl. Stared at me again. Then walked away.


I'm heartbroken that I couldn't do it for her. She needed me to eat and I let her down...
 

She finally ate at lunchtime. I had a sandwich. She kept glancing at me, pausing for me to continue before she would eat more.

 
People say we don't deserve animals.


I don't deserve this cat. She is saving my life, quite literally, and I don't think anyone appreciates or understands how incredible that is.


It's also absolutely terrifying. I don't deserve this cat...
 

UPDATE


I was trying to reply to everyone, but this took off a whole lot more than I thought it would... I can't believe the awards from everyone, the comments and likes, but most importantly, the massive amounts of support from everyone... Thank you for sharing your stories, your pets, your support, encouragement, and your belief in us to get better. I'm absolutely overwhelmed and I really wish I could thank you all personally ❤️


Please know that I'm reading every comment and will try to reply but I do have therapy today so it may take a while.


Also, we've just had breakfast... Lily had chicken and duck, I had granola and yogurt ❤️


[For those who have asked to see a picture](https://www.reddit.com/r/aww/comments/mpcus4/pretty_girl_with_a_blep/?utm_medium=android_app&utm_source=share)

*Eta, in case that link isn't working:*


https://i.redd.it/vshzofa7lqs61.jpg



Update July 19, '21:


[Lily and I are both a healthy weight now finally ❤️](https://www.reddit.com/r/MadeMeSmile/comments/ond54f/for_anyone_who_remembers_my_previous_post_will/)


Lily was actually cleared at the vets a few weeks ago but I wanted to wait... Last week was my last eating disorder therapy appointment! So now we have both been cleared... I've also managed to get Lily eating on her own. We both eat regularly but now she doesn't wait for me to start eating first...


I just wanted to update everyone and say thank you so much for your support. It's been more appreciated than you'll ever know ❤️",22693,579,2022-11-25 20:15:19,https://www.reddit.com/r/BestofRedditorUpdates/comments/z4n0fc/op_accidentally_trained_her_cat_to_be_an_eating/,[],[],False
18wmgwq,todayilearned,TIL that Elizabeth Olsen almost quit acting in 2004 due to the media attention surrounding her sister Mary-Kate's eating disorder.,,8409,433,2024-01-02 10:35:40,https://www.reddit.com/r/todayilearned/comments/18wmgwq/til_that_elizabeth_olsen_almost_quit_acting_in/,[],[],False
13s6d4n,ChatGPT,"Eating Disorder Helpline Fires Staff, Transitions to Chatbot After Unionization",,7100,792,2023-05-26 07:29:00,https://www.reddit.com/r/ChatGPT/comments/13s6d4n/eating_disorder_helpline_fires_staff_transitions/,[],[],False
uhtel0,Fauxmoi,Lili Reinhart Calls Out Kim K For Promoting Disordered Eating,,14302,844,2022-05-03 23:47:34,https://www.reddit.com/r/Fauxmoi/comments/uhtel0/lili_reinhart_calls_out_kim_k_for_promoting/,[],[],False
n7vp2n,insaneparents,“Can you think of anything from your childhood that may have caused your eating disorder?”,,29049,929,2021-05-08 18:45:29,https://www.reddit.com/r/insaneparents/comments/n7vp2n/can_you_think_of_anything_from_your_childhood/,[],[],False
1p98oya,OutOfTheLoop,"What's up with using ""almond"" as a euphemism for disordered eating?","Within the past two weeks out of nowhere, I keep seeing almond used as code for people who for whatever reason don't have a healthy relationship with food. Examples: the mean ladies at work are all 'almond ladies' and sneer at my lunch. I had an '[almond mom' growing up who for Thanksgiving only made pureed cauliflower instead of mashed potatoes](https://www.reddit.com/r/raisedbynarcissists/comments/1p93wwt/anyone_elses_parents_have_gone_full_almond_for/?utm_source=share&utm_medium=mweb3x&utm_name=mweb3xcss&utm_term=1&utm_content=share_button). Etc. Etc. Where did this come from? Some sort of TikTok thing?",1299,266,2025-11-28 22:55:12,https://www.reddit.com/r/OutOfTheLoop/comments/1p98oya/whats_up_with_using_almond_as_a_euphemism_for/,[],[],False
kihogf,MadeMeSmile,"I have depression, anxiety, body dysmorphia, and binge eating disorder. I don't often like the way I look, but I was recently gifted a crop top and it was the first time in a long time I looked in the mirror and thought ""I look good."" I'm also 121 days clean from self harm today!",,26969,1028,2020-12-23 00:13:09,https://www.reddit.com/r/MadeMeSmile/comments/kihogf/i_have_depression_anxiety_body_dysmorphia_and/,[],[],False
80s79v,pics,"From 89 to 120 pounds in ten months, I have finally reached my goal weight after battling stress loss and an eating disorder!",,81282,2646,2018-02-28 01:47:33,https://www.reddit.com/r/pics/comments/80s79v/from_89_to_120_pounds_in_ten_months_i_have/,[],[],False
1pox3g4,soup,I have an autoimmune disorder in my stomach and eat soups for breakfast every day.,"Today’s soup. Homemade chicken broth. Bok choy, baby corns, chicken, fresh green onions. ",2454,108,2025-12-17 13:54:41,https://www.reddit.com/r/soup/comments/1pox3g4/i_have_an_autoimmune_disorder_in_my_stomach_and/,[],[],False
1ir52fz,GlowUps,Undiagnosed PCOS and binge eating disorder(23) PCOS in remission and recovering from BED (24),267 to 134,7656,138,2025-02-16 22:54:09,https://www.reddit.com/r/GlowUps/comments/1ir52fz/undiagnosed_pcos_and_binge_eating_disorder23_pcos/,[],[],False
q1g88x,news,Instagram promoted pages glorifying eating disorders to teen accounts,,15193,624,2021-10-04 21:51:23,https://www.reddit.com/r/news/comments/q1g88x/instagram_promoted_pages_glorifying_eating/,[],[],False
xzk631,BlackPeopleTwitter,"And let's not pretend it's for health reasons because y'all dgaf about smoking, drinking, drug abuse, or even eating disorders for that matter",,5174,965,2022-10-09 12:12:36,https://www.reddit.com/r/BlackPeopleTwitter/comments/xzk631/and_lets_not_pretend_its_for_health_reasons/,[],[],False
cyneur,tifu,TIFU by accusing my son of having an eating disorder.,"So, I like to think i'm an O.K mom. I don't smother my son or let him get too crazy. He's fifteen so I always knock on the door, not just to be respectful, but because there's some things a mom shouldn't see.

Well, yesterday he left to go to the McDonald's across the street with some friends. I assumed he'd be a couple hours so as far as I knew I was alone. I decided to take advantage by putting on some headphones that wouldn't be inevitably tugged on with a Mom, can- question following.

I'm doing the dishes, sweeping, trash, etc while Metallica is blasting in my ears. I start gathering laundry/putting it away, and unbeknownst to me my son got home earlier than expected.

I decided to toss his gym clothes I just finished washing on his bed while I was putting away my own clothes as our rooms are right next to each other. I DID NOT KNOW HE WAS HOME. I walk straight in without knocking and I'm horrified.

My 15 y/o son is...shoving a spoon down his throat and gagging over a cereal bowl. What the fuck.

He instantly jumps, slowly turns over to me, and the spoon almost comically drops from his mouth. I set the clothes down and in my confusion/horror sit down next to him.

I asked What were you doing? and he's extremely nervous and keeps repeating it's nothing i wasn't doing anything.

He's on the wrestling team and it clicked in my head *oh shit he was making himself throw up he must be body conscious how did i not notice he was doing this to himself*. 

I start giving a mom speech about how body dysphoria is extremely common in teens and he shouldn't be afraid to ask for help from a trusted adult, that i'm here for him, he's perfect just the way he is. 

He looks like a deer caught in the headlights and remains adamant he wasn't doing anything. I asked Is this something you'd rather talk about with (uncle) or (coach)? He's exasperated and tense saying there's nothing to talk about.

Finally I just have to say It's pretty obvious what you were doing and I need you to be honest with me or someone else so we can figure this out.

Him: I wasn't trying to throw up!

Me: Then what were you doing?

Him: I needed to know if I have a gag reflex!

I'm extremely confused at this point and ask why. He blurts, I'm gay! I'm completely shocked and he has tears in his eyes.

It clicks.

I immediately wish I hadn't done laundry that day and give a quick I'm sorry, it's okay, I support you completely, I'll just...leave you to that and continue doing chores.

Dinner rolls around and he's refusing to make eye contact but eventually we ease into a conversation about how he's been hiding it for awhile, has a lot of homophobic friends and was ashamed to tell me because I'm your only son so you wouldn't have grandkids. He planned to come out in college. I had no idea he thought I'd react that way and assured him I'd love him no matter what.

Apparently he's also not planning on...doing anything he'd need to practice with a spoon for in the near future...but was just curious and wanted to be ready. I'm relieved but mostly want to forget I ever saw that. At least it brought us closer.


TL;DR walked in on son gagging himself with a spoon. thought it was bulimia. turns out hes just gay.",24448,943,2019-09-02 10:45:26,https://www.reddit.com/r/tifu/comments/cyneur/tifu_by_accusing_my_son_of_having_an_eating/,[],[],False
1jlce16,HistoryUncovered,"As a child star, Judy Garland was forced by Hollywood executives to drink black coffee, smoke cigarettes, and take amphetamines. For the rest of her life, she battled drug addiction, eating disorders, and mental illness. She was 47 years old when she was found dead on the toilet from an overdose.","By the time she was 17, Judy Garland was already reliant on pep pills, a.k.a. amphetamines, and was being hounded by studio executives regarding her weight and looks. One executive called her a fat hunchback and encouraged her to smoke in order to suppress her appetite.

Garland's grueling work schedule — coupled with a strict diet of black coffee, chicken soup, and cigarettes imposed upon her by her Hollywood bosses — set the stage for her lifetime of body dysmorphia and substance abuse. The star attempted suicide at least 20 times in her life until her fatal overdose in 1969. Discover the devastating true story of Judy Garland: https://allthatsinteresting.com/judy-garland-death",4406,157,2025-03-27 20:14:05,https://www.reddit.com/r/HistoryUncovered/comments/1jlce16/as_a_child_star_judy_garland_was_forced_by/,[],[],False
10vkprh,KidsAreFuckingStupid,gonna be a new eating disorder,,13022,345,2023-02-06 22:46:15,https://www.reddit.com/r/KidsAreFuckingStupid/comments/10vkprh/gonna_be_a_new_eating_disorder/,[],[],False
1e6mj8l,BrandNewSentence,should we take the elevator or the eating disorder stairs,,4541,256,2024-07-18 21:21:05,https://www.reddit.com/r/BrandNewSentence/comments/1e6mj8l/should_we_take_the_elevator_or_the_eating/,[],[],False
zyr91t,insaneparents,"Estranged mom argues that I'm pregnant. Jokes on her, I just recovered from an eating disorder and failed to conceive despite desperately wanting a baby!",,7256,453,2022-12-30 04:46:19,https://www.reddit.com/r/insaneparents/comments/zyr91t/estranged_mom_argues_that_im_pregnant_jokes_on/,[],[],False
