,post_id,subreddit,title,text,score,num_comments,created_utc,post_url,comments,image_urls,over_18
13,1ri31e9,entertainment,Kelly Osbourne Slams Body-Shaming Critics’ ‘Cruelty’: ‘I’m Going Through the Hardest Time of My Life’ After Father Ozzy’s Death,,3416,872,2026-03-01 17:21:59,https://www.reddit.com/r/entertainment/comments/1ri31e9/kelly_osbourne_slams_bodyshaming_critics_cruelty/,"She is not being body shamed. She looks very unwell and people are worried. It's like Karen Carpenter and watching her shrink away into nothing.,It does look like she’s killing herself in plain sight though,We're not turning our backs. 

We're looking directly at her and saying ,

#*Holy shit, someone needs to help you!*

I understand grief and loss, I lost my own mother 3 years ago....

but starving yourself to the point of your skull being visible through your face is not normal. 

I know Ozzy wouldn't want her to do this.,I wish concern for someone’s health would stop being blankety labeled as “body-shaming.” There are certain undeniable indicators of poor health. It’s hard-wired into our brains. ,I completely understand all of this. I've ballooned and gone skeletal multiple times in my life. I really do get it. Under a microscope it must be even harder, which I admit I cant understand and won't try to. 



That said, there's a level of unrecognizable awe I think a lot of people are feeling. It's like she went in for a buccal fat removal and they only left the necessary tissue for jaw management.,While there have been some cruel comments, the majority of people are truly worried, with good reason.  She keeps putting this out there to try to get people to stop mentioning it, but it's giving telling folks to not believe their lying eyes. She and her mom both truly look like they need treatment. They literally look like there could be fatal consequences if they don't get treated so her response is not aligning with the issue.

If she said, I know that I have lost too much weight and I am really working on trying to get help and seek treatment, people would be different. But instead, she just keeps trying to bat away anyone talking about what is right in front of their eyes to make them feel bad for mentioning it when folks are really thinking that the woman might not be here in the near future given the way she keeps looking.  As in like needing to be checked in somewhere for intense treatment, not going to award shows.

Her mother said a while ago that she herself lost too much weight on a GLP1, but that still doesn't make sense that over a year later, she has not gained a pound back if she stopped that medication.  We all know people taking that, and that is not what we see with them if they stop the shots.

I hope they are ok.,Ok but her and Sharon were getting into weird looking territory before Ozzy died?,I’m sorry but she was on this path well before Ozzy passed. I hope her and Sharon can heal. It’s scary how sick they look.,It's not about body shaming at all. She is clearly anorexic. Anorexia has the highest fatality rate of any mental illness. People are worried because her life is in danger.

The fact that she doesn't see herself as being too thin is part of the disorder. She truly doesn't understand how frightening her appearance is to other people. No one is trying to shame her. They are just alarmed and feel helpless watching her destroy herself.,Look, i'm sorry but Kelly and Sharon Osbourne are the uber bullies of TV and both have been extremely well paid to be nasty about others appearances. The hypocrisy of Kelly of all people telling people to back off about her appearance when she was the ultimate mean girl on Fashion Police is astounding.

She has looked like this for ages so using her Dad as an excuse is just vomit inducing. Just own it Kelly, like your Mom you have always wanted to be this thin regardless of whether it looks good or healthy. They have both paid huge amounts of money to look like this and honestly its all a part of their grift.

,I think she's doing the same thing Kate Beckinsale is doing.

Beckinsale will post a photo of herself in a bikini, wait for the comments, and then post a video where she pours out her heart about how much pain she's in because of her parents' deaths.  It's done under the guise of berating people for cruelty, but it's all a cry for help.,She looked like this when Ozzy was alive.,Been there, after my parents’ died I had trouble eating and then bounced back to eating too much out of boredom/depression. Grief is weird and our brains can be weird and…yeah. I do hope she is talking to someone or something bc she does look worryingly thin - not shaming her or anything, I think most people would be concerned.,I don't think people are being cruel; I think a lot of people are worried about her. I know Kelly was open about having an eating disorder, and I know that even when you work on getting help, it can't fully go away, and you can relapse. There is a chance that is what happened here, and it would make sense since her father died recently. I think people are more worried about her than anything, and think she should focus on getting better. She doesn't need to be in the public eye right now. I wouldn't blame her if she took a break from social media and public appearances. 

This is coming from someone who struggles with body image and mental health: I'm worried about Kelly. I want her to get the help she needs. ,We've overcorrected from body shaming into toxic body positivity which now teeters on the edge of eating disorders, and if you so much as comment on it you're labeled evil and disrespectful. I am sorry for what she's going through and am sympathetic to people who have experienced trauma and bullying, but I refuse to normalize what people like Kelly and Ariana Grande are doing to themselves. I'm in my 30s and I remember how toxic pro-ED tumblr was during my teens, I can't imagine the message teens are getting from all of this.,The majority of people are not body shaming, they are worried.,She was like this before Ozzy died.,I’m sorry, she looks like she is dying. People are legitimately concerned.,Honey you looked sick before he passed. Sharon too.,Sooo what about the 3+ years leading up to his death? 

This is just an excuse for her to blame her anorexia, drug abuse and botched plastic surgery on something else.,WE ARE WORRIED ABOUT YOU!,It’s not cruelty, she’s openly in public, looks like she’s terminally ill.  Hopefully, she has a therapist & medical team but I doubt it,People need to be calling this out though. She looks unwell and we can't normalise this. It's not about her directly, it's about the message it sends others.,Wow. Cant believe that’s her,“Rules for thee but not for me.” This woman made a living on a tv show criticizing people’s outfits and calling them fat.,Kelly, we aren’t talking about ten fucking pounds here. It looks like you’re shooting for lead extra in Schindler’s List.,That’s why you should be getting help instead of going to awards shows!,I hope family members aren’t too frightened of her acid tongue to stage an intervention.,Jesus christ, she looks incredibly unhealthy! An inch of pancake makeup and she is still skeletal and pale! Maybe she needs to hear these comments bc becoming rail thin, if from medicine, surgery or ED, Kelly is not well. Skeletal is not a fashion style, she's ill.,Cool, did she consider what others might have been going through when she made a paycheque from body shaming them?,Shes literally been unrecognizable for some years now. I was watching an episode of Ghost Hunters or Dead Files like 2 or 3 years ago. Her bf from Slipknot, Sid was the main client. 


Here and there some chick I assumed was his partner (I didn't see the beginning of the episode so missed the intros) inserted herself in certain scenes. At a certain point it was either mentioned or I realized that the chick was actually Kelly Osbourne.


OMG WHAT?! Huge fan of Ozzy & I had watched this girl on tv for at almost 2 decades at this point. I knew her on sight for sure. I did NOT recognize this girl. Even after I knew it was her I was like... That's Kelly fuckin Osbourne?? I was so shook.


So yeah this ...scary transformation of hers has been going on for sometime. With her and her mom's issues w weight, there is definitely some body dysmorphia going on, among other things. Her dad dying is just amplifying and adding to her anguish.  Hope she can make it through to the other side towards health and healing.🙏,Well rest assured, she's not going to have much of a body to shame if she continues on this path.,“What I got they used to call the blues.”  🎼🎼🎼,Two things can be true,She body shamed alot of celebrities in the past.,I think her lip filler, probable buccal fat removal, and heavy makeup is what’s aging her and making her appear frail more than anything. Her and Sharon both look like they’ve had work done alongside Ozempic use, and it’s exaggerating certain facial features.

But I’m old enough to remember when Kelly, Sharon, and Jack were frequently fat shamed by people making similar claims that they were worried for them and concerned about their health. We don’t know what someone is going through, especially those in the public eye, so I do my best to refrain from making judgements about people regarding their weight.,It’s not being critical or body shaming. She needs to go into the hospital immediately. She is not well. Everyone acknowledges that and she needs medical attention.,She has to stop using her father as her excuse.  

She is clearly dependent on weight loss drugs.  Until she is ready to face that issue, she really needs to just stop 'protesting' about it.,I feel for Kelly. Mean comments are never helpful, but when someone looks rail thin, well past the point of healthy, concern is definitely warranted.,I thought that was Sharon in the thumbnail,Poor Ozzy, snatched away from us at such an early age with a child dependent upon him.,Why are any of the remaining Osbornes getting any press? Fucking a famous person and being the result of that fucking, doesn’t do anything for me.,People get that Kelly

But you also drastically altered your face to a point you no longer look human and to expect people to not talk about this is ludicrous,Dangers of OzzyZempic,She reminds me of how Tammy Faye looked when she was dying of cancer. I know some comments are cruel but she genuinely looks sick.,She's freakishly thin.  It's obvious she needs intervention.  Not shaming.,Ok, so it’s really rich to hear her talk about body shaming. She was on that show with Joan rivers and they were pretty terrible.,Attention seeking,She looks gross,This is anorexia.  It’s not even subtle.  It’s unhealthy and concerning.",,false
14,1mg9ofv,LeopardsAteMyFace,"Nazi woman posts herself doing a Sieg Heil, immediately gets shamed by Nazi men who gets mad at her for not covering up, ""having a high body count"", and having bad posture.",,16720,1460,2025-08-03 03:56:38,https://www.reddit.com/r/LeopardsAteMyFace/comments/1mg9ofv/nazi_woman_posts_herself_doing_a_sieg_heil/,"u/WhatYouThinkYouSee, your post does fit the subreddit!

See OP's reply-comment below for context on why this fits this subreddit.,I can't imagine how much of a fucking loser you need to be to turn to Nazism to find acceptance.,I love that for her,Nazi women when they realized all Nazi men are misogynists: 😱,I love seeing them eat their own.,Racist White Nazi lady finds out white supermacist men are also misogynistic 

Oh well,throwing romans  <vomit>,You mean Nazis aren’t feminists?! /s,Imagine being a pick me for the absolute worst people and they still won’t pick you.,As if this post didn’t give the game away?

https://preview.redd.it/v6ze17w1bqgf1.jpeg?width=1170&format=pjpg&auto=webp&s=fa3ed42afa61d2d1812d57f75a621311274e813c,Holy shit.

Is that what Twitter looks like nowadays?

Jesus fucking Christ.

We have a real serious Nazi infestation going on.

I think you should arm yourselves if you haven't already. Just saying.

https://preview.redd.it/v7xsovwxcqgf1.jpeg?width=1024&format=pjpg&auto=webp&s=a96214184e262ab0895201b7deead1b68bc76c91,[Like this is just fucking comical at this point.](https://www.reddit.com/media?url=https%3A%2F%2Fpreview.redd.it%2Fyeg8t0f69qgf1.png%3Fwidth%3D1179%26format%3Dpng%26auto%3Dwebp%26s%3D66b3e80ae7d4a0361955acb8aa92ad218d5b3b60),All these superior specimens deserve each other.,These women are incredibly dumb. Let them feed themselves to the leopards. Who cares.,Them right wing men are going to struggle with relationships if they tear apart the women who do sympathise with them.,I love that the CHUDs still haven't figured out that selfie cameras mirror images. 


Also, thumb rings = lots of fuckin'? When did this happen? ,When being a Pick Me Goes Horribly Wrong.,Wtf is wrong with these people.,This is fucking horrifying. Some of them are (hopefully) bots, but some of these scumbags are real.,oh, florida.  You keep staying classy,wtf even is this?,This shit is exhausting. 

Today I ran across a post from a MAGA lady that was a deepfake voice of Virginia Guffiere saying it was a recording that posted from a “deadman” switch that released it, where she said Trump was around but never did anything but on Epstein’s island she witnessed Barack Obama molesting young boys like “all the time” and Bill Gates liked to inject young girls with his own genetic experiments. 

WTF is wrong with these people? You know they eat that shit up, and post it everywhere. It was so fucking stupid it felt like an audio version of a Nigerian Prince scam, so only the very stupidest of MAGAts will lick it up and spit it into another MAGAts mouth.,They hate everything that's not an adult white male. And even then, they hate each other because they're all trying out alpha-facist each other to prove they're not weak.

Silly, developmentally, emotionally and intellectually damaged boys.

Lead really did a number on this country,The comments are so cringe it's hard to tell if it's serious or parody.

If it is indeed serious, I don't think there's any 'superior race' to worry about.,The whole thing is so cringe, like bottom feeders arguing who’s devouring more shit,Way to go, Serena Joy.,Hahhhhahahhahahaah she's fighting in the comments to be one of humanity's worst people.,These people are seriously disturbed. There is so much beauty in this world, and they choose the path of anger, hatred, and brutality.,She's pregnant. 


Someone call child protective services stat!,Horrible form LMAO what is this the racist Olympics?

She's been training all year for this Josh!

Ooooh, what happened? Arm height is too low, elbow appears hyperextended, thumb not tucked and lack of stoic stupidity on her face, I give it a 4.2 out of 10, this puts her in last RacistPlace, she's gotta be disappointed with this performance.,They're all so fucking stupid,I feel sorry for that lil Hitler she's going to birth. I wish the celebration of nazis was illegal like in Germany.,*“Local woman expresses support for prominent hate group, quickly discovers she’s not actually a member.”*

What a jarring experience it must be for conservatives to learn the Nazis would turn on them too.,The breeding stuff is so weird. I can’t believe there are women that are down to be brood mares for this cause.,Them: “eVeRyOne yOu dOn’T LiKe iSn’T a nAZi”

 Also them: “Sieg Heil!!!”,Always remember, folks: if you think you're one of the good ones, you're not. You'll never be.,There is no gain for a women to be in the right wing space.

U have to be a complete idiot as a women to be a right winger.,First pic she says All the pretty girls

Where is the pretty girl? 🤔

I see an ugly Nazi skank,It's like watching monkeys throw shit at each other, but without the class.,thumb ring.. high body count...

were the fuck do they grow these morons,holeeeeee shit what did I walk into.,Jesus Christ, who are these people??? This is just a normal thing now??,Everyday I see something that makes me lose hope for the world, I’m so damn tired of all the MAGA fucks who think they are “cool” or that self righteous bullshit they try to pass off. It’s hard living in south Texas where every step you take is just another bigot who deems everyone less than them. I’m tired man,I wish everyone involved a very successful worst day of their lives.,They're all fighting for the braincell,Why does she keep insisting she’s using her right arm when it’s clearly her left lol,When the pick me’s don’t get picked,https://preview.redd.it/4d4vfjj42rgf1.jpeg?width=1179&format=pjpg&auto=webp&s=dfedf5875908db4078b79c416c9f4a90889f872e

Fucking snowflake,Nazis doing some online gate keeping. What a time to be alive.,Hitler senpai notice me! UWU!",,false
15,1o0cz5w,instant_regret,She tried body shaming him and bro fought back,,27671,512,2025-10-07 12:10:31,https://www.reddit.com/r/instant_regret/comments/1o0cz5w/she_tried_body_shaming_him_and_bro_fought_back/,"This reminds me of that clip from some show where the teacher goes you can’t be fat and mean choose one.,This is one of the best comebacks I've ever seen. Guy called her fat without calling her fat, without actually resorting to name-calling, and simultaneously called out her shitty behavior. Amazing 👏,There are so many situations people talking about my grey hair (I have “too much” of it for my age). 
I also enjoy giving good answers in situations like this,And he didn't even have to say anything actually body shaming wise, it was the implication ONLY about the likelihood of how she would have a double standard,*two snaps in a circle,I love the sigh at the end. Like he was so disappointed in her for making him go there.,Being rude about someone's looks while your fat is actually spilling out of your clothes is wild.,Her double blink at the end lololol.,I mean... He's right though.,That's called a warning shot.,like why did she have to say that😭 i can’t tell if it’s a bit,![gif](giphy|RdKjAkFTNZkWUGyRXF),![gif](giphy|TbXf9JHT3ex1rIMPKi),She chose the wrong dude to body shame that's for sure. This man has no filter and will destroy you if provoked 🤣🤣,This so old and yet is still very much satisfying!,She can dish it out, but then she makes two plates for herself.,That’s Zach Justice for anyone curious. Hilarious and a very genuinely nice guy., People in glass houses...,I was always told that you can make fun of someone for something they chose, but not for something they had no say in. Meaning when joking around with your friends. 

So, you can make fun of your bro for having a stupid haircut. But you can't make fun of him for being short. 

The reason I bring this up is because I made a completely inappropriate joke about someone's height when were all kidding around and I lost a friend over it. The thought makes me sad, and I've vowed to spread what I've learned so that others don't make the same mistake.,I like how he beat her to the punch too 😂 

> Goodness. Here come the comments 

Like there's no coming back from that on her end. Especially since she opened that door.,I mean, he ain’t wrong. Once you put yourself in a position to throw rocks get ready for rocks.,She asked for it,Most ridiculous part is that he literally looks nothing like a who from whoville..,![gif](giphy|80TEu4wOBdPLG),Not all heroes wear capes.,Looks like she’s over flowing, the sheer audacity of her to body shame is pure comedy.,![gif](giphy|twxoPjMpsijwPFBVqs|downsized),Girlfriend did not like that! Go get em son, don’t take any bullshit!,A person from Whoville? What an oddly specific burn.,![gif](giphy|ro08ZmQ1MeqZypzgDN),Glass houses... Stones...,Bro destroyed her confidence for the next years,![gif](giphy|13n7XeyIXEIrbG),Love that she has no reply,I honestly can't believe there are any people in existence that don't hate Fanita. Like imagine being around this shit all the time,I may not have any lips...but you're fat!,“Here come the comments” 🤣,Don't dish'em if you can't take them.,People are way too comfortable in bodyshaming in general.,She could open a bakery shop with those rolls.,![gif](giphy|h6aSxh80iVnNTip9LN),I expected like no upper lip… looks totally normal to me,Just hate that look she gave him. Just insulted him, he gave it back with something she could control and she looks shocked he dared say it. Fuck her.,you look like you ate everyone from Whoville.,*It's ok when I, or people I like, do it.*

-Lotta people ... in everything, conversations, politics, etc,People need to learn to keep their petty thoughts to themselves. She absolutely had that coming. He has a very valid point.,When Cameron was in Egypt-land... Let my Cameron go...,He's right, though.,Oof. That silence was loud,![gif](giphy|TWWWn7W1CQQSK1kGK3)",,false
