,post_id,subreddit,title,text,score,num_comments,created_utc,post_url,comments,image_urls,over_18
0,1rjrb9w,InfinityNikki,the outrage about characters body shaming nikki is silly,"if you guys played through the story, one of the very first pieces of lore you get is about how roucoco defies conventional beauty standards and the things she does to subvert these expectations",862,143,2026-03-03 14:51:18,https://www.reddit.com/r/InfinityNikki/comments/1rjrb9w/the_outrage_about_characters_body_shaming_nikki/,"I’ve been ignoring those posts tbh. I have a lot of self image issues and disordered eating. But watching a bunch of sentient mushrooms body-shame Nikki, who is built like a Barbie doll, does not offend me. 

I think it’s actually great they have “tougher” subjects in the game. It’s also great how confident Nikki herself is, as she immediately rejects and disapproves of how they were speaking of her,People need to learn media literacy and realize that portrayal doesn’t equal support…,I thought it was pretty obvious that the story was making a point to tell you that body shaming isn't okay 😭😭 I didn't read this kind of stuff either, I got that straight from the dialogue, they kinda throw that basic lesson in your face the whole time lmao,I thought it was really obvious from the get go the it’s about unrealistic and unattainable beauty standards, especially within idol culture. I just wanna mention that I too have body image issues and when through having an ED in my early 20s and still deal with body dysmorphia to this day and can appreciate how hard Nikki pushes back about beauty not being a physical thing. I’ve always appreciated media that’s willing to tackle serious subjects, especially ones that are personal to me, it gives me comfort. But I also know that everyone copes and handles with things differently, so i think people should probably avoid playing through this event if it strikes too close to home. ,I like what they're doing, it's a critique of beauty standards which are absolutely brutal in China and it's sending a positive message overall. It's cool to see!,The people complaining tells me that a lot of players skip the dialogue and base their opinions on the very little they heard.,Art should be able to convey complex and challenging concepts. This game has already shown many times that it is not afraid to breach sensitive topics, this is tame in comparison. ,I don't understand those posts. If you care deeply about an issue shouldn't you want more awareness brought to it? This whole patch is criticising body shaming and harsh beauty standards.,I played the whole story after the patch launched.

I cried because I saw my whole life story there without the fame factor, even the happy ending was the same.

And I'm happy it was written like it was, I hope more people get to know how it felt for me to grow up and come to terms with my own flawed self, how I myself embraced both sides.

It may be pedantic on my part here, but I related way too deeply with the story this time.,Crackpot theory: Some people complain about everything that gets released in hopes of more free diamonds

![gif](giphy|J20Z2SH5WmCnzSrbqA),They saw the posts about how players are dissatisfied with everyone always glazing Nikki 😭,I didn't care about them poking at Nikki's weight. But everyone insulting my outfit I was ready to throw hands.,Unfortunately, some people react before seeing the full context, like not reading the in-game text, half‑listening to dialogue, or shutting down as soon as the  sensitive topic appears. So in this instance they miss that Nikki and Roucoco are clearly pushing against these harmful standards. And it’s made known they are against it pretty early on. Social media unfortunately  amplifies this by rewarding quick reactions to triggers rather than the full narrative, especially for people who  may struggle to process difficult subjects.
In this quest line, the game signals early that the beauty standards are bad/negative. 

Like when the Shroomlings judge  Nikki for being too wide despite her being obviously thin, and Nikki openly questions why these things  are “perfect”. I’d def feel differently if the game depicted Roucoco’s struggles in a graphic or explicit way, (like very detailed or graphic depictions of like an eating disorder or self harm to fit the standards of the contest) but IMO this is like basic going against harmful beauty standards story beats especially throwing in the contest aspect of it all.

TL;DR - I think seeing the whole picture makes everything make more sense and some people are ignoring or missing it and working themselves into a frenzy 😅. 

The level they did this at is no worse than what’s on TV like *some* shows geared toward pre-teens and teens, which IMO are  worse for depicting because they go for shock value.

EDIT: Also adding, not trying to dismiss anyone’s trauma or triggers, but there are levels to this kind of stuff and in my experience (for non body/eating related stuff) like 80-90% of interacting or engaging with your traumas/triggers rely on you and properly assessing what’s best for you. If that means you need to step away from something temporary (like to re-centre and/or get more context of your distress to work through it) or permanently. Then do that. You can still advocate for wanting trigger/content warnings but you gotta look at the big picture outside of yourself too.,I also have pretty bad body dysmorphia, to the point where seeing someone with my ideal body type can cause me to spiral, and I liked how it was handled in the story. I've been waiting for the game to tackle more mature subject matter instead of just hiding behind the cozy comfort game excuse to release extremely sanitized stories that infantilize the player.

That being said I understand people have different triggers, and I'm not opposed to the game adding a warning. Personally though if they include a warning for bodyshaming, there should also be ones included for things like the Piecey trafficking ring in 1.10, or the presumably dead child in 1.8, or anytime the game goes in-depth about loss and grief like they've done plenty of times. Mainly because I know people who would also be triggered by those topics, and I think they deserve as much consideration as those with body image issues.

Honestly I think a general this game deals with sensitive subjects such as... warning on launch or on the download page would work. At the very least so people don't get completely blindsided.,Its really on the nose how ridiculous they are being. Its very clearly suppossed to be negative, they literally say how non of these ridiculous beauty standards matter and that you should be true to yourself. 
I was way more concerned about how random the unicorn felt ,“genshin players can’t read” is out, “infinity nikki players can’t read” is in,When I started playing I was like what? Then I just kept playing and finished the story and I felt understood. This story arrived at the right moment for me. ,people are outraged about this??? pleaase infold do ur thing and don’t listen to them we want more stories with topics like these 😭 is media literacy dead?,Agreed. Infold isn’t really doing anything wrong by trying to spread a positive message. Like it’s totally valid if the topic altogether might trigger someone regardless of what the message is, but if that’s the case then they can just skip the quest or dialogue. As an American I also try to keep in mind that in China, talking about weight is less taboo than it is here. I also say this as someone who struggled with an ED in the past. 

,I’ve only seen trigger warnings, not complaints. But this is gonna be a reddit thing where there is an influx of posts, an influx of complaints about the posts and then complaints about the complaint posts until it fizzles out in sth new,The games always have dark moments. We literally get guns in the first 2 hours in Shining Nikki don't we?,I’m learning to ignore the complaining posts even the ones abt the deer. 

Social media has conditioned a lot of people into impatience and reacting to the cover of a book.,I find the story dialogue a bit funny, and I mock outraged at being called wide. (Also it's ridiculous given how shiny my in-game outfit is...) 

But I actually like that the story is making people uncomfortable, because I feel like that makes this topic a bit more genuine. It's an uncomfortable topic, and way, way more wide spread in every Asian country I've visited. (There are laws against having overweight employees in Japan, and their definition is way stricter than ours!),I haven't seen outrage. I did make a post about a trigger warning that got down voted, and I was just pointing out that it might trugger some people. I was just worried about those people, as someone that's been in those spaces and still has some friends in thise spaces. I think people misunderstand.

As an aside, it just kinda sucks when an attempt to be kind and considerate is deemed an attack and people get on you for it. It keeps happening and atp it feels shameful to be considerate.,In general people need to manage their own triggers instead of expecting the world to bend for them. The intentions of this quest are so obvious.,I think this representation is totally fair. Just because it is a sore topic for many doesn't mean it shouldn't be represented. And, furthermore, the lore makes it clear that the point is NOT to say this is good and this is bad, but rather that beauty can be found in all things.

But I know I am still skipping the dialogue and not paying close attention, because it can be triggering for me on bad days to hear any kinds of body-specific comments. I'm glad I saw a post warning about this, but that doesn't mean it can't have been done well in the story.,i feel bad for people for whom a cartoon mushroom (under a spell or hallucinating or whatever) describing nikki (barbie shaped) as too wide/big is genuinely triggering. that must be an exhausting way to live.

but i also think we have an overreaction problem with this game/in general actually where outrage is welcome and context and logic and literacy go out the window. ,Shows they have never played love Nikki. Momo was calling Bobo fat from the second he saw her and was overall a rude Lil shit.,It's fair for there to be a content warning for those who may need it. Regardless of the context, that kind of material can be very damaging for some people.,I had a lot of self-esteem issues and insecurities. I was very, very chubby, and people often commented on it. I cried. I wasn't comfortable with myself and wanted to change. Now I'm much skinner. Sometimes I don't eat, or I do a lot of cardio to compensate for what I ate, and I end up exhausted. I like to dress cute to feel cute, but my mind sees my past in the mirror sometimes. And well, I'm not saying everyone has to change like I did; it was my own decision. But I think it's also realistic to expect that not everyone will be nice, and some people will make negative comments, whether it's about how you look or for any other reason about you. I had enough of those comments in my chilhood and teenage. Even Nikki says Bro, that's rude, I don't agree in response to those comments, so I think it's fine, It's not as if the game wants to impose those ideas.,It really caught me off guard initially because everyone was so rude but as the story went on it made sense. 

But I think people deserve a bit more empathy.

But, I do think infold should have added a little trigger warning before the story started, especially for people who have body dysmorphia/eating disorder/etc.

There are two types of players first who think they are a bystander to Nikki, and secondly who think of themselves as Nikki when they play. If we take the latter group of people and make jabs at something they are already insecure about, it hurts. Insecurity and perception is not logical. And just because a lot of people are not personally hurt does not take the hurt away from others. ,All I saw anyone ask for is a trigger warning which is really not unreasonable. I don't think really anyone is missing the message ,The first person that even got a lot of traction on their post was a genuine warning, though. Not everybody takes that stuff with the same level of severity,that's cool and all, but *maybe* you should spoiler tag this.,https://preview.redd.it/t8ynzqzgo1ng1.jpeg?width=4032&format=pjpg&auto=webp&s=64057219adf5a4593f473348990115a79f636df4

also nikki saying that clothes are meant to fit people and not the other way around. Slay queen,I don't think we should be calling other people's triggers silly, eating disorders are very serious and these things can still be triggering, even though Nikki immediately rejects the comments. Disorders are rarely based in logic. I also don't think this should be removed completely, but I do wish there was a warning. I appreciated seeing it on reddit first because now I can be sure to do the quest when I'm in a better mindset, rather than a day where something like that would send me spiraling. 

It's really disappointing to see that people warning others who may be sensitive to such content and asking to just have warnings, not even entirely remove the dialogue, are being so heavily downvoted.,I hate how community's nowdays forgot how to ignore things they dont like,You know, when I first got started, I was like “My daughter plays this game, idk how I feel about it..” but very basic reading comprehension let me know it was a body positivity thing and that actually, it has a good message in there. ,I thought the part where they were body shaming Nikki was hilarious, especially when they started dragging momo into it for no reason.  It was actually kind of refreshing, after all the mindless praise and affirmation she gets, to see the opposite happening,These people need to shut tf up - we’re finally getting more adult storylines instead of festivals all the time and now they might ruin it bc they can’t fucking read😭🤬,LMAOO I played this quest last ngiht and I had a feeling there would be upset, despite the message of the overall quest being the polar opposite,It must be really exhausting to be triggered by literally everything where a fictional mushroom character is saying that you are wide.

My god what a headache.,This is why trigger warnings should be more normalized. 


There is a lore reason, and this event is a story about pushing back against unrealistic and harmful beauty standards. That's all fine. 


*But*, if you are someone who struggles with body dysmorphia or eating disorder, watching a scene where Nikki is surrounded by shroomlings and criticized for being too big can be very distressing.


A disclaimer at the beginning of this event would have been helpful for those who are sensitive to these issues. So they are informed enough to choose to skip through that cutscene or else be prepared for it. ,I have not played this story yet, and I’m also grateful to not be someone with trauma that overlaps with this conversation despite being overweight.

However, dismissing something that is triggering for someone else as “a silly complaint” is not doing what you think is doing. It is clear the story will have a good message overall, but not you nor I will be able to dictate what parts of the story will trigger someone and how.

These aren’t “complaints” for complaining’s sake, these are people that have the right to feel some sort of way about something they experienced first hand and none of us have the right to downplay that, or worse, silence them. 

My advice is to stay in your lane. If you don’t like or understand why these posts are being created then do not engage, we don’t have to be part of every conversation that comes our way. ,let's judge the story as entirety, with all of it's parts in place  
\-- not just take the dark driver for drama out and point at the obvious  
this is bad! - yeah. i wonder why.,where are you guys seeing these posts? (i’m really only on tiktok),less about the event and more about the lack of tact, if a player is in a sensitive mindset regarding that it could have unintended consequences for their health. i think this story should have come with TWs for that reason. i also think this story was poorly written but that's neither here nor there tbh,You are correct, but I get where the outrage is coming from. This is one of the few times in gaming history where body shaming is portrayed at this sort of scale. Most players don’t know how to react. My best advice is to just finish the story, let everybody else get their feelings aired out, and focus on other things. And for people who have genuine eating disorders, there’s plenty of medical treatments out there.,This lore book is found after the shroomlings complain that Nikki is too wide. Even if it was found first, context and justification doesn't make triggers magically go away. For a less subtle example, knowing it's July 4th doesn't mean a soldier with PTSD can't be triggered by the fireworks. 

It's not silly that people have triggers that you don't,that writing can still be very harmful to people with disordered eating. like yeah everything ends up fine but it was like having my mother talk to me with malice in her voice again when i was 8. just weird and honestly unnecessary, there’s definitely a better way to write all that if u still want its end results lol",,false
