,post_id,subreddit,title,text,score,num_comments,created_utc,post_url,comments,image_urls,over_18
36,1mizca4,changemyview,CMV: Mocking someone's appearance because they’re “a bad person” is still body shaming,"I've noticed that people will mock someone's looks (usually face, weight, and d size) if the person is considered morally bad. But if the same exact person had the same body but was considered a good person, nobody would say anything. This just shows that people will find any excuse to be cruel once someone is no longer seen as deserving of empathy.

Yeah, call people out for their actions, expose what they've done, but bringing their looks into it doesn't make you better than them. It just reinforces the idea that certain body types or faces are wrong, even if you only say it when you think someone deserves it

It's still body shaming, and it still affects people who share physical traits but haven’t done anything wrong

",3125,423,2025-08-06 08:44:29,https://www.reddit.com/r/changemyview/comments/1mizca4/cmv_mocking_someones_appearance_because_theyre_a/,"You’re not wrong about what you’ve said, it’s just a much broader issue than you’ve described it to be. Basically it’s a case of moral inconsistency, where we apply our morals selectively rather than universally. We all want to think that we’re principled and would follow our principles no matter what, but that’s not really the way we think.  
  
To give you an example from the other side, people often praise the courage, perseverance and steadfastness of people we agree with. That seems to imply it’s those principles that we're praising, but we never recognize them in people we disagree with. A terrorist who truly believes in his cause and who keeps fighting against all odds is also showing perseverance just like a civil rights activist, but we only praise the latter’s perseverance. ,Society, in general, is very hypocritical.  It will never change.,Doesnt it just show that those people actually do hold negative views of people who are fat and are really just pretending to adhear to ”body positivity” as some kind of virtue signaling?

Otherwise they would presumably not regard ”fat” as an insult.,[removed],[removed],I would say the exception is when a part of them being a bad person is body shaming other people, especially if they have the same or a similar body type.

As an example -- I was at a party and the older sister (friend of mine) of the birthday boy (very good friend of mine) made a number of comments about his weight. So I said -- well, that's the pot calling the kettle black. She asked what that meant, and I said, you're making fun of your brother for being fat, and you are also quite overweight.

I wasn't proud of that moment, but bashing on someone for their appearance or for their body shape when you have the same problem definitely opens the door for some turnabout imo.,I agree with you, however I don't think the people doing this don't think it's body shaming. They most likely know its body shaming, _they just think it's **justifiable** to body shame them_.,I agree with this statement, looks have no correlation with how good a person is and mocking one of their physical attributes leads to others having negative ideas on themselves due to the shared attribute. 

But since this is r/CMV I will also present a different perspective. 

Most often stopping someone from thinking something is cool is to shame them or that thing. In my opinion, if some gets a n*zi tattoo or change their physical apperance to signal any kind of discriminatory views, (so if they use their outward appearance to express racist, sexist, homophobic, transphobic etc ideas), I think it is 100% valid to make fun of them for having that or reject them from getting certain oppurtunities (school, work, relationship etc),I agree with you on principle. However, there are nuances in these conversations, and there are some instances when mocking someone's appearance is called for to point out their lies and hypocrisy.

I'll use the most obvious example here of Donald Trump. I have seen many people mock Trump's appearance, especially his weight. I have also seen many people say that you shouldn't mock Trump's weight just because he's a bad person.

On principle I would agree on this. However, when Trump comes out with a clearly fake doctor's exam paper that claims that he is in perfect shape when anyone can see with their own eyes that Trump is obviously obese, physically in bad shape and visibly unwell (partially because he does not exercise and only eats junk food, and partially because he's so old his body is starting to crumble) it's hard to point that out without at least somewhat mocking his appearance. Combine this with the fact that he has posted AI-generated pictures of himself as a jacked up, muscle-bound bodybuilder, you can't help but mock the dissonance of how he sees himself and what he actually looks like.

So yeah, most of the time I think mocking someone's appearance is uncalled for, no matter whether you agree with them or not. But if some fat schlob tries to paint himself as some Adonis-like example of perfect physical health and fitness, I think that calls for a little bit of mockery.,People who say they are allies to the LGBTQ+ community will also use homophobia to insult people they don't like. It's wild.,How you feel about your body has very little if anything to do with the comments people are making about standards of attractiveness in general. People who obsess over their own flaws to an unhealthy degree tend to seek out evidence that the world is holding them to an unfair standard in order to make sense of their own experience. They aren’t just living their life and suddenly targeted by an inescapable stream of body shaming content.

Why do you think incels know every obscure dating statistic out there? That information doesn’t find them, they seek it out.,I mean yes, just like when a soldier kills his enemies he is still killing someone.  Conflict isn't nice, and sometimes aggressive action is needed to win.


I think we can agree that body shaming is less bad than killing someone, and ought to be a preferred means of attack.  ,Yeah that's true, but unfortunately, it's fun,It just shows that these people who love to virtue signal and play the acceptance game online actually have no principles and don't even believe in what they preach.,Not here to change it, I've seen it firsthand quite often. From my personal experience I've found it's also frequently the people who always claim to be about body positivity etc etc, who are the first people to jump on insults about the appearance of people they don't like as well.,I agree with you. Although sometimes pointing out hypocrisy can *seem* like body shaming to the undiscerning.

For example:

Person A: That person is fat.

Person B: But you're fatter...

Person C: Just because A is a terrible person we shouldn't body shame! Some fat people are nice!

Where person B wasn't actually body shaming, they were actually just calling out hypocrisy.,Yea. I catch myself doing it sometimes and I hate it. I grew up with parents who did this and now find it distasteful, but I’d be lying if claimed to have completely outgrown it.,Body shaming is bad and I think its ok to do bad things to bad people,You're absolutely right.  It's a slippery slope.  Even if someone's actions are reprehensible, attacking their appearance doesn't address the actual issue and only perpetuates harmful stereotypes about body image.  Focusing on their behavior is crucial; their looks are irrelevant.,Yes, and I'm totally Ok with bosy shaming if they're insolated pieces of shit with lots of power and don't answer to anyone,Notice this all the time. People want to act all everyone’s beautiful! Everyone deserves love! But as soon as an ugly person makes a mistake they lay in on his/her’s appearance HARD.,I'll agree that you're technically correct. But when you have an issue with someone, you'll rarely care about their feelings on the matter. You'll find some overlap of people who, for example, will argue you shouldn't call fat people names. And then turn around and call Trump a fat pig. But that's because there are feelings involved and we're not all robots who think and act only logically.,I wanted to change your view, but you changed mine ;(


Calling somebody a fat fuck is no different from black cunt. And that person being a fuck or a cunt has nothing to do with them being black or fat. So adding that adjective is not a personalised criticism ,So here's the thing, are you familiar with the mar a Lago look? Fake blonde, hideous makeup, Botox, fake boobs, etc. These are all active decisions these people made, none of it is beyond their control. So it's fair game for mockery. If a Nazi Barbie wants to take the time and effort to modify their appearance to look like a Nazi Barbie, I'm gonna make fun of them for doing it. Is it body shaming? I don't think so, because it's not their natural body.,[removed],There's nothing wrong with body shaming someone who shames others for the same thing.

Like Trump who says that certain women are unattractive and that he'd never rape them, when he's a big orange-dyed turd in a suit with flabby jowls.,In my opinion, the moment someone bodyshames someone is the moment that person showed that they sre okay with being bodyshamed themselve.,I bodyshame US regressives and similar hostile people online because they're generally simple, prideful, openly hypocritical about their *own* bodyshaming (insulting people for stuff they feel bad about getting called out for themselves), usually thin-skinned in very egotistical ways, and otherwise ignore or armor themselves against more thought-out and developed criticisms of what they actually believe in or do.

It's not meant to be nice or pleasant. Social combat and social policing are messy and can unfortunately sometimes catch people in the crossfire, especially because the internet has been turned into a loudspeaker to pit people against each other for algorithm engagement, but it's one of the only ways to try to erode the ill-earned sense of pride and audacity that a lot of these people have and try to shame them out of continuing their bullshit while they have confidence in numbers and their growing political influence.

I'm sorry this hurts you sometimes, but the people getting insulted are so much worse and we need every social weapon we can get against them right now. Bullying works or so many thousands of people wouldn't have scars from it.

Edit: Upvote because I earnestly understand what you mean, and I do wish this wasn't the world we lived in. But look where we are because the exact kind of people you're unintentionally defending are no longer afraid of social repercussions.,Mocking d size isn’t so much about “appearance” as it’s often unverified. People tell someone their d is small or large based on how they act: small d means pettiness, arrogance, low confidence. Big d means confidence or kindness. 

Kind of like “being the bigger person” doesn’t mean fat or tall. Or “having a big heart” isn’t based on any physical data. The d is a metaphor. 

Other than that, I grew up fat and always thought “if the worst thing someone can say to me is that I’m fat, I’m doing pretty well”. Medical facts are facts. If you’re obese, that’s about BMI and doesn’t say anything about your personality. Some obese people are bad people, some obese people are great.

If someone says “you’re a cheater and your purple shirt is stupid”, that doesn’t mean everyone with a purple shirt is a cheater, or that all purple shirts are stupid. People shouldn’t take things personally, especially if they’re not directed at them.,[removed],If I can see it or it's known to me doesn't matter the person I will weaponize anything to claim victory. 

Never falter! Never surrender! Never show weakness!,Side opinion: micro dicks are Genuinely funny. Not because of the person they’re attached to, and not in a mean way. But just seeing a little helmet forging through the pube jungle always cracks me up.,[removed],And it's body shaming but it depends if it's good or not on context. For example, Hitler and white supremacists are all about the white race being better with the blue eyes and blonde hair, so making fun of them for not having them isn't saying that brown hair is bad and who the same that they don't even have the traits that they claim are better and makes them Superior. 

I'm gay myself so this discussion did does come up and a lot of circles when it comes to politicians being caught having gay sex . Calling them gay or in the closet is insane. That being gay is bad, only that they are hypocrites,Yep I 100% agree- I’ve been saying this for years. Example: you have an arch enemy Susan and a best friend Ashley who are both relatively the same size/weight. Susan is a bitch to you and you’re venting to Ashley about how much of a bitch Susan is. You say Susan is just bitter because she’s fat and ugly and no one wants her. You are indirectly calling Ashley (who is the same weight/size) fat as well. Even if you don’t care about the person you’re insulting, and even if they really do deserve to be insulted, you’re indirectly hurting good people and possibly people that you love, if they look like Susan. As an overweight young woman (size 10/12 my whole life) this has happened to me frequently and always cuts deep and makes me distrust those friends who do this and then turn around and tell me that I’m not the same, I’m not fat, I’m beautiful, they don’t notice my weight, etc.,Oh, that's far from the only double standard that gets employed. When I ask liberals if they're willing to accept principles are rules that must never be violated, not a single one will agree. They make all kinds of excuses but it ultimately boils down to preserving the right to use double standards. Their current tactic is to dismiss both sides arguments, basically implying things that apply to the other side don't apply to them because they're more right.,I’ve seen this in real time. Couple years ago, there were a group of people who’d defend Amy Schumer whenever her looks were attacked, rightfully so. Currently those same people would insult her looks (especially her Cushing syndrome) on the basis of her being a Zionist.,IDK, if a person accuses people of being weak and soft, while presenting themselves as some kind of alpha, its fair game to point out obvious signs of laziness. 

Andrew Tate wants to refer to guys as simps and betas, Im going to point out his weak chin and skinny arms. If Trump wants to present himself as some kind of super hero, I'm not against reminding people that he is a fat, lazy fuck. 

>Yeah, call people out for their actions, 

Being an asshole, while letting your body go to shit, is an action. Don't lecture me, while you sit home eating McBurgers all day.,CMV: body shaming isn’t bad and some people need to be ashamed of their bodies,I mean it is,❤️❤️❤️,THANK YOU,Don't disagree. I just don't give even one single fuck. Some people deserve to feel bad about themselves.,I think it also takes away from valid criticism about their actions, behavior(s), etc. if anything.,It has to do with using any tools at your disposal to make those people less human and deserving of empathy. I have to say I do it a lot when someone messes with others and create chaos and suffering around them, because what else do we have at our disposal? 
In a way, it’s a healthy coping mechanism.,I mean, sure. Murder is still murder even if you do it against bad people, stealing is still stealing if you do it against big corpos, etc, the list goes on. A bad thing doesn't turn into something else just because it's done against bad people, but that doesn't mean it's unjustified in the same way those bad people attack innocents who were just minding their own business. It's not about having the moral high ground, it's about inflicting assholes with the same thing they love to inflict on others, especially because it often works. You might think it's still a bad thing but saying it's just an excuse for wanton cruelty is nonsense.

This doesn't make you better than them is silly comic book stuff, the kind of thing Batman spouts to justify not killing the Joker after he killed thousands of people (and so that DC can keep printing money). It's just a false symmetry to say that mocking an ugly guy for being ugly in response to, let's reach here to ease the argument, him being a racist is virtually the same thing as being a racist.,[removed],Rules count for “good people” so no body shaming only counts if you like the person, or deem them as good. If there’s a person you dislike who is being unkind and is say overweight its immediately fair game for most to destroy them on their body.,People who do bad things don't care that the things they do are harmful. As long as it benefits them, they couldn't give less of a shit who lives or dies in the process. The best way to upset someone who can't be upset with themselves is to show them something worth being upset about: the pimples on their face, the disproportionate distribution of fat on their body, the unsatisfactory size of their dick, etc.,Once you open that can of worms it’s fair game.",,false
