,post_id,subreddit,title,text,score,num_comments,created_utc,post_url,comments,image_urls,over_18
25,1pkfd3j,blursed_videos,Blursed_body shaming,,2227,477,2025-12-12 01:45:23,https://www.reddit.com/r/blursed_videos/comments/1pkfd3j/blursed_body_shaming/,"[removed],FATALITY,He was born with whatever the heck was allegedly wrong with his lip, and did nothing on his part to make it worse.,If someone said something insulting to me I should be able to be insulting back. He wasn't mean and didnt even direct it at her.

She could lose a lot of weight though.,there's no way shes judging his looks 😭,She lost the weight after this which makes this funnier.,Oh that GAGGED her 😭,Shaming for thee not for me,I mean he isn't wrong,Zack’s one of the guys you shouldn’t try to insult, he has zero filter.,As a person with extremely small lips, if youre in some tiff, it's the first thing they insult...it's bizarre.

I was born with small lips, you chose to be a 🐋🐳,I don't think 911 would have been able to help,I don’t know who these people are, but he seems like a good dude and she seems to have a repulsive character. And he’s right. This chick looks sloppy as fuck and is spilling out of her tiny clothes.,He’s not wrong!!,The look on her face…she knew he was right. ,Unpopular opinion- body shaming people for being overweight should make a return. Maybe if they weren’t basically encouraged to be lazy and fat they would try to get healthier.,Hit her with the two piece with a side of fries,Perfect example of someone projecting.,Don't dish it if you can't take it 🤷‍♀️,This is inaccurate. Body shaming is fine till its about women. ,seriously why was she being so rude like that 💀,The crazy thing is many people can put in the work to lose weight.,Weight or gender, Pick your poison.,You're fat, which is in your control,Girl your belly fat is folding out don't bother with brother's lip,He’s not wrong.,In a future vid she will be saying he is misogynistic, fatfobic, racist, and an incel,Zach Justice is pretty fucking witty. He plays the grinch that is in the dates eating an onion.

He was also on 'Inside: USA' on Netflix. Pretty good show and you should also watch 'Got to get Out' on Hulu because I want a second season.,Burrnnnn,Bros wit is straight fire. 🔥,I dated a girl like this lmfao! She would literally cry cause a whole scene in public because my joke one upped hers lol awwwww man,Why would a man need a bigger lip?! He is fine as he is. The girl just proved she is using a lip filler to look plastic...,Body like a can of Pillsbury croissant rolls exploded,As soon as it panned out I knew he was gonna go there. You can't be fat and talk shit if you can't take it.,She deserved that, I hope it humbled her.,She could lose a lot of weight,Wooooooooooooof that had to hit a soft spot 😮‍💨,Good for him honestly,Headshot,shes built like a bag of dirty laundry,Emotional damage!,Shame on you,i was just looking for the whole interview and could not find it. Just this clip.,Weight can be influenced, unlike the lip.,“I’m the ignorant one—and don’t call me out on it!”,As a chubby person with thin lips: all body shaming sucks. In the 90s my lips were on trend, in the 2010s my flatmate kept pushing for me to try bee venom to make my lips bigger. Its all stupid. Bodies are bodies, be grateful if yours keeps you upright and lets you leave the house.

This guy makes a good point though, its weird to shame people on things they can't change.,Cause 2/3 of the US is overweight,Fafo at it's finest ,I thought this was commentary. Like they know each other and are trying to make a point. TBH, I also don’t think what she said nec has to be negative. I got a big nose. I like it most days. My grandma said it adds character when I was 10 and I’m still riding that high in my 40s.,I never thought that natural lip shaming would be a thing.",,false
26,1kobwet,Fauxmoi,Elon Musk body-shames Taylor Swift.,,3996,825,2025-05-16 21:07:35,https://www.reddit.com/r/Fauxmoi/comments/1kobwet/elon_musk_bodyshames_taylor_swift/,"Hi OP: please add a link to your source in response to this comment! If you are submitting from Twitter, Meta, TikTok or tabloid sources, we will verify the source and then remove the comment.,https://preview.redd.it/97cjp4t1q71f1.jpeg?width=750&format=pjpg&auto=webp&s=4f7ef4be97a816a70f97d77f4257403585170f36

🤨,I’ve said it before and I’ll say it again, Elon Musk is shaped like a rotisserie chicken.,Same guy who threatened to put a baby in her last year? Dude is disgusting 🫣 ,Typical behavior from rejected men. “You’re not that hot anyway!!”,They need to leave her the fuck alone what’s their obsession with her.,Yikes. The picture they’re using is when she was suffering from an eating disorder if I’m not mistaken. These men are psychopaths.,“Gorklon rust” “Autism Capital” “Dr. Goldencream III”

https://preview.redd.it/jzz1iywgp71f1.jpeg?width=1000&format=pjpg&auto=webp&s=b2101d8d24257ee7c911984d4f9a45a4039a0012,I want her and Springsteen to do a duet and donate it to whatever cause they choose. I am so tired of gross men.,yeah bc we really need gargoyle shaped elon’s thoughts on a taylor swifts body,1. This was her when she was deep in her ED.  So it's next level gross to mock it

2. She doesn't even look like this anymore!  If you want to argue that she's not attractive NOW, use a photo of her NOW!  It'll still be dumb AF because Elon and Trump are gross and hideous but at least it'll be present day.,Guys who look like sacks of melted cheese shouldn't throw rocks through glass houses,![gif](giphy|3lJQIuk2LTV5jEvyKv|downsized),I’m not a fan of hers at all but I hope her fans go after these gross people with all the rage of a thousand suns.,https://preview.redd.it/c7w33yiz091f1.jpeg?width=691&format=pjpg&auto=webp&s=7c981cea9de9f07f27c7b2ed9a782dfbc2ea5490,is this really true?

Like the president of the US tweeting about hating TS and how she is not hot? 

Like wtf is going on in this world this is so crazy.,I could not hate this timeline any more than I do. 

Y’all, if you’re still on the sidelines, get up. ,Where are the doxxing Swifties? The Swifties that harass reporters and come shrieking for anyone who disliked her from 2010 onward? I need them to organize to take this worthless man down, ffs. What more do they have to hear?!,Can someone PLEASE JUST…….,[removed],I’m no swiftie but I’m a human with ethics. This is sick, jobless behavior. It doesn’t matter she could look like Elon Musk and it still is equally disgusting misogynistic and morally wrong to comment on her appearance or shame her.,Has this man seen himself? ,Wtf is wrong with these people?! This is truly going too far.,Teaching young girls everywhere what a red flag looks like.,Dawg, he is out here looking like Krang from Ninja Turtles lol,Elon and DT have the comparative looks of Quasimodo and Gollum so maybe they should STFU and stop criticizing the looks of women who don't agree with them politically. Fragile men.

![gif](giphy|zhlybdTZqyWwE),It’s all a distraction. The dude is doing some super shady shit with the Middle East war lords.,I am by no means a swift fan but it is disgusting that two grown men are objectifying her and trashing her. Are they that insecure that they need to publicly bully a much younger female to feel good about themselves?,How about we stop judging people on hotness.  Being hot or not doesnt change who you are as a person.  Elon could be hot AF but he will always be a racist, sexist ignoramous.  Lets judge by character.,Uh oh, sounds like Trump and company are up to something super illegal and shady (moreso) as they're bringing out the attack Taylor distraction again...,I also just need to add that he is too stupid to even insult her correctly. This is from the 1989 era, right? So around 2014-15? IE this is the era Trump would be insinuating that she was hot in. 

He's like the class idiot trying to join in on bullying someone but then accidentally insulting the bully instead,What in the holy shit is going on here??? I just want to delete the USA. I can’t anymore,Men are dumb and I don’t respect them,It's gross and concerning how an adjudicated rapist and a known sexual harrasser are obsessed with her. Regardless of how anybody may feel about her, their behavior towards her is not normal, and I fear for her safety.,America died the day they elected that fucker.,Bold words coming from a man shaped like a tube of toothpaste,Say the men that have to pay women or molest them.,I really hope this inspires Taylor to use her billions to spite them. We need more people including rich people fighting back against this BS administration.,Ugh maybe I'm having a conversation with myself, but the snark pages are rife with literally these kinds of images and commentary, online spaces ostensibly populated by mostly women. I really hope there is wider conversation and reflection about how swimming in those waters normalizes and furthers a misogynistic, fascist agenda. These technofascist freaks understand the power of harnessing peoples attention and attitudes in this way.


Once more, highly recommend this episode of the Power User podcast: The Alt-Right Pipeline for Women, which discusses the insidious pop culture spaces so many people, specifically  women frequent:
https://youtu.be/22FbaFQ9wNM?feature=shared


Edit: to be VERY clear, I am not blaming women for these misogynistic monsters behavior. I'm poorly trying to make the connection that I think they are specifically making posts like this because this commentary ALREADY exists on these snark subs....I think they are trying to harness that popular hatred and misogyny..,As a straight male who was never attracted to Taylor Swift but never felt the need to announce it to the world I would like to apologize to the hottest woman on the planet Taylor Swift.,There is something profoundly Orwellian about that golf-diaper-wearing, short-fingered, orange puddle of fascist garglevomit accusing anyone of being ugly.,Just makes me think less of Travis Kelce for not standing up for his GF lol.,Mr Ozempic should stay in his lane,![gif](giphy|qvLt6NpOstLuVzLCL9),Very, very low blow when Taylor used to really struggle with an ED.,All I have to say that it’s impossible to be a woman. That’s it. That’s the post.,I bet he doesn't think women only date him because he's a billionaire.,Elon's face reminds me of a wet possum.,I know she made a post supporting Kamala Harris before the election (as a lot of celebs did), but unless I'm missing a lot she is not like a super active liberal, is she? Most of the time I don't think she comments on anything political, why are they so butthurt about her in particular?,Don’t even spread this crap; it’s just a distraction.",,false
27,1rpprdb,LockedInMan,Why is body shaming men for their height not frowned upon people absolutely treat short men worse than they would treat a tall career criminal,,1001,891,2026-03-10 06:47:08,https://www.reddit.com/r/LockedInMan/comments/1rpprdb/why_is_body_shaming_men_for_their_height_not/,"I'm short and I don't want my body to be celebrated  Id find being called a short king or a SSG (sexy short guy) just as cringe as someone being offensive about my height. 

What I will say is in the real world most people don't care or say anything almost all of the time. 
The worst I had was a girl I'd spoken to a handful of times say 'you are quite short really aren't you'.

I said yes can I have your number so I have someone I can talk to about it. Got it. 

If a woman isn't interested in your sexually then no amount of platitudes is going to make a difference. ,The ppl in this sub r the opposite of locked in lmfao,What is this fixation on height, I never considered it until more recent years now its trending on social media. Its all bullshit, its true a girl will prefer a guy taller than them by an inch or few on average but that doesn't mean they have to be Shaq. Some girls prefer very tall but everyone has preferences, stop going down that rabbit hole. You will only hurt your confidence and it will show. Insecurity is going to be your enemy not your height. Seriously be confident in yourself its sad that so many blokes are tearing themselves down by this trend.,Y'all should really spend less time on the internet ,Mens’ bodies haven’t been widely used as a commodity to control and violate. 

I have no problem with anyone bringing to attention that we should not be body shaming men. 

I do have a problem with this being posed as another gender war piece of bullshit when it’s not. If you’re a man and want to stand up for men, you can do it without the “sEe hOw wOmEn hAVe iT bEtTeR, bRo?” ,Honestly i prefer it this way its an easy way to detect people i don't wish to associate with.,Short men you should look for women your height or shorter many women are very short and you can feel like a man next to your girl when she isn't taller than you. I am pretty short myself and i always date women who are my height or shorter. If you find someone who is taller than you there is no law stopping you from dating her if it feels right but i get how it might feel very weird. This height stuff has been taken too far it doesn't matter nesrly as much as they say it does on the internet. Take care of your health and exercise and you will look healthy and remember to respect women personality matters more in the end.,A carefully curated selection of dumb shit OP's said, along with my responses:

*Short Men don't even register as a potential partner unless they have money it's sad*

I've never had money, at least not enough to attract a woman on its own. One girl I dated met me when I was unemployed, we dated for 5 years after that. My height has yet to deter her or the dozen other women I've dated in my life, all but one of which were all taller than me... often by a lot.

*\*\*when a short man says something he is instantly attacked not for his opinion but his stature*

I can't recall any time in the last 15 years somebody's attacked my stature. In fact, I think the last time it was ever insulted was in middle school... Are you by chance in middle school?

*people absolutely treat short men worse than they would treat a tall career criminal*

I'm respected among my coworkers, praised among my friends, and celebrated by the woman I'm with. I'm dying to know how and when everybody is supposed to start treating my poorly...

Oh, and I'm 5'3.

Get off the internet and go touch some grass OP; it's difficult to even take this seriously without wondering if you're just trolling.,Body shaming women didn't magically become unacceptable, women did work to combat it on a large scale. It's still present but significantly less for a reason. 

There are men who may genuinely care but let's be real men aren't doing that same level of work on a large scale to combat it. People aren't going to magically stop doing anything until efforts are made to make it taboo to do it. ,This locked in man sounds like an incel.,Seeing a ton of posts lately about short guys. Have contempt for some women thinking less of you but dont let it live rent free in your head guys. Believe me, if you are tall they will find something else to complain about.,shaming is not always the intention even if it is often the  effect.,Basically you can make jokes at a man's expense be it physical or otherwise. This is largely because us men tolerate it from each other so woman believe its ok to join in- fair enough.,welcome! You are now awake and aware of the ongoing fraud,It’s largely due to an imbalance in perceived social power. People still act as if men are the predominant sex, thus making it socially acceptable to “punch up” at them and they perceive women as the less powerful sex making it “punching down” to look down on them for any miscellaneous reason. At least I believe that’s the subconscious reasoning behind it.

To some degree it also stems back to more traditional perceptions of masculinity and femininity. Namely, there’s the notion that men can take a hit - whether physical, mental, or emotional - whereas women are more fragile. Now to some degree this is true as men tend to lean towards stoicism more than women would, but that’s been used by generations of really fucked up people to justify treating men poorly and expecting them to just “suck it up” when in reality the stone cold expression that most men wear are largely performative and don’t reflect their inner psyche. Meanwhile women are usually more expressive and thus it’s more apparent when a comment upsets them.,Short men are treated worse than criminals? That's crazy bro. Not the short men I know. Sounds like you're just friends with shitty short dudes and you think people treat them bad because of their height,I feel this is definitely on the side of men feeling insecure, not once have I or anyone I know cared about the height of a guy,It is. Y'all frown about it all the time... 

This gives me straight pride parade vibes. 

Women had to do the work themselves to get society to stop body shaming them. (Edit to edit; to get society to body shame them a little bit less than they used to - because Lord knows male centric podcasts and their following LOVE to body shame women. 

Gay people had to make their own parade. 

But y'all heterosexual men want to sit there and have it all handed to you, no effort.,Double standards  are everywhere. ,As a tall guy, you have no idea how many times I heard from women that short guys are unattractive and that the would rather date a toxic tall guy than a nice short guy. I guess all we can do is to support other men who are shorter than we are,This is an incel sub, right?,I don’t find the woman on the lower left attractive,I definitely haven't _seen_ any women shaming short men for being short, only women preferring to _date_ taller guys. 

It's like how men generally _prefer to date_ women who are thin/fit. 

What became socially unacceptable was shaming fat/ugly women just going about their day not even bothering you. Basically, reminding people to mind their business and leave ugly people alone. 

I'll grant, I do not see everything that's ever said, but being short myself... 🤔,Body shaming still happens in both directions… it didn’t magically go away for women.,You know who are most critical of women's appearance? Women! I've heard so many women make unprovoked comments about another woman's shape, size, or dress-sense. ,https://preview.redd.it/uho6x7duk7og1.jpeg?width=640&format=pjpg&auto=webp&s=f252e86da70814617b4aa6792b21170d77d34e2e,As a taller man, I was relentlessly bullied all through grade school for being the weird looking tall lanky kid. Hated my height and wanted to be shorter for so long and only recently have I found acceptance in my body. All people can be shamed, and all people can accept themselves anyway.,Women had to spend many years fighting for that and still do. Maybe men should start to to fight for and support other men if this is such an issue. 

However, if you go outside and look around you, there are tons of short men happily in relationships and married. ,Idk where this impression came from. I love my 5’6” man,From observation of the internet.  I find it's men who put down other men for being short more so than women.   Women usually are more sympathetic towards them.   I haven't once heard a woman say she will not date a short man and only wants this supposed 6'3 investment banker.   ,No. Sane. Person. Wants. To date. A. Criminal 
Whats wrong with you? ,John Herbert from Family Guy would disagree with her.,The reason women that want tall men is because THEY are short and want to wear heels AND because of the misconception that taller=bigger dick. Either case, they are shallow and you shouldn't bother with them. Do yourself a favour and find a nice woman that makes you the best version of you.,These posts are so cringe. Why is every subreddit on self improvement always some funnel for this Intel stuff?,Canker sisters from Ed,  Edd and eddy?,Although this true, I think the biggest issue people have with it that men are finally starting to open up about stuff like this. We’ve been told to shut up, we’ve been told to open up and sequentially told to shut up again. One thing I always think about when seeing posts like this is, how would the inverse be received. If a similar post like this were created, this would not be an issue……🤔🤷🏿‍♂️,Women will discriminate a man’s height to see if it still effects him , some of the smallest guys can get the best women and look at Mike Tyson. ,Nobody body shames women harder than women.

You have to have literally never met a woman to think that body positivity is a thing outside of teen vogue.,All body shaming is frowned upon, people still do it. People still call bigger girls fat, people still call short guys short. It's not exclusive to just short guys and it definitely isn't less frowned upon.,Because they don't care,It doesn't happen that often outside the internet,If she won't bone u someone else will stop whining 😐,I'm 5'4 and my girlfriend is 6'3 and she compliments my body all the time. I have a very soft belly that she loves holding and jiggling while standing behind me with her head rested on top of mine. She calls me beautiful and handsome and good-looking several times a day. I can't grow a beard and she compliments me anyway and when I say I might want to get help with growing a beard she tells me how sexy I'll be either way. Recently we were watching a show, she joked about how obvious one character was being hitting on another but I hadn't picked up on it (autism) so I said, 'If that's flirting then I've been flirted with a lot lol' to which she replied, 'Yes, I keep telling you you're discounting yourself, you're a lot hotter than you realise.' 

Here in the Netherlands, I'm way below average height. Yet I've not been shamed for it since high school, and back then it was exclusively other guys mocking me, mostly my then friends. I was bullied for being ugly much of my childhood, again more by other boys than by girls. 

A therapist once told me that if we have trauma, if we've learned in our childhood that a certain painful belief is true, then we'll always notice things that seem to confirm that belief so much more than things that don't. Our mind focuses on the 'proof' of it and blurs the rest. ,No one likes a sense of vulnerability in men or requests for vilification , least of all  in a potential  partner. It’s not that sensitivity is wrong, it’s just that it’s only truly valued when it comes to recieving compassion. So, it’s not 100% about the weight. It is if that’s the only thing memorable about the guy. ,Its not just short men, women started body shaming, think about it as men we always have a positive name like bbw, the thigh gaps women have, slim thick, apple bottom, the song baby got back. Dont marginalize something about yourself that you think is a flaw loads of women like “short” guys, if you go to asia it becomes average hight.,I'm 35 and don't think I've ever been rejected or called out for being 5'8 (which ain't too short) In sixth form I dated a 5'11 girl for a bit 😅,Its not just short guys that get body shamed. If your a guy its ok to body shame you. The Double standard woman have is wild ,You can adjust for height/looks with proper status/income. Identify your level and adjust accordingly. 

Just look up Jason Oppenheim. Him and his brother are both 5’3 and have dated/slept with several tall beautiful women.,I asked my 5’6, 45 year old husband if he’s ever been treated poorly because of his height. Nope never. He said you young guys don’t know how to be good men and when people don’t like you, you assume it’s height but really it’s your shit personality. Also when I met him every woman I knew wanted him.,He's so happy I can just imagine his smile disappearing😭",,false
