post_id,subreddit,title,text,score,num_comments,created_utc,post_url,comments,image_urls,over_18
1f08r6m,ImTheMainCharacter,How Funny Is Blatant Sexual Harassment?,"How hilarious it is to ask a young lady to squirt in your drink. True comedians they are. The poor young lady is just doing her job. I hated the if you want, sure response in the beginning of the video. Dude you literally are recording her.",4774,569,2024-08-24 16:02:55,https://www.reddit.com/r/ImTheMainCharacter/comments/1f08r6m/how_funny_is_blatant_sexual_harassment/,[],[],False
10l3oqd,ThatsInsane,Female reporter harassed while reporting in INDlA,,5432,890,2023-01-25 17:07:57,https://www.reddit.com/r/ThatsInsane/comments/10l3oqd/female_reporter_harassed_while_reporting_in_indla/,[],[],False
1p2bc8p,BlatantMisogyny,Sexually harassing women in public.,Found this revolting video on Twitter of a man sexually harassing random women just trying to mind their own business. I’m so fucking tired of men thinking they can behave this way towards women and the fact he recorded this as well without their permission and as usual. Other men find this funny because ‘iT’s jUsT a jOkE”😐,1577,173,2025-11-20 18:44:38,https://www.reddit.com/r/BlatantMisogyny/comments/1p2bc8p/sexually_harassing_women_in_public/,[],[],False
ysm4c4,iamatotalpieceofshit,Youtuber committing sexual harassment,,4712,457,2022-11-11 20:29:45,https://www.reddit.com/r/iamatotalpieceofshit/comments/ysm4c4/youtuber_committing_sexual_harassment/,[],[],False
m5qb6c,PublicFreakout,Woman catches boss on video being sexually harassed,,18147,1525,2021-03-15 17:44:06,https://www.reddit.com/r/PublicFreakout/comments/m5qb6c/woman_catches_boss_on_video_being_sexually/,[],[],False
p850pm,iamatotalpieceofshit,Harassing prostitutes,,5541,340,2021-08-20 13:18:23,https://www.reddit.com/r/iamatotalpieceofshit/comments/p850pm/harassing_prostitutes/,[],[],False
p9856g,PublicFreakout,Another Video of crowd harassing and molesting a girl,,319,204,2021-08-22 07:21:57,https://www.reddit.com/r/PublicFreakout/comments/p9856g/another_video_of_crowd_harassing_and_molesting_a/,[],[],False
1p8ktyq,LolCowLive,KidBehindACamera sexually harassing a Host 😱😲😧,,9,25,2025-11-28 03:39:35,https://www.reddit.com/r/LolCowLive/comments/1p8ktyq/kidbehindacamera_sexually_harassing_a_host/,[],[],False
1poknni,CringeTikToks,"Drunk belligerent woman harasses staff and guests, gets kicked out and tripped hard",,31266,6355,2025-12-17 02:13:47,https://www.reddit.com/r/CringeTikToks/comments/1poknni/drunk_belligerent_woman_harasses_staff_and_guests/,[],[],False
1ravy4x,Fauxmoi,"30 years ago, Björk attacked a reporter in Bangkok who had been following her for several days and harassing her son.",,30730,771,2026-02-21 16:48:53,https://www.reddit.com/r/Fauxmoi/comments/1ravy4x/30_years_ago_björk_attacked_a_reporter_in_bangkok/,[],[],False
1rq8ijj,popculturechat,Boy George tells Chappell Roan to own her fame and “cheer up” after she filmed paparazzi harassing her in Paris,,14866,793,2026-03-10 20:31:29,https://www.reddit.com/r/popculturechat/comments/1rq8ijj/boy_george_tells_chappell_roan_to_own_her_fame/,[],[],False
1pfqcs0,TikTokCringe,Tourist in Italy harassing and spitting on locals,,21919,3722,2025-12-06 14:17:37,https://www.reddit.com/r/TikTokCringe/comments/1pfqcs0/tourist_in_italy_harassing_and_spitting_on_locals/,[],[],False
1q1i5ib,PublicFreakout,Man gets harassed for wearing make-up,,19520,1623,2026-01-01 23:11:21,https://www.reddit.com/r/PublicFreakout/comments/1q1i5ib/man_gets_harassed_for_wearing_makeup/,[],[],False
1otyr2i,LivestreamFail,Chinese security police harassed Hasan Piker while he was live streaming in Tiananmen Square,,23129,2744,2025-11-11 03:19:20,https://www.reddit.com/r/LivestreamFail/comments/1otyr2i/chinese_security_police_harassed_hasan_piker/,[],[],False
1pl53f1,minnesota,"Minnesota: ICE Cosplay patriot With AR Platform and High‑Powered Scope Harasses Citizen Filming, Gets Roasted",,17498,1572,2025-12-12 22:27:24,https://www.reddit.com/r/minnesota/comments/1pl53f1/minnesota_ice_cosplay_patriot_with_ar_platform/,[],[],False
1o7uheb,illinois,A streamer with traffic law savvy confronted and sent away federal agents harassing a Latino youth in Illinois.,,56924,2301,2025-10-16 02:23:56,https://www.reddit.com/r/illinois/comments/1o7uheb/a_streamer_with_traffic_law_savvy_confronted_and/,[],[],False
1of19ot,PublicFreakout,NYPD Cop is sick and tired of TEMU cops(ICE) racial profiling and harassing him.,,42916,2162,2025-10-24 15:46:42,https://www.reddit.com/r/PublicFreakout/comments/1of19ot/nypd_cop_is_sick_and_tired_of_temu_copsice_racial/,[],[],False
1rj83pg,AmIOverreacting,Am I overreacting: Scheduling harassing me on days off,"For context, I work in disability support. I love my job. I hate being called 6 times on my days off. I’m part time- relief. When I have a day off I feel stressed all morning because there’s a 60% chance I’m going to be called to cover a shift between the hours of 6.30am and 9am. When I tell them I can’t work the shift they guilt me, even suggesting that I cancels appointments to come to the shift. If I can’t work the shift they want me to do they ring my supervisor and she calls me to “discuss” why I can’t pick up the shift. It seems so disrespectful and honestly im so tired of it. Anyways, is this normal or am I overreacting? ",10787,594,2026-03-02 22:55:26,https://www.reddit.com/r/AmIOverreacting/comments/1rj83pg/am_i_overreacting_scheduling_harassing_me_on_days/,[],[],False
1o2xgt6,Weird,A young lady filmed herself being harassed by an old man on bus.,,24666,2647,2025-10-10 10:42:44,https://www.reddit.com/r/Weird/comments/1o2xgt6/a_young_lady_filmed_herself_being_harassed_by_an/,[],[],False
1n2nh6c,TikTokCringe,Bellevue Washington woman caught on camera harassing Asian driver after road rage incident.,,51821,3979,2025-08-28 20:34:42,https://www.reddit.com/r/TikTokCringe/comments/1n2nh6c/bellevue_washington_woman_caught_on_camera/,[],[],False
1rbdxfi,whenthe,digital circus creator harassed off platform after confirming main characters exist,,12726,545,2026-02-22 05:55:06,https://www.reddit.com/r/whenthe/comments/1rbdxfi/digital_circus_creator_harassed_off_platform/,[],[],False
1og4vdq,LivestreamFail,Emiru Shows the Consistent Harassment She Kept Facing from Mizkif After They Broke Up,,22437,1627,2025-10-25 22:44:03,https://www.reddit.com/r/LivestreamFail/comments/1og4vdq/emiru_shows_the_consistent_harassment_she_kept/,[],[],False
1nj8obm,Damnthatsinteresting,"A Chinese American wearing a sign saying he's Chinese, not Japanese, to avoid harassment at work, 1940s",,94238,1662,2025-09-17 09:44:33,https://www.reddit.com/r/Damnthatsinteresting/comments/1nj8obm/a_chinese_american_wearing_a_sign_saying_hes/,[],[],False
1rdswfh,therewasanattempt,To Antagonize And Harass Anti-Federal Protestors,,8663,575,2026-02-24 21:12:26,https://www.reddit.com/r/therewasanattempt/comments/1rdswfh/to_antagonize_and_harass_antifederal_protestors/,[],[],False
1qkxnhl,PublicFreakout,Man on the San Diego trolley stands up for himself after being harassed by a homophobic passenger,,9185,768,2026-01-23 17:49:43,https://www.reddit.com/r/PublicFreakout/comments/1qkxnhl/man_on_the_san_diego_trolley_stands_up_for/,[],[],False
1nxux93,mildlyinfuriating,Hookup turned into harassment,"Got to third base with someone while visiting a different state and stayed for 3 nights but after I left I noticed they stole money from me, so I went off on them and blocked them and they just keep *67 calling me and it’s getting annoying. It’s been almost a week now, they just need to move on. Be careful who you hang with, some people are crazy.",29802,1398,2025-10-04 14:06:57,https://www.reddit.com/r/mildlyinfuriating/comments/1nxux93/hookup_turned_into_harassment/,[],[],False
1qir58n,PublicFreakout,Tourists harassed by settlers while visiting holy sites,,6569,1136,2026-01-21 07:07:35,https://www.reddit.com/r/PublicFreakout/comments/1qir58n/tourists_harassed_by_settlers_while_visiting_holy/,[],[],False
1podkvd,AITAH,AITAH for getting the man who sexually harassed me fired right before Christmas?,"A little over two weeks ago, my family and I went away for Thanksgiving weekend. A few days after the holiday, I was walking my service dog; when one of the groundskeepers followed me up a hill, used his van to block my path, and began to ask me questions about my service animal. Mind you, we were essentially in the middle of the woods, with no one else around at this time of morning. I answered his question, and he then proceeded to try and distract my service animal. I asked, politely, for him to please stop trying to distract her, explained that she's working, and to please leave her alone.

He made it very clear that he was not going to do that; and then asked where I was staying. I told him that I would not be telling him that; he's a complete stranger. He then began to ask me a series of sexually inappropriate questions; and I repeatedly told him to LEAVE ME ALONE, as loud as I possibly could; while trying to figure out how to get away from him. The guy then told me that he was going to sit right there, and wait to see which house I went into; and did just that. I managed to finally speed walk around the back of his car, and get a couple hundred feet away (in the opposite direction of where I needed to go). For \~15 mins, we (my service dog and I) sat outside until someone else came outside; and were able to get inside the house.

Once I was able to calm down, I reported what happened; and was recently informed that he was let go. While speaking to a cousin, she asked if anything ever came of the report; and I told her. She then proceeded to go off on me; telling me how horrible I was for getting someone fired so close to Christmas; and that it wasn't like he actually touched me. I know in my heart that reporting him was the right thing to do; and I wasn't seeking his firing; but no one should be able to treat people the way I was treated But now I've got her stupid voice in the back my head, making me doubt my actions . AITA?

  
EDIT- Wanted to take a moment and say thank you to those who took the time out of their days to not only offer positive comments, but to share similar experiences, and offer great advice. Harassment can very often make the person feel quite isolated/singular; so I can't tell you how comforting it's been to receive so many comforting responses. To those with negative things to say, I sincerely hope you find some time to get off of Reddit, and learn to be kind to others. I wish everyone a peaceful and SAFE holiday season full of joy and love.

Also, thank you so very much to those who sent the awards💗

UPDATE- Wasn’t sure if this warranted an entirely new post, but here we go. In regard to the creep, I took the advice of so many of you, and filed a police report. With anything likely come of this? Probably not, but even the officer I spoke said it was good that I started a paper trail of sorts; she was very kind about the whole thing. 

About the god awful woman I’m related to, I took you all’s advice about that as well and am officially NC as of last night. Every year that’s a famous holiday market not far from here, and I take my younger cousin(her daughter) that is the same as my niece(other side of my family; the two girls are friends). Last night, she, instead of speaking to me, called my mother and our aunt saying that she no longer “felt right about letting her children be around someone like her.” Little did she know, I was sitting right next to them. I politely took the phone from my aunt, told her off, pointed out how she would never have had the balls to say that to my face, and to literally never speak to me again. ",9112,1116,2025-12-16 21:05:22,https://www.reddit.com/r/AITAH/comments/1podkvd/aitah_for_getting_the_man_who_sexually_harassed/,[],[],False
1om042j,popculturechat,Millie Bobby Brown allegedly filed a harassment and bullying claim before they started shooting the last season,,16031,1176,2025-11-01 21:51:11,https://www.reddit.com/r/popculturechat/comments/1om042j/millie_bobby_brown_allegedly_filed_a_harassment/,[],[],False
1lsbxhe,nextlevel,Group gets shamed for harassing two women kissing in a swimming pool,,48321,5889,2025-07-05 15:04:04,https://www.reddit.com/r/nextlevel/comments/1lsbxhe/group_gets_shamed_for_harassing_two_women_kissing/,[],[],False
1p674s2,LivestreamFail,Asmongold shows receipt of the amount of harassment he has received from Kaceytron for over 6 years after she accused him of harassing her.,,11565,1090,2025-11-25 08:21:46,https://www.reddit.com/r/LivestreamFail/comments/1p674s2/asmongold_shows_receipt_of_the_amount_of/,[],[],False
1ou0xgx,LivestreamFail,"Hasan Defends Chinese Security Police Harassing Him for a Meme on His Phone. ""America is Worse""",,9714,1584,2025-11-11 05:10:34,https://www.reddit.com/r/LivestreamFail/comments/1ou0xgx/hasan_defends_chinese_security_police_harassing/,[],[],False
1rr5obi,ImTheMainCharacter,"""sexual harassment = funny"" 🫩",,5281,637,2026-03-11 20:38:47,https://www.reddit.com/r/ImTheMainCharacter/comments/1rr5obi/sexual_harassment_funny/,[],[],False
1rkwba0,iamatotalpieceofshit,"""do you have any crack"" officer harasses woman for giving her son a coffee cup",,9893,404,2026-03-04 20:18:44,https://www.reddit.com/r/iamatotalpieceofshit/comments/1rkwba0/do_you_have_any_crack_officer_harasses_woman_for/,[],[],False
1rmy9h8,thenextgenbusiness,AOC Defends Vote Against Releasing Congressional S*xual Harassment Records in Reply to Nancy Mace,"

TLDR: Representative Alexandria Ocasio-Cortez responded to Rep. Nancy Mace’s accusation that she voted against releasing congressional s-xual harassment records by saying the resolution would have doxxed victim statements that contained identifying information. She explained that it only redacted names and nothing else, so House employee records could still match and reverse identify victims, and added she would vote yes if the messy loopholes were fixed while urging Mace to take her job seriously.

",10628,362,2026-03-07 02:48:17,https://www.reddit.com/r/thenextgenbusiness/comments/1rmy9h8/aoc_defends_vote_against_releasing_congressional/,[],[],False
1quu928,HonkaiStarRail,Cyrene's VA Harassed for Celebrating her GF's role as Yao Guang,,4120,1264,2026-02-03 15:03:04,https://www.reddit.com/r/HonkaiStarRail/comments/1quu928/cyrenes_va_harassed_for_celebrating_her_gfs_role/,[],[],False
1rmduxf,montreal,“Active Club” members harass Montreal Journalist Over Exposé,I thought I’d share this update today from Rachel Gilmore who did an exposé recently on “active clubs” training in Montreal area gyms.   It seems one of the guys in her exposé and a buddy decided to follow her to a music venue and approach her.   Very chilling thing to be happening right in our own city. ,4812,629,2026-03-06 13:23:12,https://www.reddit.com/r/montreal/comments/1rmduxf/active_club_members_harass_montreal_journalist/,[],[],False
1pc4v68,PublicFreakout,Lazy MAGA begging for $500 for rent proceeds to harass and assault a hard-working migrant selling flowers,,13234,674,2025-12-02 10:14:25,https://www.reddit.com/r/PublicFreakout/comments/1pc4v68/lazy_maga_begging_for_500_for_rent_proceeds_to/,[],[],False
1o84xuf,ukraine,Make this bastard famous for harassment on a Swiss train,Sauce to @united24.,15044,993,2025-10-16 12:34:32,https://www.reddit.com/r/ukraine/comments/1o84xuf/make_this_bastard_famous_for_harassment_on_a/,[],[],False
1n6ug0r,TikTokCringe,"Women in France wear ""subway shirts"" to avoid being sexually harassed on the underground",,12478,2330,2025-09-02 20:21:45,https://www.reddit.com/r/TikTokCringe/comments/1n6ug0r/women_in_france_wear_subway_shirts_to_avoid_being/,[],[],False
1ocfay7,chess,"It’s time to stop worrying about the backlash. Bullying, harassment, and slander should not be acceptable.",,11522,1157,2025-10-21 15:01:02,https://www.reddit.com/r/chess/comments/1ocfay7/its_time_to_stop_worrying_about_the_backlash/,[],[],False
1n4c6b3,TikTokCringe,California Karen harasses black women about their dresses calling them trashy.,,9605,4369,2025-08-30 20:48:13,https://www.reddit.com/r/TikTokCringe/comments/1n4c6b3/california_karen_harasses_black_women_about_their/,[],[],False
1prznla,LegalAdviceIndia,Harassed in my own appartment by society board members !!!,"

I’m 22F, live alone in the city, and I own an apartment in one of the most prestigious societies here. Yesterday, hence it was a Saturday night, 5 of my friends came over—4 guys and 1 girl. We weren’t shouting, partying, or playing loud music. We were just cooking food and talking normally.

One uncle knocked and said “bachelors are not allowed here, call the owner you’ve rented this flat from.” I told him I am the owner and that's your no goddamn business. I shut the door. That burst his ego there.

After a few minutes, 4–5 uncles came together, accused us of drinking, smoking weed and entered my living room without permission say we are checking. They told me to vacate the flat the next day. Thankfully, my male friends were present and pushed them out. One guy who tried to “check” my flat got slapped while trespassing.

They called the police. Police asked who owns the flat—I said I do. They asked me to show papers; I refused because we weren’t creating any nuisance and they had no right to enter my home. I live alone and my father had insisted on installing a living-room camera for safety—everything was recorded. We’re law students, so the police didn’t try to do anything arbitrary or shady.

The uncles kept saying “we are on the society board, we know all members.” I told them they clearly don’t even know who owns property in their own society. Also, I know exactly who the builder of this society is—and he happens to be a close friend of my father, so the intimidation tactics weren’t going to work.

Before leaving, they said “we’ll see you tomorrow.”
So today I sent a legal notice to the society, clearly stating that all the board members who were present and involved must be removed from their positions, failing which I’ll file a civil suit against the society itself under vicarious liability. And i don't give a shit if the society builder is my father's friend. Separately, I’ve sent individual legal notices to every person who entered my apartment for trespass, nuisense and assault. Tommorow i will file a civil suit on all of them.

In my case, I own the flat—but imagine how much worse this is for bachelors living in other cities on rent, who don’t have the resources, legal awareness, or power to fight back. This kind of moral policing and harassment is a serious problem.",8701,716,2025-12-21 06:20:03,https://www.reddit.com/r/LegalAdviceIndia/comments/1prznla/harassed_in_my_own_appartment_by_society_board/,[],[],False
1oe2ahv,NoFilterNews,Debate Crowd Gasps as Mamdani Tells Cuomo One of His Sexual Harassment Accusers Is in the Audience,,24124,657,2025-10-23 12:44:57,https://www.reddit.com/r/NoFilterNews/comments/1oe2ahv/debate_crowd_gasps_as_mamdani_tells_cuomo_one_of/,[],[],False
1mogwfi,politics,Trump’s Agents in D.C. Caught on Video Randomly Harassing People,,29022,1215,2025-08-12 18:34:05,https://www.reddit.com/r/politics/comments/1mogwfi/trumps_agents_in_dc_caught_on_video_randomly/,[],[],False
1lw999l,ChatGPT,"Grok sexually harassed the X CEO, deleted all its replies, then she quit",,25902,1633,2025-07-10 10:26:49,https://www.reddit.com/r/ChatGPT/comments/1lw999l/grok_sexually_harassed_the_x_ceo_deleted_all_its/,[],[],False
1omoryg,Ohio,Teens Dressed as ICE Agents Admit they chased and harassed people,,6886,1395,2025-11-02 18:25:21,https://www.reddit.com/r/Ohio/comments/1omoryg/teens_dressed_as_ice_agents_admit_they_chased_and/,[],[],False
1q9ddzc,instantkarma,"“Hilarious” TikToker Harassing a Royal Horse, U.K. 🇬🇧",Story: https://www.dailymail.co.uk/news/article-13379765/moment-armed-police-arrest-tiktoker-poking-his-microphone-under-nose-of-kings-guard-horse-and-its-rider-and-hed-previously-been-held-outside-downing-street-too.html,9505,469,2026-01-10 19:38:29,https://www.reddit.com/r/instantkarma/comments/1q9ddzc/hilarious_tiktoker_harassing_a_royal_horse_uk/,[],[],False
1nu28tw,PublicFreakout,Elderly woman harasses another lady and faces consequences,Location and context not available ,11933,1000,2025-09-30 03:08:14,https://www.reddit.com/r/PublicFreakout/comments/1nu28tw/elderly_woman_harasses_another_lady_and_faces/,[],[],False
1o36s5p,LivestreamFail,Asmon on Hasan Piker fans Harassing and being Toxic towards MoistCritical.,,5980,2580,2025-10-10 17:08:51,https://www.reddit.com/r/LivestreamFail/comments/1o36s5p/asmon_on_hasan_piker_fans_harassing_and_being/,[],[],False
