post_id,subreddit,title,text,score,num_comments,created_utc,post_url,comments,image_urls,over_18
1m9brc5,relationship_advice,"I (27M) discovered my wife's (30F) family was behind my vicious cyberbullying attack. My wife knew, but she hid it for years. How do I move past this?","My (27M) marriage is in a really bad spot after a deep breach of trust. Idk how to recover or how to trust my wife (30F) again.

For some context, we've been together 7 years and married 5. We have a child (2M). We met at a con. I thought her cosplay was amazing, struck up a conversation, and the rest is history. She's the most loving, unselfish, and decent person I've ever met.

Our relationship was never without its challenges. Our biggest obstacle was her family. My presence was unwelcome. They're very close-knit, and if one doesn't accept you, then you're not getting far.

There are a few family members who broke away from the pack, but no one hardly acknowledges them. They're no contact and black sheep.

I didn't know how my wife's family was, but I did know family was extremely important to her. Her whole upbringing was based on family. So I tried everything in my power to make it work. They didn't really put up with me until our son.

Between our wedding planning to shortly before the wedding, I was the target of some relentless and vicious cyberbullying. It got personal. Fake bad reviews polluted my business profile too. It cost me some potential clients.

I didn't know where it came from or why. I couldn't find a solution. I'd report, but it'd take a while for anything to be done, or there'd be more accounts coming out for another round. The whole thing impacted my life and my mental health. It took a toll.

My wife was incredibly supportive. She was my rock and my best friend. I loved her even more for her care and how she held me down. Then the trolling and everything stopped.

I wanted nothing more than to move on. I put it all behind me until the other day my wife confessed that her family was behind the harassment. I didn't believe her at first, but she was serious and showed me proof in their family group chat.

It felt like I was right back there again. They were gloating and justifying themselves. Saying stuff like Some people gotta learn the hard way and If he wants to join the fold, here's his initiation.

I knew I wasn't their favorite person, but I never realized they hated me and would go to such extremes. I asked my wife when did she find out and if she was a part of it. She swore she wasn't and that she'd never do that to me.

She claims she didn't initially know it was her family until a few months before our wedding. One of my SIL's (28F) left a profile up on her phone, and my wife saw it. She confronted her family and made them stop.

I asked why she was telling me everything now. She said it was weighing on her, and she opened up to her eldest sister (35F), one of the family's black sheep. She threatened to tell me the truth if my wife didn't.

Nothing my wife said made it better. She knew for years what her family did and hid it from me. She kept everything quiet. It hurts more coming from her because she knew firsthand my pain.

I was pretty numb. My wife was anxious and kept pushing for me to say something. I told her there wasn't anything she could say right now that would make it ok. What she did was no better than her family. They made my life hell, and her first instinct was to cover for them.

She started crying and begged me to understand. She said it wasn't like that, and she was trying to make things right with as little damage as possible and mend relationships.

I wasn't very receptive to her. She wasn't reaching me. I couldn't help her or myself. I told her I needed some time to clear my head. She was against it. She said we could work through this together, but I was firm on space.

Space isn't a request she's respected. I'm really trying to understand her side. I'm trying to move past it, but I feel so betrayed. I trusted her more than anyone. I'm my most vulnerable with her. I kept opening up to her about the incident even after she knew the truth.

She encouraged me to let it go and not allow it to have any claim on me. I thought she had my best interest in mind. Now I just see it as her attempt to protect her family yet again.

I haven't confronted anyone involved. I don't think they're worth it. But I've made it clear they're no longer allowed to see our son until further notice. Now I'm getting texts about how I'm depriving my child of grandparents and aunts over past family spats.

One of the hardest parts is the distance from my wife. She's my best friend and partner in every way. Now we're mostly only communicating about our son and other household necessities.

She's hurt by my rejection, and she's been crying often. Idk if I'm being unfair to her. I hate all of this. I want to make our marriage work, but I'm questioning our relationship up to now. I'm just really lost. I need an outside perspective.

How do I navigate this situation and move forward for my marriage and myself?

TL;DR My marriage is in a bad spot. Idk how to trust my wife again. I was the target of some relentless and vicious cyberbullying for months. It impacted my life and my mental health. I put it behind me until my wife confessed that her family was the culprit. She showed me proof in their group chat. I knew I wasn't their favorite person, but I never realized they hated me. My wife swears she didn't initially know and that she made them stop. But she still hid it for years. She begged me to understand and said that she was trying to make things right for us and our son. I asked for space to clear my head. She hasn't exactly respected that request. I'm really trying to move past it, but I feel so betrayed by her. Idk if I'm being unfair. I want to make our marriage work, but I'm questioning everything. How do I navigate this situation and move forward for my marriage and myself?",3065,1274,2025-07-25 21:40:23,https://www.reddit.com/r/relationship_advice/comments/1m9brc5/i_27m_discovered_my_wifes_30f_family_was_behind/,[],[],False
1erkcjv,Fauxmoi,J.K. Rowling and Elon Musk Named in Cyberbullying Lawsuit Filed by Algerian Boxer Imane Khelif After Olympic Win,,35186,809,2024-08-13 22:05:32,https://www.reddit.com/r/Fauxmoi/comments/1erkcjv/jk_rowling_and_elon_musk_named_in_cyberbullying/,[],[],False
1iecvk1,TheWeeknd,I'm ready to get cyberbullied,,5728,643,2025-01-31 11:40:43,https://www.reddit.com/r/TheWeeknd/comments/1iecvk1/im_ready_to_get_cyberbullied/,[],[],False
1fchn7f,olympics,"You Have Been Cruel To Me, My Family And My Mother': Controversial Olympic Boxer To Sue Elon Musk And Donald Trump For Cyberbullying",,14219,573,2024-09-09 04:58:37,https://www.reddit.com/r/olympics/comments/1fchn7f/you_have_been_cruel_to_me_my_family_and_my_mother/,[],[],False
1h214p3,whenthe,a new era of cyberbullying,,20460,379,2024-11-28 17:31:00,https://www.reddit.com/r/whenthe/comments/1h214p3/a_new_era_of_cyberbullying/,[],[],False
1gxuprw,politics,Elon Musk Is Now Cyberbullying Government Employees,,8900,522,2024-11-23 08:04:56,https://www.reddit.com/r/politics/comments/1gxuprw/elon_musk_is_now_cyberbullying_government/,[],[],False
1qm5f3o,television,‘The Traitors’ Urges Viewers Not To ‘Ruin’ The Show With ‘Personal Attacks’: ‘What Happens In The Game Should Never Lead To Cyberbullying Or Harassment’,,1697,295,2026-01-25 01:33:42,https://www.reddit.com/r/television/comments/1qm5f3o/the_traitors_urges_viewers_not_to_ruin_the_show/,[],[],False
1errj6n,TwoXChromosomes,J.K. Rowling and Elon Musk Named in Cyberbullying Lawsuit Filed by Algerian Boxer Imane Khelif After Olympic Win ,,10474,488,2024-08-14 03:31:42,https://www.reddit.com/r/TwoXChromosomes/comments/1errj6n/jk_rowling_and_elon_musk_named_in_cyberbullying/,[],[],False
1exp5fh,lgbt,'Are you ok babe?' JK Rowling hasn't posted a thing since getting named in cyberbullying lawsuit,,9172,514,2024-08-21 13:06:27,https://www.reddit.com/r/lgbt/comments/1exp5fh/are_you_ok_babe_jk_rowling_hasnt_posted_a_thing/,[],[],False
1erkzhn,lgbt,"J.K. Rowling, Elon Musk Named in Imane Khelif's Cyberbullying Lawsuit",,13371,390,2024-08-13 22:32:00,https://www.reddit.com/r/lgbt/comments/1erkzhn/jk_rowling_elon_musk_named_in_imane_khelifs/,[],[],False
1p1rr1f,PedroPeepos,"South Korean politician from the Democratic Party of Korea Jeon Yong-gi speaks out about the cyberbullying of T1 gal against Gumayusi and demanded that the Korea eSports Association (KeSPA), Riot Games Korea, and each club ""can no longer be bystanders"" and step forward and take responsible action","

EDIT:Before reading if you don't understand what T1 gal is here's a short paragraph on who they are and what they've been trying to do/done throughout the years.
EDIT2:Hopefully mods won't delete this post like they did in the league subreddit

T1 gal is basically a Korean equivalent of a t1 subreddit or a t1 board on 4chan.They call themselves t1 fans but are instead a crazy hate group.They've been harassing Gumayusi and his family for the last 2 years.From death threats, to planning to hurt him in real life with acid or trying to find him on the road to push him off of his bike so he wouldn't be able to play.Even a fan of Gumayusi was physically assaulted by one of the members in which they ended up filing a case against that person and they were sentence to 1 year in prison. They were the one who were sending trucks in front of the T1 office throughout the year.Now that Gumayusi is gone from T1,they will find a new target.Even Faker is not safe from them.Here's a thread on twitter that goes a bit more in depth on who they are and what they've done throughout the years https://x.com/tachycardial/status/1954100721327968280

Here's a MTL translation of the post on naver

On the 20th, Rep. Jeon Yong-gi released a statement on his social media titled, Stop the cyberbullying of Lee Min-hyung (Gumayusi) immediately. Rep.

Jeon cited the example of Gumayusi Lee Min-hyung, who is suffering from malicious slander even after winning the MVP of the 2025 League of Legends World Championship (Worlds) finals, and strongly criticized the excessive behavior of some communities, especially the T1 Support Gallery (hereafter referred to as T-Eung Gallery). Rep.

Jeon directly singled out specific communities in his statement. He said, I express deep regret for the behavior of some community users, such as the T1 Support Gallery, who have been cyberbullying him (Gumayusi) for a long time, and I urge them to stop immediately.

In particular, he fact-checked the personal attacks hidden behind the pretext of advice for the team or criticism of his performance. Rep. Jeon stated, Team cheering cannot be a justification for criticizing a specific player, and the argument that it is encouragement for a temporary decline in skill cannot be an excuse for malicious criticism.

Above all, he said, Considering that Gumayusi continues to criticize even now that he has decided to leave T1, I doubt whether his motive is pure cheering. He defined the activities of the community in question as not normal fandom activities, but no different from cyberbullying for entertainment and cyber wrecking for profit.

Rep. Jeon went beyond a simple warning and signaled strong intervention at the institutional level. He proposed three steps of action to protect players: ▲eSports-related organizations ▲platform operators ▲government and the National Assembly.

First, he demanded that the Korea eSports Association (KeSPA), Riot Games Korea, and each club can no longer be bystanders and step forward and take responsible action. He particularly emphasized the urgency of establishing protective measures for youth and young players.

He also stated that he would urge practical self-correcting measures for platform operators, such as DC Inside, which are hotbeds of malicious posts, and create a system to hold them accountable, if necessary. This implies that if platforms ignore malicious posts that spread to the level of crime, they are also complicit.

Rep. Jeon Yong-gi has been continuously fighting online bullying since taking office in 2020, leading the effort to abolish sports news comments and recently proposing a bill to prevent cyber bullying.

He asserted that the government and the National Assembly should strengthen criminal penalties for defamation and insults and increase civil damages, and expressed his intention to use this incident as an opportunity to spur legislative activities to promote self-correcting throughout the entire esports industry.

Finally, Rep. Jeon said, This cyberbullying issue goes beyond just Gumayusi; all esports players deserve protection, and appealed, I urge all stakeholders and fans to work together to end this absurd behavior and create a safe culture.


   
",2466,227,2025-11-20 02:41:52,https://www.reddit.com/r/PedroPeepos/comments/1p1rr1f/south_korean_politician_from_the_democratic_party/,[],[],False
dcsitt,worldnews,"Trump targets 16-year-old Greta Thunberg again on twitter, quotes tweet calling her “an actress”: A professor of Vermont Law School took Trump to task for ""cyberbullying a child,""",,39161,4740,2019-10-03 15:33:20,https://www.reddit.com/r/worldnews/comments/dcsitt/trump_targets_16yearold_greta_thunberg_again_on/,[],[],False
eajgqg,politics,Why is the president of the United States cyberbullying a 16-year-old girl?,,39029,3220,2019-12-14 13:02:12,https://www.reddit.com/r/politics/comments/eajgqg/why_is_the_president_of_the_united_states/,[],[],False
1r4es81,Brawlstars,Is this cyberbullying?,Thx random short before bed for the inspiration and my friend for helping,3275,83,2026-02-14 07:50:23,https://www.reddit.com/r/Brawlstars/comments/1r4es81/is_this_cyberbullying/,[],[],False
1eskncf,news,Algerian boxer Imane Khelif names J.K. Rowling and Elon Musk in cyberbullying suit,,5187,340,2024-08-15 03:01:06,https://www.reddit.com/r/news/comments/1eskncf/algerian_boxer_imane_khelif_names_jk_rowling_and/,[],[],False
1e5vmam,LinkedInLunatics,CEO of a California-based Cannabis Business Cyberbullying a Woman on LinkedIn,,4172,364,2024-07-17 22:39:25,https://www.reddit.com/r/LinkedInLunatics/comments/1e5vmam/ceo_of_a_californiabased_cannabis_business/,[],[],False
7zrcuc,politics,14-year-old Parkland survivor calls out Melania Trump for sitting by as Donald Trump Jr. cyberbullied her,,40249,2587,2018-02-23 20:50:08,https://www.reddit.com/r/politics/comments/7zrcuc/14yearold_parkland_survivor_calls_out_melania/,[],[],False
1omvnmp,wikipedia,"Lia Purcell Smith was an American student at Middlebury College who died by suicide on October 18, 2025, at the age of 21. Smith had been a member of the Middlebury Panthers women's swimming and diving team and was cyberbullied by the anti-trans website and X account ""HeCheated"".",,1481,221,2025-11-02 23:00:42,https://www.reddit.com/r/wikipedia/comments/1omvnmp/lia_purcell_smith_was_an_american_student_at/,[],[],False
1ljboph,vegan,SaveaFox youtuber commits suicide due to cyberbullying,Goes to show to not give a fuck when people online drag/bully you for caring about animal rights/being vegan,1741,289,2025-06-24 13:52:29,https://www.reddit.com/r/vegan/comments/1ljboph/saveafox_youtuber_commits_suicide_due_to/,[],[],False
dwjpdq,BrandNewSentence,Cyberbullied and entire studio,,69499,689,2019-11-15 01:53:21,https://www.reddit.com/r/BrandNewSentence/comments/dwjpdq/cyberbullied_and_entire_studio/,[],[],False
1m9bsyn,AmIOverreacting,"AIO after discovering my (27M) wife's (30F) family was behind my vicious cyberbullying attack and that my wife knew, but she hid it for years?","My (27M) marriage is in a really bad spot after a deep breach of trust. Idk how to recover or how to trust my wife (30F) again.

For some context, we've been together 7 years and married 5. We have a child (2M). We met at a con. I thought her cosplay was amazing, struck up a conversation, and the rest is history. She's the most loving, unselfish, and decent person I've ever met.

Our relationship was never without its challenges. Our biggest obstacle was her family. My presence was unwelcome. They're very close-knit, and if one doesn't accept you, then you're not getting far.

There are a few family members who broke away from the pack, but no one hardly acknowledges them. They're no contact and black sheep.

I didn't know how my wife's family was, but I did know family was extremely important to her. Her whole upbringing was based on family. So I tried everything in my power to make it work. They didn't really put up with me until our son.

Between our wedding planning to shortly before the wedding, I was the target of some relentless and vicious cyberbullying. It got personal. Fake bad reviews polluted my business profile too. It cost me some potential clients.

I didn't know where it came from or why. I couldn't find a solution. I'd report, but it'd take a while for anything to be done, or there'd be more accounts coming out for another round. The whole thing impacted my life and my mental health. It took a toll.

My wife was incredibly supportive. She was my rock and my best friend. I loved her even more for her care and how she held me down. Then the trolling and everything stopped.

I wanted nothing more than to move on. I put it all behind me until the other day my wife confessed that her family was behind the harassment. I didn't believe her at first, but she was serious and showed me proof in their family group chat.

It felt like I was right back there again. They were gloating and justifying themselves. Saying stuff like Some people gotta learn the hard way and If he wants to join the fold, here's his initiation.

I knew I wasn't their favorite person, but I never realized they hated me and would go to such extremes. I asked my wife when did she find out and if she was a part of it. She swore she wasn't and that she'd never do that to me.

She claims she didn't initially know it was her family until a few months before our wedding. One of my SIL's (28F) left a profile up on her phone, and my wife saw it. She confronted her family and made them stop.

I asked why she was telling me everything now. She said it was weighing on her, and she opened up to her eldest sister (35F), one of the family's black sheep. She threatened to tell me the truth if my wife didn't.

Nothing my wife said made it better. She knew for years what her family did and hid it from me. She kept everything quiet. It hurts more coming from her because she knew firsthand my pain.

I was pretty numb. My wife was anxious and kept pushing for me to say something. I told her there wasn't anything she could say right now that would make it ok. What she did was no better than her family. They made my life hell, and her first instinct was to cover for them.

She started crying and begged me to understand. She said it wasn't like that, and she was trying to make things right with as little damage as possible and mend relationships.

I wasn't very receptive to her. She wasn't reaching me. I couldn't help her or myself. I told her I needed some time to clear my head. She was against it. She said we could work through this together, but I was firm on space.

Space isn't a request she's respected. I'm really trying to understand her side. I'm trying to move past it, but I feel so betrayed. I trusted her more than anyone. I'm my most vulnerable with her. I kept opening up to her about the incident even after she knew the truth.

She encouraged me to let it go and not allow it to have any claim on me. I thought she had my best interest in mind. Now I just see it as her attempt to protect her family yet again.

I haven't confronted anyone involved. I don't think they're worth it. But I've made it clear they're no longer allowed to see our son until further notice. Now I'm getting texts about how I'm depriving my child of grandparents and aunts over past family spats.

One of the hardest parts is the distance from my wife. She's my best friend and partner in every way. Now we're mostly only communicating about our son and other household necessities.

She's hurt by my rejection, and she's been crying often. Idk if I'm being unfair to her. I hate all of this. I want to make our marriage work, but I'm questioning our relationship up to now. I'm just really lost. I need an outside perspective.

Idk how to navigate this situation and move forward for my marriage and myself. AIO?",1052,470,2025-07-25 21:42:13,https://www.reddit.com/r/AmIOverreacting/comments/1m9bsyn/aio_after_discovering_my_27m_wifes_30f_family_was/,[],[],False
gqwr5h,SquaredCircle,"CNN: Japanese government officials are calling for action against cyberbullying, amid a national outpouring of grief after the death of professional wrestler and reality television star Hana Kimura.",,11803,1018,2020-05-26 13:09:58,https://www.reddit.com/r/SquaredCircle/comments/gqwr5h/cnn_japanese_government_officials_are_calling_for/,[],[],False
lov5y2,PewdiepieSubmissions,"YT has removed this video from my channel due to harassment, threat and cyberbullying",,44569,440,2021-02-21 11:22:28,https://www.reddit.com/r/PewdiepieSubmissions/comments/lov5y2/yt_has_removed_this_video_from_my_channel_due_to/,[],[],False
1jfpfdw,popculturechat,"Courtney Stodden Says She Considered Suicide Because of Cyberbullying by Chrissy Teigen, Other Celebs",,1641,371,2025-03-20 13:53:55,https://www.reddit.com/r/popculturechat/comments/1jfpfdw/courtney_stodden_says_she_considered_suicide/,[],[],False
