post_id,subreddit,title,text,score,num_comments,created_utc,post_url,comments,image_urls,over_18
1malrad,thanksimcured,this feels so incredibly insensitive :(,"i haven't been cyberbullied before but my heart goes out to anyone who has 😞

here is the original video : https://youtube.com/shorts/SkwI9TIUVqA?si=KLeLu3RDgSS8W9Aq",5640,787,2025-07-27 13:03:21,https://www.reddit.com/r/thanksimcured/comments/1malrad/this_feels_so_incredibly_insensitive/,[],[],False
198n0kx,unpopularopinion,Cyberbullying isn't a joke- schools just have an out of touch way of describing what it truly is.,"First of all- I'm not using that word because it does sound very corny   


Online harassment usually isn't as simple as log off or just block them - there are many examples of harassment over the internet that while you might be aware of- most people don't consider when this topic comes up. A lot of these are hard for especially women.   


Posting about a person or sending private information about a person online is a problem itself but what a lot of people fail to remember is that this follows you into your personal life especially in a school environment. Yeah you can log off or ignore messages but now it's just happening behind your back until it follows you into your real life.   


Posting nudes, private messages, speaking about somebodies trauma- the internet in general has made people less empathetic and respectful because behind a screen there are less consequences for the person doing the harassment.   


For many women, when a guy messages them in creepy ways or sends unsolicited photos it is very easy for them to create alternate accounts to continue pursuing them, message their family or friends or even just escalate the situation toward in person harassment since they no longer are able to message them.   


Yet all school systems seem to teach this basic understanding of very miniscule situations such as someone insulting you in a groupchat, giving the advice to just block them and take it to a counselor but counselor's themselves usually will do nothing about it. It created a narrative that online harassment doesn't have any real effect on it's victims and that they are weak for simply not walking away from the situation when in reality most of them try too.",149,61,2024-01-17 03:43:23,https://www.reddit.com/r/unpopularopinion/comments/198n0kx/cyberbullying_isnt_a_joke_schools_just_have_an/,[],[],False
1am5m4y,ControversialOpinions,cyber bullying should be taken more seriously,"“just block them!” “just turn off your phone!”

how about not be a fucking bitch to random people? people are soo quick to judge and be asshats online while hiding being their greasy ass phone screen while typing with their fat ass fingers.

edit: i’m being very vulgar here but let me explain further. i was bullied the entirety of elementary school, middle school, and now in high school people still try to bully me. in elementary school i was always added to group chats where people talked shit about me and after leaving and blocking everyone in just continued at school. in middle school, people took pictures of me and posted them online talking about how ugly i was. people message me everywhere calling me ugly and just shitting on me in general. so no, i can’t just block people and things will be okay. i have been told to kill myself and to slit my wrists on multiple different occasions… so yes cyber bullying is real, yes it can hurt people, and no blocking doesn’t work because it still hurts knowing that people will hate on you for absolutely no reason. ",31,82,2024-02-08 20:38:40,https://www.reddit.com/r/ControversialOpinions/comments/1am5m4y/cyber_bullying_should_be_taken_more_seriously/,[],[],False
1lirhew,videos,An autistic woman who dedicated her life to rescuing animals just ended her life due to cyberbullying. She was 31.,,45330,3799,2025-06-23 20:28:28,https://www.reddit.com/r/videos/comments/1lirhew/an_autistic_woman_who_dedicated_her_life_to/,[],[],False
1rgjzo3,SquaredCircle,"Bully Ray on X: ""As a not so gentle reminder… My friend Hana took her own life because of cyberbullying and hateful comments on this app. This is me doing my part…urging the toxic portion of the IWC to think twice. Yours, may be the last post someone reads. 🌸""",,3930,413,2026-02-27 21:47:41,https://www.reddit.com/r/SquaredCircle/comments/1rgjzo3/bully_ray_on_x_as_a_not_so_gentle_reminder_my/,[],[],False
1q4i6sn,news,A Paris court finds 10 people guilty of cyberbullying France’s first lady Brigitte Macron,,10294,297,2026-01-05 10:25:38,https://www.reddit.com/r/news/comments/1q4i6sn/a_paris_court_finds_10_people_guilty_of/,[],[],False
1juv3f6,Gamingcirclejerk,Elon Musk Rage Quits Livestream After Being Cyberbullied by Gamers,,30090,760,2025-04-09 02:17:28,https://www.reddit.com/r/Gamingcirclejerk/comments/1juv3f6/elon_musk_rage_quits_livestream_after_being/,[],[],False
1lj24aq,WhitePeopleTwitter,This is how I found out that  Mikayla from Saveafox Corporation. was cyberbullied into suicide,[https://x.com/FoxenCoffee/status/1937241923896430911](https://x.com/FoxenCoffee/status/1937241923896430911),13172,571,2025-06-24 04:41:33,https://www.reddit.com/r/WhitePeopleTwitter/comments/1lj24aq/this_is_how_i_found_out_that_mikayla_from/,[],[],False
1mkl8nb,BestofRedditorUpdates,"I (27M) discovered my wife's (30F) family was behind my vicious cyberbullying attack. My wife knew, but she hid it for years. How do I move past this?","**I am NOT OOP, OOP is** u/ThrowRADraftCassette

**Originally posted to r/relationship_advice**

**I (27M) discovered my wife's (30F) family was behind my vicious cyberbullying attack. My wife knew, but she hid it for years. How do I move past this?**

**Thanks to u/queenlegolas for suggesting this BoRU**

**Trigger Warnings:** >!sabotage, mental health struggles, emotional abuse and manipulation, possible controlling behavior, isolating behavior!<
 
----

[Original Post](https://www.reddit.com/r/relationship_advice/s/simt6iz0Ev): **July 25, 2025**

My (27M) marriage is in a really bad spot after a deep breach of trust. Idk how to recover or how to trust my wife (30F) again.

For some context, we've been together 7 years and married 5. We have a child (2M). We met at a con. I thought her cosplay was amazing, struck up a conversation, and the rest is history. She's the most loving, unselfish, and decent person I've ever met.

Our relationship was never without its challenges. Our biggest obstacle was her family. My presence was unwelcome. They're very close-knit, and if one doesn't accept you, then you're not getting far.

There are a few family members who broke away from the pack, but no one hardly acknowledges them. They're no contact and black sheep.

I didn't know how my wife's family was, but I did know family was extremely important to her. Her whole upbringing was based on family. So I tried everything in my power to make it work. They didn't really put up with me until our son.

Between our wedding planning to shortly before the wedding, I was the target of some relentless and vicious cyberbullying. It got personal. Fake bad reviews polluted my business profile too. It cost me some potential clients.

I didn't know where it came from or why. I couldn't find a solution. I'd report, but it'd take a while for anything to be done, or there'd be more accounts coming out for another round. The whole thing impacted my life and my mental health. It took a toll.

My wife was incredibly supportive. She was my rock and my best friend. I loved her even more for her care and how she held me down. Then the trolling and everything stopped.

I wanted nothing more than to move on. I put it all behind me until the other day my wife confessed that her family was behind the harassment. I didn't believe her at first, but she was serious and showed me proof in their family group chat.

It felt like I was right back there again. They were gloating and justifying themselves. Saying stuff like Some people gotta learn the hard way and If he wants to join the fold, here's his initiation.

I knew I wasn't their favorite person, but I never realized they hated me and would go to such extremes. I asked my wife when did she find out and if she was a part of it. She swore she wasn't and that she'd never do that to me.

She claims she didn't initially know it was her family until a few months before our wedding. One of my SIL's (28F) left a profile up on her phone, and my wife saw it. She confronted her family and made them stop.

I asked why she was telling me everything now. She said it was weighing on her, and she opened up to her eldest sister (35F), one of the family's black sheep. She threatened to tell me the truth if my wife didn't.

Nothing my wife said made it better. She knew for years what her family did and hid it from me. She kept everything quiet. It hurts more coming from her because she knew firsthand my pain.

I was pretty numb. My wife was anxious and kept pushing for me to say something. I told her there wasn't anything she could say right now that would make it ok. What she did was no better than her family. They made my life hell, and her first instinct was to cover for them.

She started crying and begged me to understand. She said it wasn't like that, and she was trying to make things right with as little damage as possible and mend relationships.

I wasn't very receptive to her. She wasn't reaching me. I couldn't help her or myself. I told her I needed some time to clear my head. She was against it. She said we could work through this together, but I was firm on space.

Space isn't a request she's respected. I'm really trying to understand her side. I'm trying to move past it, but I feel so betrayed. I trusted her more than anyone. I'm my most vulnerable with her. I kept opening up to her about the incident even after she knew the truth.

She encouraged me to let it go and not allow it to have any claim on me. I thought she had my best interest in mind. Now I just see it as her attempt to protect her family yet again.

I haven't confronted anyone involved. I don't think they're worth it. But I've made it clear they're no longer allowed to see our son until further notice. Now I'm getting texts about how I'm depriving my child of grandparents and aunts over past family spats.

One of the hardest parts is the distance from my wife. She's my best friend and partner in every way. Now we're mostly only communicating about our son and other household necessities.

She's hurt by my rejection, and she's been crying often. Idk if I'm being unfair to her. I hate all of this. I want to make our marriage work, but I'm questioning our relationship up to now. I'm just really lost. I need an outside perspective.

How do I navigate this situation and move forward for my marriage and myself?

TL;DR My marriage is in a bad spot. Idk how to trust my wife again. I was the target of some relentless and vicious cyberbullying for months. It impacted my life and my mental health. I put it behind me until my wife confessed that her family was the culprit. She showed me proof in their group chat. I knew I wasn't their favorite person, but I never realized they hated me. My wife swears she didn't initially know and that she made them stop. But she still hid it for years. She begged me to understand and said that she was trying to make things right for us and our son. I asked for space to clear my head. She hasn't exactly respected that request. I'm really trying to move past it, but I feel so betrayed by her. Idk if I'm being unfair. I want to make our marriage work, but I'm questioning everything. How do I navigate this situation and move forward for my marriage and myself?

**Relevant Comments** 

**Commenter 1:** I think what is bothering me most is that your wife is still not getting it. She doesn't understand how vile her family is, and if they did it once, they could do it again. They took your money, your peace of mind, your confidence. Even though she stopped it, she never told you, leaving you to wonder why and who.

And past family spats? It's not like this was a little tiff and they apologized and you won't let it go.

I'd suggest therapy for you both, and I don't even know. At the very least, you'll learn how to co-parent together if you can't save the marriage. Maybe a therapist can get her to see how huge this is.

> **OOP:** Idk it's like my wife's not getting where I'm coming from or just doesn't want to go there. Her family never even apologized. They're making it out like I'm holding grudges

**Commenter 2:** So her idea of making things right is to lie to you for years, providing cover for the awful, awful people who did this to you?

Any decent partner would cut that family off without a backward glance.

I am so sorry, OP, you must be reeling.

> **OOP:** She said she thought she was protecting me and that she handled the situation with her family. I just don't see anything she did as for my benefit. I see it more as she was protecting her family yet again before anything else

**Commenter 3:** It sounds like she got them to stop as soon as she found out. You wouldn’t be wrong to end things over this but at the same time, I think she was maybe in a hard place as well because she knew that as soon as you found out, she probably couldn’t be close with her family anymore, even if they are pretty terrible. Why do they hate you so much?

> **OOP:** Well, one of my wife's siblings said they thought she was settling for me because of age and that she could do better. It felt like once their mind was made up about me there was nothing I could do

**Commenter 4:** I couldn’t imagine trying to rebuild after that level of betrayal. Has anyone tried to make amends? Take ownership of their actions? She can make excuses all she wants, but it doesn’t sound like she’s taking accountability. I don’t know if I would even be open to continuing. I’d be having a heart to heart with my lawyer to see what custody arrangements would look like.

> **OOP:** There's been no apology of any kind or acknowledging what they did. They're making it out like I'm depriving them from my son over a minor dispute
>> 
>> **Commenter 5:** Also realise she didn’t tell you because she wanted to. She only told you because someone else threatened to tell you and she wanted to control exactly what was said. If I were you I’d want to speak to the other person who knew, ie the black sheep.
>> 
>> It’s such a huge breach of trust. She aided her relatives in trying to destroy your livelihood and self worth. I can’t see any reason why you’d want to remain married to someone who clearly doesn’t value you or really love you (and has demonstrated she loves and places her family above you).
>>> 
>>> **OOP:** I do think I want to talk with the eldest sister too. The reason why I would consider staying is because things weren't always like this between my wife and I. She's not consumed with her family when boundaries are in place. We were better and didn't have secrets from each other. We built a life together

**Is OOP's wife the people pleaser?** 

> **OOP:** My wife does tend to play caretaker and fixer to everything and everyone in her family. All boundaries go out the window

**Commenter 5:** You need therapy. Individual and couples. Part of why she did what she did is because of familial influence, and she needs to learn how to cut those apron strings. Therapy can help.

> **OOP:** I'm open to therapy. Something needs to change. I just wish she wouldn't continue to chose her family at every wrong turn

&nbsp;

[Update](https://www.reddit.com/r/relationship_advice/s/EKIb8AxIvW): **August 1, 2025 (one week later)**

Update: I (27M) discovered my wife's (30F) family was behind my vicious cyberbullying attack. My wife knew, but she hid it for years. How do I move past this?

Original post: https://www.reddit.com/r/relationship_advice/s/P4f2MpEjIq

Thank you to everyone who reached out. I (27M) wasn't able to reply to everyone, but it was appreciated. It solidified my wake-up call and helped me see I wasn't overthinking. I wanted to give an update.

Earlier this week, my wife (30F) and I were able to regroup and hash stuff out. I was glad I took the space I did because even though this situation is still hurtful and feels like a massive betrayal, I was in a better position to talk.

My wife thought I was calling it quits, but I told her we were at a crossroads and needed to talk things out. She apologized for what her family did and her role in it. She said she never intended to hurt me. She had convinced herself she was protecting me from more pain. She realizes now she was largely protecting herself.

She admitted she was afraid of telling me the truth because she thought it wouldn't just end the wedding but that I'd end the relationship. She lost other relationships and friendships over her family. She didn't want to lose me too.

Over the years, she wanted to tell me but kept talking herself out of it, and then the cover-up kept getting bigger, and she didn't know how to confess. I told her I didn't agree with her choices, and I wished she had more trust in me and our relationship. I meant it too. I wouldn't have just ditched her.

She asked where do we go from here and promised no matter the outcome, there wouldn't be any more secrets between us. I told her I wanted to work on our marriage, but things needed to change. We couldn't survive with her family looming, and I didn't want our son exposed to them.

She asked what I needed of her. I was never big on ultimatums, and I don't really consider this as one, but I was adamant that any path of us moving forward together would mean radical boundaries with her family.

She was honest that the thought of making this big of a move against her family was scary but said if it's between them and us/our son (2M), then she chooses us.

Her agreement was major for me because I really didn't know where she'd land if she had to choose. I never wanted to put her in that position, but after everything her family did, I feel there was no other way.

The reason I have hope that my wife is being for real is because she sent a text to their group chat stating to stop blowing up my phone and that the no access to our son until further notice is a joint decision she fully supports. I didn't expect that of her. She did it on her own.

Of course, they didn't like it. Now she's labeled as disrespectful and ungrateful, and how the black sheep eldest sister (35F) and I are poisoning her against them. It was also said, What kind of man takes a woman away from her family over a spat?

This isn't a spat, nor do I have anything to prove about manhood. They led a whole campaign designed to ruin my life. Their actions are chilling to me. These are the same people who looked me in the eye with a straight face while everything was going on. This is about protecting my family.

My wife has gone low contact. Her family has this mindset that significant others or friends come and go, and it's family who is the constant and where loyalty should be.

They can't seem to compute that my wife, our son, and I are the core family. They're extended family, and they don't have a claim over our son. Being involved with him is a privilege, not a right.

Idk what their exact issue is with me. They only really tolerated me because of our son. When I first met them, one of my wife's siblings (28F) said they thought my wife was settling for me because of age and that she could do better.

They're a very tight-knit group, and if one doesn't take to you, then you're not getting far with the rest. It felt like once their minds were made up, there was nothing I could do. I've long since stopped trying to make sense of any of their reasonings. It's a rabbit hole.

Our plan is to move to a new area to create a healthier distance, cement boundaries, and have a fresh start. I brought up therapy too. It's something we've been discussing. We'll be officially starting that soon.

I think moving away will be beneficial for us. It's something my eldest SIL had advised us on. During the wedding planning, she was encouraging my wife to move and create our own space away from their family's isolating circle.

I know my wife is more than just her family. I've seen it firsthand. She shines so bright when away from their influence. That's what I meant when I said she was the most loving, unselfish, and decent person I've ever met.

If I'm being honest, idk how things will turn out. I'm still hurt, I still feel betrayed, and my wife's facing her own challenges with low contact, but I want to be hopeful. I don't want to close the door. I'm hoping we can heal together.

Thank you again to everyone for the support. I found not everything is as isolating as with the majority of my in-laws. It means more than you know.

**TL;DR Update** to: My marriage is in a bad spot. Idk how to trust my wife again. I was the target of some relentless and vicious cyberbullying for months. It impacted my life and my mental health. I put it behind me until my wife confessed that her family was the culprit. She showed me proof in their group chat. I knew I wasn't their favorite person, but I never realized they hated me. My wife swears she didn't initially know and that she made them stop. But she still hid it for years. She begged me to understand and said that she was trying to make things right for us and our son. I asked for space to clear my head. She hasn't exactly respected that request. I'm really trying to move past it, but I feel so betrayed by her. Idk if I'm being unfair. I want to make our marriage work, but I'm questioning everything. How do I navigate this situation and move forward for my marriage and myself?

**Relevant Comments**

**Commenter 1:** Dude I wish you all the best. I hope your wife can keep the no/low contact

> **OOP:** Thank you. It's much appreciated. I'm really hoping this can be a turning point

**Commenter 2:** I was really relieved to hear that you were moving because this is going to be a very difficult boundary for her to maintain. Hopefully with therapy, time, and physical and emotional space though she can construct a fortress of a wall around your family. I really hope she doesn't let you down again.

> **OOP:** It's my hope that the distance will give her some clarity and help us as a family

**Commenter 3:** I didn't actually realize how much I was still thinking about the post a week ago until I saw an update and felt relief.

best of luck in therapy, one thought I might add is that the instinct might be to do couples therapy but you might also find success in family systems therapy. just know that if a therapist doesn't feel like they're helping that doesn't mean that therapy won't work, just that this therapist didn't work.

glad you both found the strength to work together and that she found the strength to distance herself from toxic family.

> **OOP:** Thank you for the recommendation and the support. I'll research family systems therapy

**Commenter 4:** Your wife… what kind of wife betrays, puts down, belittles, and lies to her “partner”? She did nothing to protect you and only herself. I could never trust her again. If she’ll allow that to happen to you, imagine the awfulness your child will experience?

> **OOP:** I don't condone my wife's actions and I'm not deluding myself that any of this will be easy. I'm willing to give our marriage an honest try. Broken trust doesn't mean it can never be regained. We aren't the first couple in history going through a trust crisis
> 
> I made a commitment. Marriage requires making a vow for better or for worse. I'm not saying that covers everything under the sun. Of course there are situations where a parting of ways is needed. But not every case is the same. I made vows to give my marriage an honest try in the bad times

&nbsp;
 
**DO NOT COMMENT IN LINKED POSTS OR MESSAGE OOPs – BoRU Rule #7**

**THIS IS A REPOST SUB - I AM NOT OOP**",5683,721,2025-08-08 04:02:08,https://www.reddit.com/r/BestofRedditorUpdates/comments/1mkl8nb/i_27m_discovered_my_wifes_30f_family_was_behind/,[],[],False
1ieivb7,LivestreamFail,Jokerd gets DMCA'ed by PirateSoftware for Harassment and Cyberbullying,,10327,1191,2025-01-31 16:36:12,https://www.reddit.com/r/LivestreamFail/comments/1ieivb7/jokerd_gets_dmcaed_by_piratesoftware_for/,[],[],False
