post_id,subreddit,title,text,score,num_comments,created_utc,post_url,comments,image_urls,over_18
c37jun,Gamingcirclejerk,TFW you cyberbully a 10 year old for not praising an actor so badly that you force him to publicly apologize in an attempt to end his harassment.,,13125,819,2019-06-21 07:22:17,https://www.reddit.com/r/Gamingcirclejerk/comments/c37jun/tfw_you_cyberbully_a_10_year_old_for_not_praising/,[],[],False
1bpudqw,lastimages,"The final images of Canadian teenager Amanda Michelle Todd (aged 15) , taken 2 days before she committed suicide due to excessive cyberbullying.","Amanda Todd lived in British Columbia,Canada and was bullied repeatedly online and in school. Her tormentor Aydin Coban was sentenced to 12 years in prison in October 2022 (10 years exactly after Amanda’s death) for his involvement in the cyberbullying and sextortion that caused her death on October 10,2012.",4106,276,2024-03-28 12:28:35,https://www.reddit.com/r/lastimages/comments/1bpudqw/the_final_images_of_canadian_teenager_amanda/,[],[],False
1rq03ud,Slovenia,Redditorji ste si s cyberbullying-om mladega slovenca (34ur brez toplega obroka) prislužili učno uro spletnega bontona na RTV.,,497,257,2026-03-10 15:32:02,https://www.reddit.com/r/Slovenia/comments/1rq03ud/redditorji_ste_si_s_cyberbullyingom_mladega/,[],[],False
mwdc1u,news,'Permanently damaged': 46-year-old San Francisco woman allegedly cyberbullied three boys for years,,7056,606,2021-04-22 20:00:06,https://www.reddit.com/r/news/comments/mwdc1u/permanently_damaged_46yearold_san_francisco_woman/,[],[],False
1jyjpn0,coaxedintoasnafu,That one tweet about cyberbullying,,2797,152,2025-04-13 22:22:11,https://www.reddit.com/r/coaxedintoasnafu/comments/1jyjpn0/that_one_tweet_about_cyberbullying/,[],[],False
1rtwp5o,rareinsults,Instagram is the Da Vinci of cyberbullying,,4413,27,2026-03-14 22:18:04,https://www.reddit.com/r/rareinsults/comments/1rtwp5o/instagram_is_the_da_vinci_of_cyberbullying/,[],[],False
f39ll7,DesignPorn,This ad against cyberbullying,,23574,436,2020-02-13 12:58:28,https://www.reddit.com/r/DesignPorn/comments/f39ll7/this_ad_against_cyberbullying/,[],[],False
w2a4d1,entertainment,"Anti-Amber Heard Twitter Campaign One Of ‘Worst Cases Of Cyberbullying,’ Report Says",,2254,2235,2022-07-18 21:01:02,https://www.reddit.com/r/entertainment/comments/w2a4d1/antiamber_heard_twitter_campaign_one_of_worst/,[],[],False
99xo8v,politics,Trump Is Now Cyberbullying His Attorney General Because He's Afraid of In-Person Confrontation,,10488,733,2018-08-24 14:03:59,https://www.reddit.com/r/politics/comments/99xo8v/trump_is_now_cyberbullying_his_attorney_general/,[],[],False
kmbe0w,AmItheAsshole,"AITA for telling my cousin she wasn't being ""cyberbullied"" after calling out ""racist cosplay?","I have a younger cousin, she's 20. For reference we are both Chinese-Americans who grew up in the US.

Her parents had bad English, so they relied on her to translate a lot as a kid. This gave her a huge ego growing up since she had so much control over her parents, and IMO turned her super arrogant.

She had no friends growing up because she was so unlikable and controlling. We tolerated her at family gatherings, but she was a brat and would cry and scream if we didn't play what she wanted to play. Since she was the youngest, our parents forced us to go along with her.

I hoped going to college would fix her since she'd be away from her parents, but she only got into community college and lived at home. I REALLY hoped transferring to an actual college with give her a chance to grow up, but then then COVID so now she's doing year 3 STILL at home.

Anyways my aunt recently called us saying that she was upset and claiming to be cyberbullied. Our parents aren't super good with technology so all they know are horror stories about cyberbullying victims. So they asked me (since I'm closest in age to her) to talk to her and figure out what's happening.

Turns out she made a post about how white people who cosplay Asian characters are racist and perpetuating yellowface and they need to stop. And she topped it all off by pulling pictures of random white cosplayers and calling them out.

This post got traction and a bunch of people started pointing out how this was incorrect and in general disagreeing with her. She immediately accused everyone who disagreed with her as racist and she was Chinese so she had final say. Then Chinese people from Asia disagreed with her, and she started talking about how they don't count because they aren't Chinese-Americans and don't have to experience life as a minority. And then other Chinese-Americans disagreed with her, and she started talking about how this was her personal feelings so there.

I was like, ok so where's the bullying? And there wasn't. It was literally people just commenting, telling her she's, wrong, or messaging her and telling her she's wrong. Some with varying levels of civility.

But apparently she was so distressed by people *disagreeing* with her she locked her account to followers only and made this dramatic post about how she's taking a break to protect her mental health.

I flat out told her she wasn't being cyberbullied. Her mental health problems come from experiencing shame and embarrassment for the first time in her life. And that she should just stop doubling down, remove her post, apologize for being wrong, and this will all blow over in 2 weeks.

And of course she screamed at me, hung up, and my aunt was like WTF. I tried explaining to her but she didn't get it, and just told me I should've just gone along with it like when we were kids. And of course my parents are mad at me because I was supposed to make her feel better, not worse.

Edit: No they were not using yellow makeup or eye tape. Literally, if a white person dressed up as an Asian character, it was yellowface.",7310,518,2020-12-29 09:45:40,https://www.reddit.com/r/AmItheAsshole/comments/kmbe0w/aita_for_telling_my_cousin_she_wasnt_being/,[],[],False
gn79gx,Showerthoughts,You can't cyberbully the Amish,,20325,361,2020-05-20 08:01:36,https://www.reddit.com/r/Showerthoughts/comments/gn79gx/you_cant_cyberbully_the_amish/,[],[],False
